alias_address,alias_city,data_prelievo,geocode,geometry,georeferencingString,type
Ufficio Cantina Tiefenbrunner / Büro Kellerei Tiefenbrunner,CORTACCIA SULLA STRADA DEL VINO/KURTATSCH AN DER WEINSTRASSE,04/11/2018,"Tiefenbrunner, 4, Schloßweg - Via Castello, Turmhof, Entiklar - Niclara, Kurtatsch an der Weinstraße - Cortaccia sulla Strada del Vino, Überetsch-Unterland - Oltradige-Bassa Atesina, Bolzano - Bozen, Trentino-Alto Adige/Südtirol, 39040, Italia",,CORTACCIA SULLA STRADA DEL VINO Tiefenbrunner,POINT
Fontana pubblica vicino Despar / Öffentlicher Brunnen neben Despar,APPIANO SULLA STRADA DEL VINO/EPPAN AN DER WEINSTRASSE,13/11/2018,"Despar, 19b, St.-Martin-Straße - Via San Martino, Girlan - Cornaiano, Eppan an der Weinstraße - Appiano sulla Strada del Vino, Überetsch-Unterland - Oltradige-Bassa Atesina, Bolzano - Bozen, Trentino-Alto Adige/Südtirol, 39057, Italia",,APPIANO SULLA STRADA DEL VINO   Despar,POINT
Outlet Center Brennero / Outlet Center Brenner,BRENNERO/BRENNER,13/11/2018,"Outlet Center Brenner, 9A, Valentinstraße - Via San Valentino, Brennerbad - Terme di Brennero, Brenner - Brennero, Wipptal - Alta Vall'Isarco, Bolzano - Bozen, Trentino-Alto Adige/Südtirol, 39041, Italia",,BRENNERO Outlet Center Brennero,POINT
Ehrenburgerhof Lido / Ehrenburgerhof Lido,CHIENES/KIENS,14/03/2018,"Falkensteiner Family Hotel Lido Ehrenburgerhof, 7, Via Stazione - Bahnhofstraße, Untergols, Ehrenburg, Kiens - Chienes, Pustertal - Val Pusteria, Bolzano - Bozen, Trentino-Alto Adige/Südtirol, 39030, Italia",,CHIENES Ehrenburgerhof Lido,POINT
Centro visite / Naturparkhaus,MAREBBE/ENNEBERG,09/11/2018,"Naturparkhaus, 96, Strada Catarina Lanz, Runcac, Marèo - Enneberg - Marebbe, Pustertal - Val Pusteria, Bolzano - Bozen, Trentino-Alto Adige/Südtirol, 39030, Italia",,MAREBBE Centro visite,POINT
Fontana / Brunnen,SAN CANDIDO/INNICHEN,05/08/2018,"Fontana Salsa, SP590, Garoppi, Mombello Monferrato, Alessandria, Piemonte, 15020, Italia",,SAN CANDIDO Fontana,POINT
f.p. centro / Öffentlicher Brunnen Zentrum,ULTIMO/ULTEN,02/07/2018,"El Último, 32, Calle del Marqués de Santa Ana, Universidad, Centro, Madrid, Área metropolitana de Madrid y Corredor del Henares, Comunidad de Madrid, 28004, España",,ULTIMO f.p. centro,POINT
Hotel Markus  /  Hotel Markus,VALLE AURINA/AHRNTAL,04/09/2018,"Hotel Markus, 10, Sankt Jakob - San Giacomo, Ahrntal - Valle Aurina, Pustertal - Val Pusteria, Bolzano - Bozen, Trentino-Alto Adige/Südtirol, 39030, Italia",,VALLE AURINA Hotel Markus,POINT
Bar Graf / Bar Graf,VALLE DI CASIES/GSIES,22/11/2018,"Ristirante Bar Graf, 1/A, Via Casies - Gsieser Straße, Innerpichl, Gsies - Valle di Casies, Pustertal - Val Pusteria, Bolzano - Bozen, Trentino-Alto Adige/Südtirol, 39030, Italia",,VALLE DI CASIES Bar Graf,POINT
Albergo Brugger / Gasthof Brugger; WH WC,VANDOIES/VINTL,10/09/2018,"Gasthof Brugger - Albergo Brugger, 12, Lärchstraße, Scheiper, Pfunders, Vintl - Vandoies, Pustertal - Val Pusteria, Bolzano - Bozen, Trentino-Alto Adige/Südtirol, 39030, Italia",,VANDOIES Albergo Brugger,POINT
f.p. caserma dei VVFF / öffentl. Brunnen bei der Feuerwehrhalle,CAINES/KUENS,10/10/2018,"Kuens - Caines, Burggrafenamt - Burgraviato, Bolzano - Bozen, Trentino-Alto Adige/Südtirol, Italia","{'type': 'Point', 'coordinates': [11.1694866, 46.6994802]}",CAINES,POINT
Ditta Finstral zona industriale / Fa. Finstral Industriezone,CORTACCIA SULLA STRADA DEL VINO/KURTATSCH AN DER WEINSTRASSE,16/05/2018,"Industriezone Kurtatsch Etschweg - Zona Industriale Cortaccia, Breitbach - Rio Largo, Kurtatsch an der Weinstraße - Cortaccia sulla Strada del Vino, Überetsch-Unterland - Oltradige-Bassa Atesina, Bolzano - Bozen, Trentino-Alto Adige/Südtirol, 39040, Italia","{'type': 'Point', 'coordinates': [11.238673053145405, 46.293547700000005]}",CORTACCIA SULLA STRADA DEL VINO zona industriale,POINT
F. p. Weg K. von Fenner / Öff. Brunnen Weg K. von Fenner,CORTACCIA SULLA STRADA DEL VINO/KURTATSCH AN DER WEINSTRASSE,04/05/2018,"Franz von Fenner Weg - Via Franz von Fenner, Entiklar - Niclara, Kurtatsch an der Weinstraße - Cortaccia sulla Strada del Vino, Überetsch-Unterland - Oltradige-Bassa Atesina, Bolzano - Bozen, Trentino-Alto Adige/Südtirol, 39040, Italia","{'type': 'Point', 'coordinates': [11.2111763, 46.3033049]}",CORTACCIA SULLA STRADA DEL VINO von Fenner,POINT
Fontana pubblica Platzl / Öffentlicher Brunnen Platzl,CORTACCIA SULLA STRADA DEL VINO/KURTATSCH AN DER WEINSTRASSE,09/03/2018,"Kurtatsch an der Weinstraße - Cortaccia sulla Strada del Vino, Überetsch-Unterland - Oltradige-Bassa Atesina, Bolzano - Bozen, Trentino-Alto Adige/Südtirol, Italia","{'type': 'Point', 'coordinates': [11.2235011, 46.3134726]}",CORTACCIA SULLA STRADA DEL VINO,POINT
Fontana pubblica piazza H.M.Schweiggl / Ö.B. Hauptmann Schweigglplatz,CORTACCIA SULLA STRADA DEL VINO/KURTATSCH AN DER WEINSTRASSE,14/03/2018,"Hauptmann-Schweiggl-Platz - Piazza Hauptmann Schweiggl, Breitbach - Rio Largo, Kurtatsch an der Weinstraße - Cortaccia sulla Strada del Vino, Überetsch-Unterland - Oltradige-Bassa Atesina, Bolzano - Bozen, Trentino-Alto Adige/Südtirol, 39040, Italia","{'type': 'Point', 'coordinates': [11.2235121, 46.3136123]}",CORTACCIA SULLA STRADA DEL VINO  Schweiggl,POINT
Fontana pubblica vicino albergo Goldener Adler / Öffentlicher Brunnen neben Gasthaus Adler,CORTACCIA SULLA STRADA DEL VINO/KURTATSCH AN DER WEINSTRASSE,16/07/2018,"Gasthof Goldener Adler, Indermauer-Straße - Via Indermauer, Graun - Corona, Kurtatsch an der Weinstraße - Cortaccia sulla Strada del Vino, Überetsch-Unterland - Oltradige-Bassa Atesina, Bolzano - Bozen, Trentino-Alto Adige/Südtirol, 39040, Italia","{'type': 'Point', 'coordinates': [11.2159107, 46.3225829]}",CORTACCIA SULLA STRADA DEL VINO Goldener Adler,POINT
Öffentlicher Brunnen Kirchplatz Penon / Öffentlicher Brunnen Kirchplatz Penon,CORTACCIA SULLA STRADA DEL VINO/KURTATSCH AN DER WEINSTRASSE,10/01/2018,"Penon - Penone, Kurtatsch an der Weinstraße - Cortaccia sulla Strada del Vino, Überetsch-Unterland - Oltradige-Bassa Atesina, Bolzano - Bozen, Trentino-Alto Adige/Südtirol, Italia","{'type': 'Point', 'coordinates': [11.2009346, 46.3031618]}",CORTACCIA SULLA STRADA DEL VINO Penon,POINT
WC - municipio / WC - Gemeinde,GARGAZZONE/GARGAZON,12/06/2018,"Gargazon - Gargazzone, Burggrafenamt - Burgraviato, Bolzano - Bozen, Trentino-Alto Adige/Südtirol, Italia","{'type': 'Point', 'coordinates': [11.2027298, 46.5847807]}",GARGAZZONE,POINT
f.p. centro / Öffentlicher Brunnen Zentrum,GARGAZZONE/GARGAZON,16/08/2018,"Gargazon - Gargazzone, Burggrafenamt - Burgraviato, Bolzano - Bozen, Trentino-Alto Adige/Südtirol, Italia","{'type': 'Point', 'coordinates': [11.2027298, 46.5847807]}",GARGAZZONE,POINT
"Fontana pubbl. via Schwanburg/Öff. Brunnen, Schwanburgerstr.",NALLES/NALS,20/03/2018,"Schwanburgerstraße - Via Schwanburg, Nals - Nalles, Burggrafenamt - Burgraviato, Bolzano - Bozen, Trentino-Alto Adige/Südtirol, 39010, Italia","{'type': 'Point', 'coordinates': [11.2053775, 46.5418507]}",NALLES via Schwanburg,POINT
fontana pubb. municipio nuovo / Brunnen Rathausplatz neu,NALLES/NALS,03/06/2018,"Nals - Nalles, Burggrafenamt - Burgraviato, Bolzano - Bozen, Trentino-Alto Adige/Südtirol, Italia","{'type': 'Point', 'coordinates': [11.2046272, 46.5434871]}",NALLES,POINT
Uffici comunali Ponte Gardena / Gemeindeamt Waidbruck,PONTE GARDENA/WAIDBRUCK,05/07/2018,"Waidbruck - Ponte Gardena, Eisacktal - Valle Isarco, Bolzano - Bozen, Trentino-Alto Adige/Südtirol, Italia","{'type': 'Point', 'coordinates': [11.530879, 46.597121]}",PONTE GARDENA,POINT
f.p. sopra la biblioteca pubblica / Öffentlicher Brunnen oberhalb der öffentlichen Bibliothek,RIFIANO/RIFFIAN,06/12/2018,"Riffian - Rifiano, Burggrafenamt - Burgraviato, Bolzano - Bozen, Trentino-Alto Adige/Südtirol, Italia","{'type': 'Point', 'coordinates': [11.1814431, 46.7036399]}",RIFIANO,POINT
Fontana pubblica vicino alla ex scuola / öff. Brunnen neben ex Schule,SALORNO/SALURN,10/09/2018,"Salorno - Salurn, Überetsch-Unterland - Oltradige-Bassa Atesina, Bolzano - Bozen, Trentino-Alto Adige/Südtirol, Italia","{'type': 'Point', 'coordinates': [11.2110749, 46.2396083]}",SALORNO,POINT
fontana pubblica via Trento / öff. Brunnen Trientstr.,SALORNO/SALURN,07/05/2018,"Via Trento - Trientstraße, Salorno - Salurn, Überetsch-Unterland - Oltradige-Bassa Atesina, Bolzano - Bozen, Trentino-Alto Adige/Südtirol, 39040, Italia","{'type': 'Point', 'coordinates': [11.2074863, 46.2375369]}",SALORNO via Trento,POINT
fontana pubblica via Valfredda / öff. Brunnen - Kaltentalstr.,SALORNO/SALURN,09/11/2018,"Via Valfredda - Kaltentalstraße, Salorno - Salurn, Überetsch-Unterland - Oltradige-Bassa Atesina, Bolzano - Bozen, Trentino-Alto Adige/Südtirol, 39040, Italia","{'type': 'Point', 'coordinates': [11.2149734, 46.2385004]}",SALORNO via Valfredda,POINT
Fontana pubblica presso Municipio / Öffentlicher Brunnen neben Gemeinde,SAN GENESIO ATESINO/JENESIEN,09/11/2018,"Jenesien - San Genesio Atesino, Salten-Schlern - Salto-Sciliar, Bolzano - Bozen, Trentino-Alto Adige/Südtirol, Italia","{'type': 'Point', 'coordinates': [11.3312082, 46.5354011]}",SAN GENESIO ATESINO,POINT
"f.p. centro / Öffentlicher Brunnen, Zentrum",SAN MARTINO IN PASSIRIA/ST. MARTIN IN PASSEIER,04/05/2018,"St. Martin in Passeier - San Martino in Passiria, Burggrafenamt - Burgraviato, Bolzano - Bozen, Trentino-Alto Adige/Südtirol, Italia","{'type': 'Point', 'coordinates': [11.2267986, 46.7839388]}",SAN MARTINO IN PASSIRIA,POINT
"f.p. centro / Öffentlicher Brunnen, Zentrum",SAN PANCRAZIO/ST. PANKRAZ,02/07/2018,,,SAN PANCRAZIO ALTO ADIGE,POINT
Bar Tennis / Bar Tennis,TERMENO SULLA STRADA DEL VINO/TRAMIN AN DER WEINSTRASSE,16/10/2018,"Tramin an der Weinstraße - Termeno sulla Strada del Vino, Überetsch-Unterland - Oltradige-Bassa Atesina, Bolzano - Bozen, Trentino-Alto Adige/Südtirol, Italia","{'type': 'Point', 'coordinates': [11.2422716, 46.3415121]}",TERMENO SULLA STRADA DEL VINO,POINT
"fontana pubbl. Viertl Graun / Öffentl. Brunnen, Viertl Graun",TERMENO SULLA STRADA DEL VINO/TRAMIN AN DER WEINSTRASSE,09/11/2018,"Tramin an der Weinstraße - Termeno sulla Strada del Vino, Überetsch-Unterland - Oltradige-Bassa Atesina, Bolzano - Bozen, Trentino-Alto Adige/Südtirol, Italia","{'type': 'Point', 'coordinates': [11.2422716, 46.3415121]}",TERMENO SULLA STRADA DEL VINO,POINT
f.p. presso il municipio / Öffentl. Brunnen bei Gemeinde,TESIMO/TISENS,04/11/2018,"Tisens - Tesimo, Burggrafenamt - Burgraviato, Bolzano - Bozen, Trentino-Alto Adige/Südtirol, Italia","{'type': 'Point', 'coordinates': [11.1694971, 46.5638983]}",TESIMO,POINT
Fontana pubblica presso Ufficio postale / Öffentlicher Brunnen gegenüber Postamt,TIRES/TIERS,23/05/2018,"Tiers - Tires, Salten-Schlern - Salto-Sciliar, Bolzano - Bozen, Trentino-Alto Adige/Südtirol, Italia","{'type': 'Point', 'coordinates': [11.5276758, 46.4683162]}",TIRES,POINT
"Bar Tennis, Monticolo paese / Bar Tennis, Montiggl Dorf",APPIANO SULLA STRADA DEL VINO/EPPAN AN DER WEINSTRASSE,13/11/2018,"Montiggl - Monticolo, Eppan an der Weinstraße - Appiano sulla Strada del Vino, Überetsch-Unterland - Oltradige-Bassa Atesina, Bolzano - Bozen, Trentino-Alto Adige/Südtirol, Italia","{'type': 'Point', 'coordinates': [11.2771256, 46.417726]}",APPIANO SULLA STRADA DEL VINO Monticolo,POINT
Castel Masaccio / Schlössl Matschatsch,APPIANO SULLA STRADA DEL VINO/EPPAN AN DER WEINSTRASSE,18/06/2018,"Matschatscher Weg - Strada Masaccio, Berg - Monte, Eppan an der Weinstraße - Appiano sulla Strada del Vino, Überetsch-Unterland - Oltradige-Bassa Atesina, Bolzano - Bozen, Trentino-Alto Adige/Südtirol, 39057, Italia","{'type': 'Point', 'coordinates': [11.2443592, 46.4598891]}",APPIANO SULLA STRADA DEL VINO Masaccio,POINT
GH Sonnenheim / GH Sonnenheim,AVELENGO/HAFLING,13/03/2018,"Hotel Sonnenheim, 63, Falzebenerstraße - Via Falzeben, Hafling - Avelengo, Burggrafenamt - Burgraviato, Bolzano - Bozen, Trentino-Alto Adige/Südtirol, 39010, Italia","{'type': 'Point', 'coordinates': [11.220735383450151, 46.653170349999996]}",AVELENGO Sonnenheim,POINT
WC comune / WC Gemeinde,AVELENGO/HAFLING,13/03/2018,"Hafling - Avelengo, Burggrafenamt - Burgraviato, Bolzano - Bozen, Trentino-Alto Adige/Südtirol, Italia","{'type': 'Point', 'coordinates': [11.224384, 46.644615]}",AVELENGO,POINT
Associazione turistica / Tourismusverein,BADIA/ABTEI,04/04/2018,"Badia - Abtei, Pustertal - Val Pusteria, Bolzano - Bozen, Trentino-Alto Adige/Südtirol, 39036, Italia","{'type': 'Point', 'coordinates': [11.893487, 46.610124]}",BADIA,POINT
Brunnen Scolina  /  Brunnen Scolina,BADIA/ABTEI,06/11/2018,"Badia - Abtei, Pustertal - Val Pusteria, Bolzano - Bozen, Trentino-Alto Adige/Südtirol, 39036, Italia","{'type': 'Point', 'coordinates': [11.893487, 46.610124]}",BADIA,POINT
Caserma VF / FF Halle,BADIA/ABTEI,17/09/2018,"Badia - Abtei, Pustertal - Val Pusteria, Bolzano - Bozen, Trentino-Alto Adige/Südtirol, 39036, Italia","{'type': 'Point', 'coordinates': [11.893487, 46.610124]}",BADIA,POINT
Fontana Municipio / Brunnen Rathaus,BADIA/ABTEI,06/11/2018,"Chemun - Gemeinde - Municipio, Strada Col Alt, Burjé, Corvara in Badia - Corvara, Pustertal - Val Pusteria, Bolzano - Bozen, Trentino-Alto Adige/Südtirol, 39033, Italia","{'type': 'Point', 'coordinates': [11.8745845, 46.5495617]}",BADIA Municipio,POINT
"Albergo Kalter Keller, Via Brennero 10 / Gasthof Kalter Keller, Brennerstr. 10",BARBIANO/BARBIAN,05/03/2018,"Brennerstraße - Via Brennero, Barbian - Barbiano, Eisacktal - Valle Isarco, Bolzano - Bozen, Trentino-Alto Adige/Südtirol, 39040, Italia","{'type': 'Point', 'coordinates': [11.5288349, 46.5957976]}",BARBIANO Via Brennero,POINT
"Colma, Albergo Stern, Via Kunter 1 / Kollmann, Gasthof Stern, Am Kuntersweg 1; WH Bar",BARBIANO/BARBIAN,05/03/2018,"Am Kuntersweg - Via Kunter, Barbian - Barbiano, Eisacktal - Valle Isarco, Bolzano - Bozen, Trentino-Alto Adige/Südtirol, 39040, Italia","{'type': 'Point', 'coordinates': [11.5228953, 46.5854955]}",BARBIANO Via Kunter,POINT
Fa. Hofer Fliesen und Böden GmbH - Handwerkerzone 4  /  Fa. Hofer Fliesen und Böden GmbH - Handwerkerzone 4  - WH WC,BARBIANO/BARBIAN,05/03/2018,"Handwerkerzone Barbian - Zona artigianale Barbiano, Barbian - Barbiano, Eisacktal - Valle Isarco, Bolzano - Bozen, Trentino-Alto Adige/Südtirol, 39040, Italia","{'type': 'Point', 'coordinates': [11.53169992277843, 46.605701749999994]}",BARBIANO Handwerkerzone,POINT
"Scuola dell'infanzia Colma, S. Leonardo 26 / Kindergarten Kollmann, St. Leonhard 26 - WH WC",BARBIANO/BARBIAN,16/10/2018,"St. Leonhard - San Leonardo, Barbian - Barbiano, Eisacktal - Valle Isarco, Bolzano - Bozen, Trentino-Alto Adige/Südtirol, 39040, Italia","{'type': 'Point', 'coordinates': [11.5240264, 46.5920025]}",BARBIANO San Leonardo,POINT
"Scuola dell'infanzia Colma, S. Leonardo 26 / Kindergarten Kollmann, St. Leonhard 26; WH WC",BARBIANO/BARBIAN,05/03/2018,"St. Leonhard - San Leonardo, Barbian - Barbiano, Eisacktal - Valle Isarco, Bolzano - Bozen, Trentino-Alto Adige/Südtirol, 39040, Italia","{'type': 'Point', 'coordinates': [11.5240264, 46.5920025]}",BARBIANO San Leonardo,POINT
Casa di riposo Clara / Altersheim Clara,CORNEDO ALL'ISARCO/KARNEID,21/11/2018,"Karneid - Cornedo all'Isarco, Salten-Schlern - Salto-Sciliar, Bolzano - Bozen, Trentino-Alto Adige/Südtirol, Italia","{'type': 'Point', 'coordinates': [11.4080724, 46.4898543]}",CORNEDO ALL'ISARCO,POINT
Fontana cimitero / Brunnen Friedhof,CORNEDO ALL'ISARCO/KARNEID,04/05/2018,"Karneid - Cornedo all'Isarco, Salten-Schlern - Salto-Sciliar, Bolzano - Bozen, Trentino-Alto Adige/Südtirol, Italia","{'type': 'Point', 'coordinates': [11.4080724, 46.4898543]}",CORNEDO ALL'ISARCO,POINT
Fontana cimitero Collepietra / Brunnen Friedhof Steinegg,CORNEDO ALL'ISARCO/KARNEID,07/12/2018,"Steinegg - Collepietra, Salten-Schlern - Salto-Sciliar, Bolzano - Bozen, Trentino-Alto Adige/Südtirol, 39053, Italia","{'type': 'Point', 'coordinates': [11.4563044, 46.483944]}",CORNEDO ALL'ISARCO Collepietra,POINT
Gummer - Scuole elementari M. Pichler / Gummer - Grundschule M. Pichler,CORNEDO ALL'ISARCO/KARNEID,27/02/2018,"Grundschule und Kindergarten, Gummer Dorf - Via San Valentino in Campo Paese, Oberwieser, Karneid - Cornedo all'Isarco, Salten-Schlern - Salto-Sciliar, Bolzano - Bozen, Trentino-Alto Adige/Südtirol, 39053, Italia","{'type': 'Point', 'coordinates': [11.474949631066522, 46.43868055]}",CORNEDO ALL'ISARCO Gummer - Scuole,POINT
Azienda turistica / Tourismusverein,CORVARA IN BADIA/CORVARA,04/04/2018,"Corvara in Badia - Corvara, Pustertal - Val Pusteria, Bolzano - Bozen, Trentino-Alto Adige/Südtirol, Italia","{'type': 'Point', 'coordinates': [11.855975823158872, 46.5517403]}",CORVARA IN BADIA,POINT
Brunnen Friedhof,CORVARA IN BADIA/CORVARA,17/09/2018,"Strada Pedecorvara, la flu, Corvara in Badia - Corvara, Pustertal - Val Pusteria, Bolzano - Bozen, Trentino-Alto Adige/Südtirol, 39033, Italia","{'type': 'Point', 'coordinates': [11.8777251, 46.5477018]}",CORVARA IN BADIA Friedhof,POINT
Fontana chiesa / Brunnen Kirche,MONGUELFO - TESIDO/WELSBERG - TAISTEN,17/09/2018,"Welsberg-Taisten - Monguelfo-Tesido, Pustertal - Val Pusteria, Bolzano - Bozen, Trentino-Alto Adige/Südtirol, 39035, Italia","{'type': 'Point', 'coordinates': [12.118921771523121, 46.78114465]}",MONGUELFO - TESIDO,POINT
Municipio / Rathaus,MONGUELFO - TESIDO/WELSBERG - TAISTEN,14/02/2018,"Welsberg-Taisten - Monguelfo-Tesido, Pustertal - Val Pusteria, Bolzano - Bozen, Trentino-Alto Adige/Südtirol, 39035, Italia","{'type': 'Point', 'coordinates': [12.118921771523121, 46.78114465]}",MONGUELFO - TESIDO,POINT
Reservoir (Einlauf) bei Schneebergbrücke / Reservoir (Einlauf) bei Schneebergbrücke,MOSO DI PASSIRIA /MOOS IN PASSEIER,13/11/2018,"Moos in Passeier - Moso in Passiria, Burggrafenamt - Burgraviato, Bolzano - Bozen, Trentino-Alto Adige/Südtirol, 39013, Italia","{'type': 'Point', 'coordinates': [11.1672933, 46.8318323]}",MOSO DI PASSIRIA,POINT
Scuola elementare Corvara / Grundschule Rabenstein,MOSO DI PASSIRIA /MOOS IN PASSEIER,06/04/2018,"Volksschule - Scuola elementare, Pill - Bovile, Weierhof, Mitterpill, Moos in Passeier - Moso in Passiria, Burggrafenamt - Burgraviato, Bolzano - Bozen, Trentino-Alto Adige/Südtirol, 39013, Italia","{'type': 'Point', 'coordinates': [11.15029254442048, 46.8237942]}",MOSO DI PASSIRIA  Scuola,POINT
"f.p. centro / Öffentlicher Brunnen, Zentrum",MOSO DI PASSIRIA /MOOS IN PASSEIER,06/04/2018,"Moos in Passeier - Moso in Passiria, Burggrafenamt - Burgraviato, Bolzano - Bozen, Trentino-Alto Adige/Südtirol, 39013, Italia","{'type': 'Point', 'coordinates': [11.1672933, 46.8318323]}",MOSO DI PASSIRIA,POINT
f.p. presso la chiesa di Stulles / Ö.B. bei der Kirche in Stuls,MOSO DI PASSIRIA /MOOS IN PASSEIER,08/09/2018,"Stuls - Stulles, Burggrafenamt - Burgraviato, Bolzano - Bozen, Trentino-Alto Adige/Südtirol, 39013, Italia","{'type': 'Point', 'coordinates': [11.1966805, 46.8284354]}",MOSO DI PASSIRIA  Stulles,POINT
Fontana pubblica presso Municipio / Öffentlicher Brunnen vor Rathaus,NOVA PONENTE/DEUTSCHNOFEN,09/04/2018,"Rathaus Deutschnofen - Municipio di Nova Ponente, Schloß Thurn Straße - Via Castello Thurn, Maria Weißenstein - Pietralba, Deutschnofen - Nova Ponente, Salten-Schlern - Salto-Sciliar, Bolzano - Bozen, Trentino-Alto Adige/Südtirol, 39050, Italia","{'type': 'Point', 'coordinates': [11.4256042, 46.4144111]}",NOVA PONENTE  Municipio,POINT
Cimitero / Friedhofbrunnen,ALDINO/ALDEIN,07/03/2018,"Aldein - Aldino, Überetsch-Unterland - Oltradige-Bassa Atesina, Bolzano - Bozen, Trentino-Alto Adige/Südtirol, Italia","{'type': 'Point', 'coordinates': [11.3541164, 46.3681742]}",ALDINO Alto Adige,POINT
Fontana pubblica Kirchplatz / Öffentlicher Brunnen Kirchplatz,ALDINO/ALDEIN,07/02/2018,"Aldein - Aldino, Überetsch-Unterland - Oltradige-Bassa Atesina, Bolzano - Bozen, Trentino-Alto Adige/Südtirol, Italia","{'type': 'Point', 'coordinates': [11.3541164, 46.3681742]}",ALDINO,POINT
Hotel Schwarzhorn rubinetto cucina / Hotel Schwarzhorn Wasserhahn Küche,ALDINO/ALDEIN,13/09/2018,"Hotel Schwarzhorn, S - Schwarzhorn - Corno Nero, Ville di Fiemme, Comunità territoriale della Val di Fiemme, Bolzano - Bozen, Trentino-Alto Adige/Südtirol, 39040, Italia","{'type': 'Point', 'coordinates': [11.45294000711365, 46.34647495]}",ALDINO Hotel Schwarzhorn,POINT
Municipio / Rathaus,ALDINO/ALDEIN,28/03/2018,"Municipio di Aldino - Rathaus Aldein, Dorf - Paese, Holen - Olmi, Aldein - Aldino, Überetsch-Unterland - Oltradige-Bassa Atesina, Bolzano - Bozen, Trentino-Alto Adige/Südtirol, 39040, Italia","{'type': 'Point', 'coordinates': [11.3541397, 46.3677412]}",ALDINO Municipio,POINT
Scuola elementare Holen / Grundschule Holen,ALDINO/ALDEIN,07/12/2018,"Grundschule Aldein - Scuola Elementare in lingua tedesca di Aldino, Baderweg - Via Bader, Holen - Olmi, Aldein - Aldino, Überetsch-Unterland - Oltradige-Bassa Atesina, Bolzano - Bozen, Trentino-Alto Adige/Südtirol, 39040, Italia","{'type': 'Point', 'coordinates': [11.3540439, 46.3663617]}",ALDINO Scuola elementare Holen,POINT
"Scuola elementare Oberradein / Grundschule, Oberradein",ALDINO/ALDEIN,13/03/2018,"Grundschule Aldein - Scuola Elementare in lingua tedesca di Aldino, Baderweg - Via Bader, Holen - Olmi, Aldein - Aldino, Überetsch-Unterland - Oltradige-Bassa Atesina, Bolzano - Bozen, Trentino-Alto Adige/Südtirol, 39040, Italia","{'type': 'Point', 'coordinates': [11.3540439, 46.3663617]}",ALDINO Scuola elementare,POINT
Fontana Pubblica piazza paese / Öffentlicher Brunnen Dorfplatz,ANDRIANO/ANDRIAN,07/04/2018,"Andrian - Andriano, Überetsch-Unterland - Oltradige-Bassa Atesina, Bolzano - Bozen, Trentino-Alto Adige/Südtirol, Italia","{'type': 'Point', 'coordinates': [11.231373, 46.5176161]}",ANDRIANO,POINT
Municipio / Rathaus,ANDRIANO/ANDRIAN,14/11/2018,"Rathaus - Municipio, Wehrburgstraße - Via Wehrburg, Andrian - Andriano, Überetsch-Unterland - Oltradige-Bassa Atesina, Bolzano - Bozen, Trentino-Alto Adige/Südtirol, 39010, Italia","{'type': 'Point', 'coordinates': [11.2327731, 46.5200872]}",ANDRIANO Municipio,POINT
Comune / Rathaus,ANTERIVO/ALTREI,29/11/2018,"Anterivo - Altrei, Überetsch-Unterland - Oltradige-Bassa Atesina, Bolzano - Bozen, Trentino-Alto Adige/Südtirol, Italia","{'type': 'Point', 'coordinates': [11.367961064571444, 46.279746700000004]}",ANTERIVO,POINT
Fontana pubblica centro paese / Öffentlicher Brunnen Dorfplatz,ANTERIVO/ALTREI,09/04/2018,"Anterivo - Altrei, Überetsch-Unterland - Oltradige-Bassa Atesina, Bolzano - Bozen, Trentino-Alto Adige/Südtirol, Italia","{'type': 'Point', 'coordinates': [11.367961064571444, 46.279746700000004]}",ANTERIVO,POINT
Asilo di lingua italiana / Italienischer Kindergarten,APPIANO SULLA STRADA DEL VINO/EPPAN AN DER WEINSTRASSE,02/07/2018,"Kindergarten ""Untere Gand"", Lambrechtsweg - Via Lambrecht, Untere Gand - Ganda di Sotto, St. Michael - San Michele, Eppan an der Weinstraße - Appiano sulla Strada del Vino, Überetsch-Unterland - Oltradige-Bassa Atesina, Bolzano - Bozen, Trentino-Alto Adige/Südtirol, 39057, Italia","{'type': 'Point', 'coordinates': [11.2574958, 46.4461539]}",APPIANO SULLA STRADA DEL VINO Asilo,POINT
Fontana pubblica P.zza San Michele / Öffentlicher Brunnen St.-Michael-Platz,APPIANO SULLA STRADA DEL VINO/EPPAN AN DER WEINSTRASSE,11/08/2018,"St.-Michael-Platz - Piazza San Michele, St. Michael (Eppan) - San Michele (Appiano), St. Michael - San Michele, Eppan an der Weinstraße - Appiano sulla Strada del Vino, Überetsch-Unterland - Oltradige-Bassa Atesina, Bolzano - Bozen, Trentino-Alto Adige/Südtirol, 39057, Italia","{'type': 'Point', 'coordinates': [11.2574994, 46.4567931]}",APPIANO SULLA STRADA DEL VINO  P.zza San Michele,POINT
Fontana pubblica Riva di sotto / öffentliche Brunnen Unterrain,APPIANO SULLA STRADA DEL VINO/EPPAN AN DER WEINSTRASSE,22/05/2018,"Unterrain - Riva di Sotto, Eppan an der Weinstraße - Appiano sulla Strada del Vino, Überetsch-Unterland - Oltradige-Bassa Atesina, Bolzano - Bozen, Trentino-Alto Adige/Südtirol, Italia","{'type': 'Point', 'coordinates': [11.2591427, 46.4917035]}",APPIANO SULLA STRADA DEL VINO  Riva di sotto,POINT
Fontana pubblica Via della Fiera / Öffentlicher Brunnen Marktstrasse,APPIANO SULLA STRADA DEL VINO/EPPAN AN DER WEINSTRASSE,13/11/2018,"Marktstraße - Via della Fiera, Girlan - Cornaiano, Eppan an der Weinstraße - Appiano sulla Strada del Vino, Überetsch-Unterland - Oltradige-Bassa Atesina, Bolzano - Bozen, Trentino-Alto Adige/Südtirol, 39057, Italia","{'type': 'Point', 'coordinates': [11.2800451, 46.4609587]}",APPIANO SULLA STRADA DEL VINO  Via della Fiera,POINT
Fontana pubblica davanti Unterhausenhof / Öffentl. Brunnen vor Unterhausenhof,APPIANO SULLA STRADA DEL VINO/EPPAN AN DER WEINSTRASSE,16/04/2018,"Eppan an der Weinstraße - Appiano sulla Strada del Vino, Überetsch-Unterland - Oltradige-Bassa Atesina, Bolzano - Bozen, Trentino-Alto Adige/Südtirol, 39057, Italia","{'type': 'Point', 'coordinates': [11.2590488, 46.4553328]}",APPIANO SULLA STRADA DEL VINO,POINT
"Fontana pubblica vicino Brennerhof, Frangarto / Öffentlicher Brunnen neben Brennerhof, Frangart",APPIANO SULLA STRADA DEL VINO/EPPAN AN DER WEINSTRASSE,16/04/2018,"Frangart - Frangarto, Eppan an der Weinstraße - Appiano sulla Strada del Vino, Überetsch-Unterland - Oltradige-Bassa Atesina, Bolzano - Bozen, Trentino-Alto Adige/Südtirol, Italia","{'type': 'Point', 'coordinates': [11.28521232569054, 46.48255685]}","APPIANO SULLA STRADA DEL VINO   , Frangarto",POINT
Fontana pubblica vicino chiesa  /  Öffentl. Brunnen neben Kirche,APPIANO SULLA STRADA DEL VINO/EPPAN AN DER WEINSTRASSE,04/03/2018,"Eppan an der Weinstraße - Appiano sulla Strada del Vino, Überetsch-Unterland - Oltradige-Bassa Atesina, Bolzano - Bozen, Trentino-Alto Adige/Südtirol, 39057, Italia","{'type': 'Point', 'coordinates': [11.2590488, 46.4553328]}",APPIANO SULLA STRADA DEL VINO,POINT
