alias_address,alias_city,data_prelievo,geocode,geometry,georeferencingString,type
"Ristorante Plose-Stodl, via della Funivia, 15/Restaurant Plose-Stodl, Seilbahnstr. 15; WH Bar",BRESSANONE/BRIXEN,23/08/2018,,,"BRESSANONE Ristorante Plose-Stodl, via della Funivia, 15",POINT
"Scuola dell''infanzia S. Andrea, Via Vinzenz Goller 5/A / Kindergarten St.Andrä, Vinzenz Goller Weg 5/A",BRESSANONE/BRIXEN,04/05/2018,,,"BRESSANONE Scuola dell''infanzia S. Andrea, Via Vinzenz Goller 5",POINT
"Scuola dell''infanzia S. Andrea, Via Vinzenz Goller 5/A / Kindergarten St.Andrä, Vinzenz Goller Weg 5/A - WH Küche",BRESSANONE/BRIXEN,10/10/2018,,,"BRESSANONE Scuola dell''infanzia S. Andrea, Via Vinzenz Goller 5",POINT
"Scuola dell''infanzia S. Andrea, Via Vinzenz Goller 5/A / Kindergarten St.Andrä, Vinzenz Goller Weg 5/A; WH Küche",BRESSANONE/BRIXEN,28/05/2018,,,"BRESSANONE Scuola dell''infanzia S. Andrea, Via Vinzenz Goller 5",POINT
"Scuola dell'infanzia Anna Seidner, Via Kaspar von Kempter 5 / Kindergarten Anna Seidner, Kaspar von Kempterweg 5",BRESSANONE/BRIXEN,09/06/2018,,,"BRESSANONE Scuola dell'infanzia Anna Seidner, Via Kaspar von Kempter 5",POINT
"Scuola dell'infanzia Anna Seidner, Via Kaspar von Kempter 5 / Kindergarten Anna Seidner, Kaspar von Kempterweg 5; WH Küche",BRESSANONE/BRIXEN,05/08/2018,,,"BRESSANONE Scuola dell'infanzia Anna Seidner, Via Kaspar von Kempter 5",POINT
"Scuola dell'infanzia Arcobaleno, Via Wolkenstein 201 / Kindergarten Arcobaleno, Wolkensteinstr. 201 - WH Wäscherei",BRESSANONE/BRIXEN,13/03/2018,,,"BRESSANONE Scuola dell'infanzia Arcobaleno, Via Wolkenstein 201",POINT
"Scuola dell'infanzia Arcobaleno, Via Wolkenstein 201 / Kindergarten Arcobaleno, Wolkensteinstr. 201; WH Wäscherei",BRESSANONE/BRIXEN,26/11/2018,,,"BRESSANONE Scuola dell'infanzia Arcobaleno, Via Wolkenstein 201",POINT
"Scuola elementare Albes, Albes 1 / Grundschule Albeins, Albeins 1; WH WC",BRESSANONE/BRIXEN,22/03/2018,,,"BRESSANONE Scuola elementare Albes, Albes 1",POINT
"Scuola elementare Varna, Via Salern 5 / Grundschule Vahrn, Salernstr. 5 - WH WC",BRESSANONE/BRIXEN,14/03/2018,,,"BRESSANONE Scuola elementare Varna, Via Salern 5",POINT
"Scuola elementare Varna, Via Salern 5 / Grundschule Vahrn, Salernstr. 5; WH WC",BRESSANONE/BRIXEN,26/11/2018,,,"BRESSANONE Scuola elementare Varna, Via Salern 5",POINT
"Südtiroler Kinderdorf, Via Castelliere 28 / Südtiroler Kinderdorf, Burgfrieden 28; WH Kochnische",BRESSANONE/BRIXEN,05/08/2018,,,"BRESSANONE Südtiroler Kinderdorf, Via Castelliere 28",POINT
"The Vista Hotel, Plancios 291B / The Vista Hotel, Palmschoss 291B",BRESSANONE/BRIXEN,18/06/2018,,,"BRESSANONE The Vista Hotel, Plancios 291B",POINT
"Uffici comunali, Piazza Maria Hueber 3 / Gemeindehaus Maria Hueber Platz 3; WH WC",BRESSANONE/BRIXEN,07/04/2018,,,"BRESSANONE Uffici comunali, Piazza Maria Hueber 3",POINT
fontana pubblica Via Dogana / Öffentlicher Brunnen Zollamtstrasse,BRONZOLO/BRANZOLL,02/07/2018,,,BRONZOLO fontana pubblica Via Dogana,POINT
Distretto / Sprengel,BRUNICO/BRUNECK,15/02/2018,,,BRUNICO Distretto,POINT
Fontana Schlemmerstube / Brunnen Schlemmerstube,BRUNICO/BRUNECK,16/05/2018,,,BRUNICO Fontana Schlemmerstube,POINT
Fontana Waldheim / Brunnen Waldheim,BRUNICO/BRUNECK,16/05/2018,,,BRUNICO Fontana Waldheim,POINT
Fontana chiesa / Brunnen Kirche,BRUNICO/BRUNECK,22/05/2018,,,BRUNICO Fontana chiesa,POINT
Fontana parrocchia / Brunnen Pfarre,BRUNICO/BRUNECK,19/07/2018,,,BRUNICO Fontana parrocchia,POINT
Latte montagna Alto Adige / Bergmilch Südtirol,BRUNICO/BRUNECK,19/07/2018,,,BRUNICO Latte montagna Alto Adige,POINT
Scuola media Röd / Mittelschule Röd,BRUNICO/BRUNECK,15/02/2018,,,BRUNICO Scuola media Röd,POINT
Sowi Gym,BRUNICO/BRUNECK,25/09/2018,,,BRUNICO Sowi Gym,POINT
font. pubb.  Brunnenweg St. Nikolaus / Öffentlicher Brunnen - Brunnenweg St. Nikolaus,CALDARO SULLA STRADA DEL VINO/KALTERN AN DER WEINSTRASSE,08/02/2018,,,CALDARO SULLA STRADA DEL VINO font. pubb.  Brunnenweg St. Nikolaus,POINT
font. pubb. Brunnenweg Nr. 21 / Öffentlicher Brunnen - Brunnenweg Nr. 21,CALDARO SULLA STRADA DEL VINO/KALTERN AN DER WEINSTRASSE,05/09/2018,,,CALDARO SULLA STRADA DEL VINO font. pubb. Brunnenweg Nr. 21,POINT
font. pubb. Kreuzung Trutsch / Öffent. Brunnen Kreuzung Trutsch,CALDARO SULLA STRADA DEL VINO/KALTERN AN DER WEINSTRASSE,11/07/2018,,,CALDARO SULLA STRADA DEL VINO font. pubb. Kreuzung Trutsch,POINT
font. pubb. Mitterdorf - Mayor v. Morandellplatz / Öffentlicher Brunnen Mitterdorf - Mayor v. Morandellplatz,CALDARO SULLA STRADA DEL VINO/KALTERN AN DER WEINSTRASSE,08/02/2018,,,CALDARO SULLA STRADA DEL VINO font. pubb. Mitterdorf - Mayor v. Morandellplatz,POINT
font. pubb. Oberplanitzing Hauptstraße / Öffentlicher Brunnen Oberplanitzing Hauptstraße,CALDARO SULLA STRADA DEL VINO/KALTERN AN DER WEINSTRASSE,28/02/2018,,,CALDARO SULLA STRADA DEL VINO font. pubb. Oberplanitzing Hauptstraße,POINT
"font. pubb. Pianizza di sopra, Strada Principale n. 17 / Öff. Brunnen Oberplanitzing, Hauptstrasse Nr. 17",CALDARO SULLA STRADA DEL VINO/KALTERN AN DER WEINSTRASSE,08/02/2018,,,"CALDARO SULLA STRADA DEL VINO font. pubb. Pianizza di sopra, Strada Principale n. 17",POINT
font. pubb. cimitero / Friedhofsbrunnen,CALDARO SULLA STRADA DEL VINO/KALTERN AN DER WEINSTRASSE,22/10/2018,,,CALDARO SULLA STRADA DEL VINO font. pubb. cimitero,POINT
font.pubb. Rottenburgplatz / Öffentlicher Brunnen Rottenburgplatz,CALDARO SULLA STRADA DEL VINO/KALTERN AN DER WEINSTRASSE,01/09/2018,,,CALDARO SULLA STRADA DEL VINO font.pubb. Rottenburgplatz,POINT
Öffentlicher Brunnen Altenburg / Öffentlicher Brunnen Altenburg,CALDARO SULLA STRADA DEL VINO/KALTERN AN DER WEINSTRASSE,01/09/2018,,,CALDARO SULLA STRADA DEL VINO Öffentlicher Brunnen Altenburg,POINT
Scuola elementare Mules / Grundschule Mauls -  WH WC Mädchen,CAMPO DI TRENS/FREIENFELD,05/03/2018,,,CAMPO DI TRENS Scuola elementare Mules,POINT
Scuola elementare Mules / Grundschule Mauls - Gansör WH WC Mädchen,CAMPO DI TRENS/FREIENFELD,10/01/2018,,,CAMPO DI TRENS Scuola elementare Mules,POINT
"Scuola elementare Mules / Grundschule Mauls, WH WC Damen Mauls Gansör",CAMPO DI TRENS/FREIENFELD,19/03/2018,,,CAMPO DI TRENS Scuola elementare Mules,POINT
Fontana Daimer / Daimerbrunnen,CAMPO TURES/SAND IN TAUFERS,07/11/2018,,,CAMPO TURES Fontana Daimer,POINT
Fontana Taufra Bahnl / Taufra Bahnl Brunnen,CAMPO TURES/SAND IN TAUFERS,07/11/2018,,,CAMPO TURES Fontana Taufra Bahnl,POINT
Fontana Unimet / Brunnen Unimet,CAMPO TURES/SAND IN TAUFERS,05/02/2018,,,CAMPO TURES Fontana Unimet,POINT
Fontana chiesa / Brunnen Kirche,CAMPO TURES/SAND IN TAUFERS,08/07/2018,,,CAMPO TURES Fontana chiesa,POINT
Fontana municipio / Brunnen Rathaus,CAMPO TURES/SAND IN TAUFERS,31/05/2018,,,CAMPO TURES Fontana municipio,POINT
"Albergo ""Sonnenhof"" - Juvale / Gasth. Sonnenhof - Juval",CASTELBELLO-CIARDES/KASTELBELL-TSCHARS,17/10/2018,,,"CASTELBELLO-CIARDES Albergo ""Sonnenhof"" - Juvale",POINT
"f.p. ""Widumplatz"" Ciardes / Öffentlicher Brunnen Widumplatz, Tschars",CASTELBELLO-CIARDES/KASTELBELL-TSCHARS,02/06/2018,,,"CASTELBELLO-CIARDES f.p. ""Widumplatz"" Ciardes",POINT
f.p. centro / Öffentlicher Brunnen Zentrum,CASTELBELLO-CIARDES/KASTELBELL-TSCHARS,09/03/2018,,,CASTELBELLO-CIARDES f.p. centro,POINT
"ristoro di campagna ""Niedermair"" - Montetrumes+I71 / Buschenschank Niedermair - Trumsberg",CASTELBELLO-CIARDES/KASTELBELL-TSCHARS,03/12/2018,,,"CASTELBELLO-CIARDES ristoro di campagna ""Niedermair"" - Montetrumes+I71",POINT
Asilo / Kindergarten,CASTELROTTO/KASTELRUTH,04/10/2018,,,CASTELROTTO,POINT
Asilo Sureghes / Kindergarten Sureghes,CASTELROTTO/KASTELRUTH,05/08/2018,,,CASTELROTTO Sureghes,POINT
"Bagno Pubblico - Centro / Öff. Toiletten, Zentrum",CASTELROTTO/KASTELRUTH,14/02/2018,,,CASTELROTTO,POINT
Bar Lavies - Pufels 5,CASTELROTTO/KASTELRUTH,10/03/2018,,,CASTELROTTO Bar Lavies - Pufels 5,POINT
Fontana pubblica O.-v.-Wolkenstein - Siusi / Öffentlicher Brunnen O.-v.-Wolkenstein-Platz - Seis,CASTELROTTO/KASTELRUTH,13/08/2018,,,CASTELROTTO  O.-v.-Wolkenstein - Siusi,POINT
Fontana pubblica presso scuola elementare / Öffentlicher Brunnen bei Grundschule,CASTELROTTO/KASTELRUTH,17/07/2018,,,CASTELROTTO  presso scuola elementare,POINT
Nordiccenter / Nordiccenter,CASTELROTTO/KASTELRUTH,14/02/2018,,,CASTELROTTO Nordiccenter,POINT
"Cafe` Eggbauer, Basling / Cafe` Eggbauer, Basling",CERMES/TSCHERMS,30/05/2018,,,"CERMES Cafe` Eggbauer, Basling",POINT
Fontana chiesa / Brunnen Kirche,CHIENES/KIENS,05/09/2018,,,CHIENES Fontana chiesa,POINT
Fontana paese / Brunnen Oberdorf,CHIENES/KIENS,05/09/2018,,,CHIENES Fontana paese,POINT
Fontana pubblica Piazza paese / Öffentlicher Brunnen Dorfplatz,CHIUSA/KLAUSEN,04/11/2018,,,CHIUSA  Piazza paese,POINT
"Scuola dell'Infanzia Chiusa, Langrain 39 / Kindergarten Klausen, Langrain 39; WH Küche",CHIUSA/KLAUSEN,10/10/2018,,,"CHIUSA Scuola dell'Infanzia Chiusa, Langrain 39",POINT
Brunnen Friedhof Gummer  /  Brunnen Friedhof Gummer,CORNEDO ALL'ISARCO/KARNEID,10/03/2018,,,CORNEDO ALL'ISARCO Brunnen Friedhof Gummer,POINT
"Scuola elementare Cornedo "" Martin Wenter"" / Grundschule Karneid ""Martin Wenter""",CORNEDO ALL'ISARCO/KARNEID,26/11/2018,,,"CORNEDO ALL'ISARCO Scuola elementare Cornedo "" Martin Wenter""",POINT
Scuole medie Prato Isarco / Mittelschule in Blumau,CORNEDO ALL'ISARCO/KARNEID,27/02/2018,,,CORNEDO ALL'ISARCO Scuole medie Prato Isarco,POINT
fontana pubblica piazza S. Martino / öff. Brunnen St. Martin Platz,CORTINA SULLA STRADA DEL VINO/KURTINIG AN DER WEINSTRASSE,04/10/2018,,,CORTINA SULLA STRADA DEL VINO fontana pubblica piazza S. Martino,POINT
Costabiei / Costabiei,CORVARA IN BADIA/CORVARA,04/04/2018,,,CORVARA IN BADIA Costabiei,POINT
Garni Pcei / Garni Pcei,CORVARA IN BADIA/CORVARA,12/12/2018,,,CORVARA IN BADIA Garni Pcei,POINT
Res. Plagätt - Einlauf,CURON VENOSTA/GRAUN IM VINSCHGAU,20/09/2018,,,CURON VENOSTA Res. Plagätt - Einlauf,POINT
WC - scuola media  /  WC - Mittelschule,CURON VENOSTA/GRAUN IM VINSCHGAU,23/01/2018,,,CURON VENOSTA WC - scuola media,POINT
f. p. S. Valentino - cimitero / Ö. B. St. Valentin - Friedhof,CURON VENOSTA/GRAUN IM VINSCHGAU,10/08/2018,,,CURON VENOSTA f. p. S. Valentino - cimitero,POINT
f.p. Kaschon / ö.B. Kaschon,CURON VENOSTA/GRAUN IM VINSCHGAU,14/11/2018,,,CURON VENOSTA f.p. Kaschon,POINT
f.p. Monteplai / Öffentlicher Brunnen Dörfl,CURON VENOSTA/GRAUN IM VINSCHGAU,14/05/2018,,,CURON VENOSTA f.p. Monteplai,POINT
f.p. Pedrossi Vallelunga di fuori / Öffentlicher Brunnen Pedross Außerlangtaufers,CURON VENOSTA/GRAUN IM VINSCHGAU,14/05/2018,,,CURON VENOSTA f.p. Pedrossi Vallelunga di fuori,POINT
f.p. parcheggio  / Ö.B. Parkplatz,CURON VENOSTA/GRAUN IM VINSCHGAU,14/05/2018,,,CURON VENOSTA f.p. parcheggio,POINT
f.p. parcheggio torre / ö.B. beim Parkplatz Turm,CURON VENOSTA/GRAUN IM VINSCHGAU,14/05/2018,,,CURON VENOSTA f.p. parcheggio torre,POINT
f.p. vallelunga di dentro / Öffentlicher Brunnen Innerlangtaufers,CURON VENOSTA/GRAUN IM VINSCHGAU,20/09/2018,,,CURON VENOSTA f.p. vallelunga di dentro,POINT
Öff. Brunnen unter der Strasse  /  Öff. Brunnen unter der Strasse,CURON VENOSTA/GRAUN IM VINSCHGAU,12/12/2018,,,CURON VENOSTA Öff. Brunnen unter der Strasse,POINT
Fontana chiesa / Brunnen Kirche,DOBBIACO/TOBLACH,24/09/2018,,,DOBBIACO Fontana chiesa,POINT
Fontana municipio / Brunnen Rathaus,DOBBIACO/TOBLACH,09/10/2018,,,DOBBIACO Fontana municipio,POINT
Latteria / Sennerei,DOBBIACO/TOBLACH,04/03/2018,,,DOBBIACO Latteria,POINT
Panificio Trenker / Bäckerei Trenker,DOBBIACO/TOBLACH,14/02/2018,,,DOBBIACO Panificio Trenker,POINT
Fontana pubblica Piazza della Libertà / Öffentliche Brunnen Freiheitsplatz,EGNA/NEUMARKT,15/05/2018,,,EGNA  Piazza della Libertà,POINT
Fontana pubblica via A. Hofer / Öffentliche Brunnen A. Hofer Straße,EGNA/NEUMARKT,28/08/2018,,,EGNA  via A. Hofer,POINT
Fontana Osnerplatz / Brunnen Osnerplatz,FALZES/PFALZEN,08/09/2018,,,FALZES Fontana Osnerplatz,POINT
Fontana Reichegger / Brunnen Reichegger,FALZES/PFALZEN,08/06/2018,,,FALZES Fontana Reichegger,POINT
Fontana chiesa / Brunnen Kirche,FALZES/PFALZEN,08/06/2018,,,FALZES Fontana chiesa,POINT
Autobahnraststätte Atzwang-Schlern West/Autobahnraststätte Atzwang-Schlern West,FIÈ ALLO SCILIAR/VÖLS AM SCHLERN,25/01/2018,,,FIÈ ALLO SCILIAR Autobahnraststätte Atzwang-Schlern West,POINT
Fontana Hotel Perwanger/Brunnen Hotel Perwanger,FIÈ ALLO SCILIAR/VÖLS AM SCHLERN,13/08/2018,,,FIÈ ALLO SCILIAR Fontana Hotel Perwanger,POINT
Fontana pubblica Binderplatz / Öffentlicher Brunnen Binderplatz,FIÈ ALLO SCILIAR/VÖLS AM SCHLERN,05/10/2018,,,FIÈ ALLO SCILIAR  Binderplatz,POINT
GH Kircher / GH Kircher - Ums,FIÈ ALLO SCILIAR/VÖLS AM SCHLERN,26/02/2018,,,FIÈ ALLO SCILIAR GH Kircher,POINT
"Albergo Brückenwirt, Mezzaselva / Gasthof Brückenwirt, Mittewald - WH Bar - ohne Abflaemmen",FORTEZZA/FRANZENSFESTE,08/07/2018,,,"FORTEZZA Albergo Brückenwirt, Mezzaselva",POINT
"Albergo Riol, Fortezza / Gasthof Riol, Franzenfeste",FORTEZZA/FRANZENSFESTE,05/03/2018,,,"FORTEZZA Albergo Riol, Fortezza",POINT
"Albergo Riol, Fortezza / Gasthof Riol, Franzenfeste - Riolbar, WH Bar - Entnahme ohne abflammen",FORTEZZA/FRANZENSFESTE,19/03/2018,,,"FORTEZZA Albergo Riol, Fortezza",POINT
"Albergo Riol, Fortezza / Gasthof Riol, Franzenfeste - WH Bar - ohne Abfalmmen",FORTEZZA/FRANZENSFESTE,08/07/2018,,,"FORTEZZA Albergo Riol, Fortezza",POINT
"Albergo Edelweiss, S. Maddalena 77 / Gasthof Edelweiss, St. Magdalena 77 - WH Bar",FUNES/VILLNÖSS,27/03/2018,,,"FUNES Albergo Edelweiss, S. Maddalena 77",POINT
"Albergo Edelweiss, S. Maddalena 77 / Gasthof Edelweiss, St. Magdalena 77; WH Bar",FUNES/VILLNÖSS,07/09/2018,,,"FUNES Albergo Edelweiss, S. Maddalena 77",POINT
"Fa. Hewoline, Schmelze 4/Fa. Hewoline, Schmelze 4, WH Garage",FUNES/VILLNÖSS,24/09/2018,,,"FUNES Fa. Hewoline, Schmelze 4",POINT
Font. pubbl. sede del circolo Tiso/Öff. Brunnen Vereinshaus Teis,FUNES/VILLNÖSS,05/07/2018,,,FUNES Font. pubbl. sede del circolo Tiso,POINT
Fontana S. Pietro / Dorfbrunnen St. Peter,FUNES/VILLNÖSS,05/07/2018,,,FUNES Fontana S. Pietro,POINT
"Scuola elementare S. Pietro, S. Pietro 140 / Grundschule St. Peter, St. Peter 140; WH WC",FUNES/VILLNÖSS,27/03/2018,,,"FUNES Scuola elementare S. Pietro, S. Pietro 140",POINT
"Scuola elementare S. Pietro, S. Pietro 140 / Grundschule St. Peter, St. Peter 140; WH WC Vereinslokale",FUNES/VILLNÖSS,07/09/2018,,,"FUNES Scuola elementare S. Pietro, S. Pietro 140",POINT
"Scuola materna S. Maddalena/Kindergarten St. Magdalen, St. Magdalena 114; WH Küche",FUNES/VILLNÖSS,24/09/2018,,,FUNES Scuola materna S. Maddalena,POINT
"Scuola materna S. Maddalena/Kindergarten St. Magdalena, WH Küche",FUNES/VILLNÖSS,27/11/2018,,,FUNES Scuola materna S. Maddalena,POINT
Scuola materna S. Maddalena/Kindergarten St. Magdalena; WH Küche,FUNES/VILLNÖSS,05/07/2018,,,FUNES Scuola materna S. Maddalena,POINT
Albergo Huber / Gasthaus Huber,GAIS/GAIS,24/10/2018,,,GAIS Huber,POINT
Fontana Brunner / Brunner Brunnen,GAIS/GAIS,17/04/2018,,,GAIS Brunner,POINT
Fontana chiesa / Brunnen Kirche,GAIS/GAIS,17/04/2018,,,GAIS ALTO ADIGE,POINT
Fontana municipio / Brunnen Rathaus,GAIS/GAIS,07/11/2018,,,GAIS alto adige,POINT
f.p. vicino la chiesa e ristorante Stambecco / Öffentlicher Brunnen neben Kirche u. Gh. Steinbock,GLORENZA/GLURNS,01/09/2018,,,GLORENZA f.p.  la chiesa e ristorante Stambecco,POINT
Coldrano: f.p. incrocio via Castello - via Tschanderle / Goldrain: Öffentlicher Brunnen Kreuzung Schlossstr. - Tschanderleweg,LACES/LATSCH,03/12/2018,,,LACES Coldrano: f.p.  via Castello - via Tschanderle,POINT
f.p. Coldrano - piazzetta / Öffentlicher Brunnen Goldrain - Platzl,LACES/LATSCH,12/06/2018,,,LACES f.p. Coldrano - piazzetta,POINT
f.p. pista ciclabile / Öff. Brunnen bei Radweg,LACES/LATSCH,05/03/2018,,,LACES f.p. pista ciclabile,POINT
"f.p. via Schuler / Öffentlicher Brunnen, Schulerstrasse",LACES/LATSCH,27/08/2018,,,LACES f.p. via Schuler,POINT
fontana pubblica zona industriale Pedross / Öffentlicher Brunnen Industriezone Pedross,LACES/LATSCH,24/09/2018,,,LACES fontana pubblica zona industriale Pedross,POINT
ristorante stazione a monte a San Martino / Restaurant Bergstation in St. Martin,LACES/LATSCH,03/12/2018,,,LACES ristorante stazione a monte a San Martino,POINT
Ö.B. neben Kirche,LACES/LATSCH,27/02/2018,,,LACES Ö.B. neben Kirche,POINT
"Albergo ""Maratscher, Plars di Mezzo / Gasthaus Maratscher, Mitterplars",LAGUNDO /ALGUND,12/06/2018,,,"LAGUNDO  Albergo ""Maratscher, Plars di Mezzo",POINT
"GH Gruber, Vellau",LAGUNDO /ALGUND,07/09/2018,,,"LAGUNDO  GH Gruber, Vellau",POINT
"Gasthaus Ladurner, Vellau / Gasthaus Ladurner, Vellau",LAGUNDO /ALGUND,12/06/2018,,,"LAGUNDO  Gasthaus Ladurner, Vellau",POINT
Servizi pubblici seggiovia stazione di monte  /  Öffentl. Toiletten Bergstation Seilbahn,LAGUNDO /ALGUND,22/05/2018,,,LAGUNDO  Servizi pubblici seggiovia stazione di monte,POINT
WC - municipio / Gemeinde -  WC,LAGUNDO /ALGUND,02/07/2018,,,LAGUNDO  WC - municipio,POINT
f.p. via B. Leiter / ö.B. B. Leiter Str.,LAGUNDO /ALGUND,04/04/2018,,,LAGUNDO  f.p. via B. Leiter,POINT
fontana pubblica presso la chiesa / Öffentlicher Brunnen bei Kirche,LAGUNDO /ALGUND,05/08/2018,,,LAGUNDO  fontana pubblica presso la chiesa,POINT
f.p. via B. Leiter / ö.B. B. Leiter Str.,LAGUNDO/ALGUND,07/09/2018,,,LAGUNDO f.p. via B. Leiter,POINT
"Ditta ELA Srl, Zona Artigianale Pontives 10 / Fa. ELA GmbH, Gewerbezone Pontives 10",LAION/LAJEN,17/04/2018,,,"LAION Ditta ELA Srl, Zona Artigianale Pontives 10",POINT
Fontana pubblica Tanürz  /  Öffentlicher Brunnen Tanürz,LAION/LAJEN,05/07/2018,,,LAION  Tanürz,POINT
Fontana pubblica scuola elementare Lajener Ried/Öff. Brunnen Grundschule Lajener Ried,LAION/LAJEN,09/10/2018,,,LAION  scuola elementare Lajener Ried,POINT
Bagni 1° compagnia,LAIVES/LEIFERS,12/11/2018,,,LAIVES Bagni 1° compagnia,POINT
Caserma CC. Guella - rubinetto cucina carabinieri / Kaserne CC. Guella - Wasserhahn der Küche der Carabinieri,LAIVES/LEIFERS,21/02/2018,,,LAIVES Caserma CC. Guella -  carabinieri,POINT
Fontana pubblica Pineta di Laives  /  Fontana pubblica Pineta di Laives,LAIVES/LEIFERS,10/09/2018,,,LAIVES  Pineta di Laives,POINT
Magazzino comunale zona industriale/ Magazin der Gemeinde Industriezone,LAIVES/LEIFERS,02/07/2018,,,LAIVES Magazzino comunale zona industriale,POINT
Scuola Elementare Fraz. Pineta / Grundschule Steinmannwald,LAIVES/LEIFERS,19/02/2018,,,LAIVES Scuola Elementare Fraz. Pineta,POINT
Scuola elementare San Giacomo / Grundschule St. Jakob,LAIVES/LEIFERS,19/02/2018,,,LAIVES Scuola elementare San Giacomo,POINT
WC piscina coperta comunale / WC Gemeindehallenbad,LAIVES/LEIFERS,28/02/2018,,,LAIVES WC piscina coperta comunale,POINT
f.p. giardino zona 46/Öff. Brunnen Garten Zone 46,LAIVES/LEIFERS,14/06/2018,,,LAIVES f.p. giardino zona 46,POINT
"f.p. parco giochi via Sottomonte / öff. Brunnen, Spielplatz, Unterbergstr.",LAIVES/LEIFERS,17/05/2018,,,LAIVES f.p. parco giochi via Sottomonte,POINT
"Albergo ""Pawiglerwirt"" - Pavicolo / Gasthaus Pawiglerwirt - Pawigl",LANA/LANA,03/07/2018,,,"LANA Albergo ""Pawiglerwirt"" - Pavicolo",POINT
Bar Nordkap / Bar Nordkap,LANA/LANA,05/10/2018,,,LANA Bar Nordkap,POINT
f.p. p.zza della chiesa / Öffentlicher Brunnen Kirchplatz,LANA/LANA,04/04/2018,,,LANA f.p. p.zza della chiesa,POINT
"f.p. presso la chiesa ""Kapuziner"" / Öffentlicher Brunnen bei Kapuziner Kirche",LANA/LANA,02/01/2018,,,"LANA f.p. presso la chiesa ""Kapuziner""",POINT
"f.p. presso la chiesa, Foiana / Öffentlicher Brunnen neben Kirche, Völlan",LANA/LANA,05/08/2018,,,"LANA f.p. presso la chiesa, Foiana",POINT
Oris: WC scuola elementare/Eyrs: WC Grundschule,LASA/LAAS,12/11/2018,,,LASA Oris: WC scuola elementare,POINT
f.p. - parcheggio / Öffentlicher Brunnen am Parkplatz,LASA/LAAS,30/07/2018,,,LASA f.p. - parcheggio,POINT
"f.p. ciclabile ""Zapferbad"" / ö.B. Radweg Zapferbad",LASA/LAAS,15/05/2018,,,"LASA f.p. ciclabile ""Zapferbad""",POINT
f.p. strada principale / Öffentlicher Brunnen Hauptstrasse,LASA/LAAS,01/09/2018,,,LASA f.p. strada principale,POINT
fontana pubblica cimitero / Öffentlicher Brunnen Friedhof,LAUREGNO/LAUREIN,08/08/2018,,,LAUREGNO fontana pubblica cimitero,POINT
Albergo Lüsnerhof / Hotel Lüsnerhof,LUSON/LÜSEN,17/10/2018,,,LUSON Albergo Lüsnerhof,POINT
Albergo Lüsnerhof / Hotel Lüsnerhof WH WC,LUSON/LÜSEN,30/08/2018,,,LUSON Albergo Lüsnerhof,POINT
Albergo Lüsnerhof / Hotel Lüsnerhof; WH WC,LUSON/LÜSEN,04/12/2018,,,LUSON Albergo Lüsnerhof,POINT
fontana pubblica piazza paese / Öffentlicher Brunnen Dorfplatz,LUSON/LÜSEN,04/12/2018,,,LUSON fontana pubblica,POINT
Fontana pubblica Caserma dei Pompieri / Öffentlicher Brunnen neben Feuerwehrhalle,MAGRÈ SULLA STRADA DEL VINO/MARGREID AN DER WEINSTRASSE,16/05/2018,,,MAGRÈ SULLA STRADA DEL VINO  Caserma dei Pompieri,POINT
Fontana pubblica vicino casa padronale Löwengang / Öffentl. Brunnen neben Ansitz Löwengang,MAGRÈ SULLA STRADA DEL VINO/MARGREID AN DER WEINSTRASSE,02/06/2018,,,MAGRÈ SULLA STRADA DEL VINO   casa padronale Löwengang,POINT
Tischlerei Amegg / Tischlerei Amegg,MAGRÈ SULLA STRADA DEL VINO/MARGREID AN DER WEINSTRASSE,16/07/2018,,,MAGRÈ SULLA STRADA DEL VINO Tischlerei Amegg,POINT
Fontana pubblica presso Stazione  /  Öff. Brunnen bei Bahnhof,MALLES VENOSTA /MALS,08/06/2018,,,MALLES VENOSTA   presso Stazione,POINT
Fürstenburg - Käse Produktionsraum,MALLES VENOSTA /MALS,03/06/2018,,,MALLES VENOSTA  Fürstenburg - Käse Produktionsraum,POINT
Knottbergquellen nach AB / Knottbergquellen nach AB,MALLES VENOSTA /MALS,24/10/2018,,,MALLES VENOSTA  Knottbergquellen nach AB,POINT
Knottbergquellen vor AB /  Knottbergquellen vor AB,MALLES VENOSTA /MALS,24/10/2018,,,MALLES VENOSTA  Knottbergquellen vor AB,POINT
Sammelschacht Quellen Mischwasser,MALLES VENOSTA /MALS,26/09/2018,,,MALLES VENOSTA  Sammelschacht Quellen Mischwasser,POINT
Sennerei Burgeis Arbeitsraum,MALLES VENOSTA /MALS,03/06/2018,,,MALLES VENOSTA  Sennerei Burgeis Arbeitsraum,POINT
albergo Moriggl - dispensa del latte / Gasthaus Moriggl - Milchkammer,MALLES VENOSTA /MALS,20/11/2018,,,MALLES VENOSTA  albergo Moriggl - dispensa del latte,POINT
fontana pubblica / Öffentlicher Brunnen,MALLES VENOSTA /MALS,20/11/2018,,,MALLES VENOSTA  fontana pubblica,POINT
"ristoro di campagna ""Patzleid"" / Buschenschank: Platzleid",MALLES VENOSTA /MALS,22/10/2018,,,"MALLES VENOSTA  ristoro di campagna ""Patzleid""",POINT
Öffentlicher Brunnen vor Kirche vierzehn Nothelfer / Öffentlicher Brunnen vor Kirche vierzehn Nothelfer,MALLES VENOSTA /MALS,05/02/2018,,,MALLES VENOSTA  Öffentlicher Brunnen vor Kirche vierzehn Nothelfer,POINT
Fontana Posta / Brunnen Post,MAREBBE/ENNEBERG,07/02/2018,,,MAREBBE Fontana Posta,POINT
Fontana chiesa / Brunnen Kirche,MAREBBE/ENNEBERG,07/02/2018,,,MAREBBE Fontana chiesa,POINT
Garni Prantnerhof  /  Garni Prantnerhof,MARLENGO/MARLING,30/05/2018,,,MARLENGO Garni Prantnerhof,POINT
f.p. di fronte al parcheggio / Öffentlicher Brunnen gegenüber Parkplatz,MARLENGO/MARLING,12/04/2018,,,MARLENGO f.p. di fronte al parcheggio,POINT
Serbatoio Thairmühl -  entrata delle sorgenti Platzer Mahd e sorgente Grub / Reservoir Thairmühl - Einlauf der Platzer Mahd Quellen und Grubquelle,MARTELLO/MARTELL,09/05/2018,,,MARTELLO Serbatoio Thairmühl -  entrata delle sorgenti Platzer Mahd e sorgente Grub,POINT
Stallwies: Trattoria Hölderle / Stallwies: GH Hölderle,MARTELLO/MARTELL,06/05/2018,,,MARTELLO Stallwies: Trattoria Hölderle,POINT
WC - vicino comune /WC - neben Gemeinde,MARTELLO/MARTELL,06/05/2018,,,MARTELLO WC -  comune,POINT
WC-Gemeindebauhof,MARTELLO/MARTELL,21/11/2018,,,MARTELLO WC-Gemeindebauhof,POINT
"centro ""Biathlon"" - WC malga di ""Grogg"" / Biathlonzentrum -  WC Groggalm",MARTELLO/MARTELL,20/03/2018,,,"MARTELLO centro ""Biathlon"" - WC malga di ""Grogg""",POINT
f.p. vicino Obkirchhof / öffentlicher Brunnen beim Obkirchhof,MARTELLO/MARTELL,06/05/2018,,,MARTELLO f.p.  Obkirchhof,POINT
Font. pubb. vicino chiesa / Öffentlicher Brunnen neben Kirche,MELTINA/MÖLTEN,09/11/2018,,,MELTINA Font. pubb.,POINT
Fontana pubblica piazza S. Teßmann / Öff. Brunnen Siegfried Teßmann Platz,MELTINA/MÖLTEN,26/09/2018,,,MELTINA  piazza S. Teßmann,POINT
Scuola media Meltina - WC / Grundschule Mölten - WC parterre,MELTINA/MÖLTEN,20/03/2018,,,MELTINA Scuola media Meltina - WC,POINT
fontana pubblica Schlaneid  /  Öff. Brunnen Schlaneid,MELTINA/MÖLTEN,07/03/2018,,,MELTINA fontana pubblica Schlaneid,POINT
Asilo Girotondo - Maia Bassa / Asilo Girotondo - Untermais,MERANO/MERAN,31/01/2018,,,MERANO Asilo Girotondo - Maia Bassa,POINT
Bar Cinzia / Bar Cinzia,MERANO/MERAN,24/01/2018,,,MERANO Bar Cinzia,POINT
Bar Vittoria - Sinigo / Bar Vittoria - Sinich,MERANO/MERAN,24/01/2018,,,MERANO Bar Vittoria - Sinigo,POINT
"Ufficio Igiene, via Goethe n. 7 / Hygieneamt, Goethestr. 7",MERANO/MERAN,24/01/2018,,,"MERANO Ufficio Igiene, via Goethe n. 7",POINT
"Via Planta, condotta delle sorgenti / Plantastrasse Leitung von Quellen",MERANO/MERAN,04/05/2018,,,"MERANO Via Planta, condotta delle sorgenti",POINT
"f.p. ""Brunnegger Brunnen"" via Planta / Öff. Brunnen, Brunegger Brunnen, Plantastrasse",MERANO/MERAN,17/10/2018,,,"MERANO f.p. ""Brunnegger Brunnen"" via Planta",POINT
f.p. presso il Bar Cinzia / Ö.B. bei Bar Cinzia,MERANO/MERAN,28/03/2018,,,MERANO f.p. presso il Bar Cinzia,POINT
"f.p. presso il serbatoio ""Naif"" / Öffentlicher Brunnen bei Reservoir Naiftal",MERANO/MERAN,16/08/2018,,,"MERANO f.p. presso il serbatoio ""Naif""",POINT
f.p. via Brennero/via Roma / Öffentlicher Brunnen Kreuzung Brennerstr./Romstr.,MERANO/MERAN,04/05/2018,,,MERANO f.p. via Brennero,POINT
"ospedale, dialisi dopo l'impianto osmosi / Krankenhaus Meran, Dialyseabteilung nach der Osmoseanlage",MERANO/MERAN,27/03/2018,,,"MERANO ospedale, dialisi dopo l'impianto osmosi",POINT
"ospedale, dialisi prima dell'impianto osmosi / Krankenhaus Meran, Dialyseabteilung vor der Osmoseanlage",MERANO/MERAN,27/03/2018,,,"MERANO ospedale, dialisi prima dell'impianto osmosi",POINT
pozzo di distribuzione Tell / Verteilerschacht Töll,MERANO/MERAN,02/05/2018,,,MERANO pozzo di distribuzione Tell,POINT
