alias_address,alias_city,geocode,geometry,georeferencingString
FRAZIONE BRUGNACH,AGORDO,"Brugnàch, Belluno, Veneto, 32027, Italia","{'type': 'Point', 'coordinates': [12.020224, 46.2857798]}"," BRUGNACH, Belluno, Veneto, Italia"
VIA FIORI,CALALZO DI CADORE,"Via Fiori, Molinà, Calalzo di Cadore, Belluno, Veneto, 32042, Italia","{'type': 'Point', 'coordinates': [12.3806878, 46.4471892]}","VIA FIORI, CALALZO DI CADORE, Belluno, Veneto, Italia"
CORSO DEGLI ALPINI,AGORDO,"Corso degli Alpini, Crostolin, Colvignàs, Agordo, Belluno, Veneto, 32021, Italia","{'type': 'Point', 'coordinates': [12.0350418, 46.2821909]}","CORSO DEGLI ALPINI, AGORDO, Belluno, Veneto, Italia"
CORSO PATRIOTI,AGORDO,"Corso Patrioti, Crostolin, Colvignàs, Agordo, Belluno, Veneto, 32021, Italia","{'type': 'Point', 'coordinates': [12.0344056, 46.2815144]}","CORSO PATRIOTI, AGORDO, Belluno, Veneto, Italia"
FRAZIONE COLVIGNAS,AGORDO,"Colvignàs, Agordo, Belluno, Veneto, 32021, Italia","{'type': 'Point', 'coordinates': [12.0381432, 46.2899373]}"," COLVIGNAS, AGORDO, Belluno, Veneto, Italia"
FRAZIONE CROSTOLIN,AGORDO,"Crostolin, Agordo, Belluno, Veneto, 32021, Italia","{'type': 'Point', 'coordinates': [12.0516042, 46.2757537]}"," CROSTOLIN, AGORDO, Belluno, Veneto, Italia"
FRAZIONE FARENZENA,AGORDO,"Farenzena, Agordo, Belluno, Veneto, 32021, Italia","{'type': 'Point', 'coordinates': [12.0318236, 46.2922762]}"," FARENZENA, AGORDO, Belluno, Veneto, Italia"
FRAZIONE GIOVE,AGORDO,"Giove, Agordo, Belluno, Veneto, 32021, Italia","{'type': 'Point', 'coordinates': [12.0272715, 46.2734231]}"," GIOVE, AGORDO, Belluno, Veneto, Italia"
FRAZIONE PIASENT,AGORDO,"Piasent, Agordo, Belluno, Veneto, 32021, Italia","{'type': 'Point', 'coordinates': [12.0516334, 46.2893974]}"," PIASENT, AGORDO, Belluno, Veneto, Italia"
FRAZIONE RIF,AGORDO,"Rif, Belluno, Veneto, 32021, Italia","{'type': 'Point', 'coordinates': [12.0464562, 46.2850166]}"," RIF, AGORDO, Belluno, Veneto, Italia"
FRAZIONE TOCCOL,AGORDO,"Toccol, Agordo, Belluno, Veneto, 32027, Italia","{'type': 'Point', 'coordinates': [12.0270695, 46.2905861]}"," TOCCOL, AGORDO, Belluno, Veneto, Italia"
FRAZIONE VALCOZZENA,AGORDO,"Valcozzena, Agordo, Belluno, Veneto, 32021, Italia","{'type': 'Point', 'coordinates': [12.0232645, 46.2802901]}"," VALCOZZENA, AGORDO, Belluno, Veneto, Italia"
FRAZIONE VERAN,AGORDO,"Veran, Agordo, Belluno, Veneto, 32021, Italia","{'type': 'Point', 'coordinates': [12.0457977, 46.2794341]}"," VERAN, AGORDO, Belluno, Veneto, Italia"
LOCALITA' CAMPREGANA,AGORDO,"Rio Campregana, Agordo, Belluno, Veneto, 32021, Italia","{'type': 'Point', 'coordinates': [12.0348236, 46.2913859]}"," CAMPREGANA, AGORDO, Belluno, Veneto, Italia"
LOCALITA' FAION,AGORDO,"Località Faion, Crostolin, Veran, Agordo, Belluno, Veneto, 32021, Italia","{'type': 'Point', 'coordinates': [12.0423005, 46.2773484]}"," FAION, AGORDO, Belluno, Veneto, Italia"
LOCALITA' GRAVE,AGORDO,"Località Grave, Crostolin, Veran, Agordo, Belluno, Veneto, 32021, Italia","{'type': 'Point', 'coordinates': [12.0445588, 46.281031]}"," GRAVE, AGORDO, Belluno, Veneto, Italia"
LOCALITA' MOLIN DEI COT,AGORDO,"Località Molin dei Col, Crostolin, Veran, Agordo, Belluno, Veneto, 32021, Italia","{'type': 'Point', 'coordinates': [12.0446821, 46.2818623]}"," MOLIN DEI COT, AGORDO, Belluno, Veneto, Italia"
LOCALITA' MOZZACH,AGORDO,"Via Mozzach, Crostolin, Veran, Agordo, Belluno, Veneto, 32021, Italia","{'type': 'Point', 'coordinates': [12.0399516, 46.2785853]}"," MOZZACH, AGORDO, Belluno, Veneto, Italia"
LOCALITA' PAS,AGORDO,"Agordo, Belluno, Veneto, 32021, Italia","{'type': 'Point', 'coordinates': [12.034981, 46.2821471]}"," PAS, AGORDO, Belluno, Veneto, Italia"
LOCALITA' POLANE,AGORDO,"Polane, Variante di Agordo, Crostolin, Giove, Agordo, Belluno, Veneto, 32021, Italia","{'type': 'Point', 'coordinates': [12.033855310733244, 46.272579300000004]}"," POLANE, AGORDO, Belluno, Veneto, Italia"
LOCALITA' VAL DI FRELA,AGORDO,"Val di Frela, Agordo, Belluno, Veneto, 32021, Italia","{'type': 'Point', 'coordinates': [12.0351135, 46.2942062]}"," VAL DI FRELA, AGORDO, Belluno, Veneto, Italia"
LOCALITA' VALCOZZENA,AGORDO,"Valcozzena, Agordo, Belluno, Veneto, 32021, Italia","{'type': 'Point', 'coordinates': [12.0232645, 46.2802901]}"," VALCOZZENA, AGORDO, Belluno, Veneto, Italia"
CORSO ITALIA,ALLEGHE,"Corso Italia, Cordella, Alleghe, Belluno, Veneto, 32022, Italia","{'type': 'Point', 'coordinates': [12.0205269, 46.4064987]}","CORSO ITALIA, ALLEGHE, Belluno, Veneto, Italia"
CORSO VENETO,ALLEGHE,"Corso Veneto, Alleghe, Belluno, Veneto, 32022, Italia","{'type': 'Point', 'coordinates': [11.9940309, 46.4383229]}","CORSO VENETO, ALLEGHE, Belluno, Veneto, Italia"
CORSO VENEZIA,ALLEGHE,"Corso Venezia, Cordella, Alleghe, Belluno, Veneto, 32022, Italia","{'type': 'Point', 'coordinates': [12.0179369, 46.4026005]}","CORSO VENEZIA, ALLEGHE, Belluno, Veneto, Italia"
VIA COI,ALLEGHE,"Coi, Alleghe, Belluno, Veneto, 32022, Italia","{'type': 'Point', 'coordinates': [12.036883, 46.4127434]}","VIA COI, ALLEGHE, Belluno, Veneto, Italia"
VIA COLDAI,ALLEGHE,"Via Coldai, Cordella, Alleghe, Belluno, Veneto, 32022, Italia","{'type': 'Point', 'coordinates': [12.0216239, 46.4062237]}","VIA COLDAI, ALLEGHE, Belluno, Veneto, Italia"
VIA COLDEMIES,ALLEGHE,"Coldemies, Alleghe, Belluno, Veneto, 32022, Italia","{'type': 'Point', 'coordinates': [12.0255834, 46.4105156]}","VIA COLDEMIES, ALLEGHE, Belluno, Veneto, Italia"
VIA CORDELLA,ALLEGHE,"Cordella, Alleghe, Belluno, Veneto, 32022, Italia","{'type': 'Point', 'coordinates': [12.0201018, 46.4095332]}","VIA CORDELLA, ALLEGHE, Belluno, Veneto, Italia"
VIA DEGLI ALPINI,ALLEGHE,"Via degli Alpini, Coldemies, Alleghe, Belluno, Veneto, 32022, Italia","{'type': 'Point', 'coordinates': [12.0282925, 46.4069144]}","VIA DEGLI ALPINI, ALLEGHE, Belluno, Veneto, Italia"
VIA DEI PINI,ALLEGHE,"Via dei Pini, Cordella, Alleghe, Belluno, Veneto, 32022, Italia","{'type': 'Point', 'coordinates': [12.0149719, 46.3979231]}","VIA DEI PINI, ALLEGHE, Belluno, Veneto, Italia"
VIA EUROPA,ALLEGHE,"Via Europa, Cordella, Alleghe, Belluno, Veneto, 32022, Italia","{'type': 'Point', 'coordinates': [12.0191704, 46.4065106]}","VIA EUROPA, ALLEGHE, Belluno, Veneto, Italia"
VIA FERNAZZA,ALLEGHE,"Fernazza, Alleghe, Belluno, Veneto, 32022, Italia","{'type': 'Point', 'coordinates': [12.0359916, 46.4155914]}","VIA FERNAZZA, ALLEGHE, Belluno, Veneto, Italia"
VIA MONTE CIVETTA,ALLEGHE,"Via Monte Civetta, Coi, Alleghe, Belluno, Veneto, 32022, Italia","{'type': 'Point', 'coordinates': [12.029277, 46.4109001]}","VIA MONTE CIVETTA, ALLEGHE, Belluno, Veneto, Italia"
CORSO ALPINO,ALPAGO,"Corso Alpino, Farra d'Alpago, Alpago, Belluno, Veneto, 32016, Italia","{'type': 'Point', 'coordinates': [12.361772, 46.1177631]}","CORSO ALPINO, ALPAGO, Belluno, Veneto, Italia"
FRAZIONE BASTIA,ALPAGO,"Bastia, Belluno, Veneto, 32015, Italia","{'type': 'Point', 'coordinates': [12.3357893, 46.1332022]}"," BASTIA, ALPAGO, Belluno, Veneto, Italia"
FRAZIONE SPERT,ALPAGO,"Spert, Alpago, Belluno, Veneto, 32016, Italia","{'type': 'Point', 'coordinates': [12.4016862, 46.1137645]}"," SPERT, ALPAGO, Belluno, Veneto, Italia"
FRAZIONE TORCH,ALPAGO,"Torch, Alpago, Belluno, Veneto, 32015, Italia","{'type': 'Point', 'coordinates': [12.3646902, 46.1524823]}"," TORCH, ALPAGO, Belluno, Veneto, Italia"
FRAZIONE TORRES,ALPAGO,"Torres, Alpago, Belluno, Veneto, 32010, Italia","{'type': 'Point', 'coordinates': [12.3611072, 46.1673086]}"," TORRES, ALPAGO, Belluno, Veneto, Italia"
FRAZIONE VALZELLA,ALPAGO,"Valzella, Alpago, Belluno, Veneto, 32015, Italia","{'type': 'Point', 'coordinates': [12.3566859, 46.147709]}"," VALZELLA, ALPAGO, Belluno, Veneto, Italia"
LOCALITA' CAMPON,ALPAGO,"Località Campon, Pieve d'Alpago, Alpago, Belluno, Veneto, 32010, Italia","{'type': 'Point', 'coordinates': [12.3567547, 46.176688]}"," CAMPON, ALPAGO, Belluno, Veneto, Italia"
LOCALITA' FONTANA,ALPAGO,"Fontana di Poiatte, Via Poiatte, Farra d'Alpago, Alpago, Belluno, Veneto, 32016, Italia","{'type': 'Point', 'coordinates': [12.3550298, 46.1065076]}"," FONTANA, ALPAGO, Belluno, Veneto, Italia"
LOCALITA' MONTAGNA,ALPAGO,"Via Montagna, Farra d'Alpago, Tambre, Belluno, Veneto, Italia","{'type': 'Point', 'coordinates': [12.4158605, 46.1144053]}"," MONTAGNA, ALPAGO, Belluno, Veneto, Italia"
BORGO SAN LORENZO,ARSIE',"Borgo San Lorenzo, San Lorenzo, Arsiè, Belluno, Veneto, Italia","{'type': 'Point', 'coordinates': [11.7589869, 45.9899522]}","BORGO SAN LORENZO, ARSIE', Belluno, Veneto, Italia"
LOCALITA' COL PERER,ARSIE',"Col Perer, Arsiè, Belluno, Veneto, 32033, Italia","{'type': 'Point', 'coordinates': [11.7321173, 46.0102497]}"," COL PERER, ARSIE', Belluno, Veneto, Italia"
LOCALITA' GAJOLE,ARSIE',"Camping Gajole, Via Campagna, C. Placido, Arsiè, Belluno, Veneto, Italia","{'type': 'Point', 'coordinates': [11.765084068986672, 45.96809905]}"," GAJOLE, ARSIE', Belluno, Veneto, Italia"
PIAZZA MARTIRI,ARSIE',"Piazza Martiri, Cascine alle Rive, Arsiè, Belluno, Veneto, Italia","{'type': 'Point', 'coordinates': [11.747456539488798, 45.98923905]}","PIAZZA MARTIRI, ARSIE', Belluno, Veneto, Italia"
PIAZZA SAN MARTINO,ARSIE',"Piazza S. Martino, Cascine alle Rive, Arsiè, Belluno, Veneto, Italia","{'type': 'Point', 'coordinates': [11.7469195, 45.9914312]}","PIAZZA SAN MARTINO, ARSIE', Belluno, Veneto, Italia"
PIAZZA SAN VITO,ARSIE',"Piazza San Vito, Case Cecchin, Arsiè, Belluno, Veneto, 36052, Italia","{'type': 'Point', 'coordinates': [11.7148899, 45.959709]}","PIAZZA SAN VITO, ARSIE', Belluno, Veneto, Italia"
VIA A. MANZONI,ARSIE',"Via A. Manzoni, Cascine alle Rive, Arsiè, Belluno, Veneto, Italia","{'type': 'Point', 'coordinates': [11.7488193, 45.990116]}","VIA A. MANZONI, ARSIE', Belluno, Veneto, Italia"
VIA ANGELO ARBOIT,ARSIE',"Via Angelo Arboit, C. Mason, Arsiè, Belluno, Veneto, Italia","{'type': 'Point', 'coordinates': [11.7568481, 45.9769019]}","VIA ANGELO ARBOIT, ARSIE', Belluno, Veneto, Italia"
VIA ANGOA,ARSIE',"Via Angoa, Soras, Arsiè, Belluno, Veneto, 32033, Italia","{'type': 'Point', 'coordinates': [11.7642343, 45.9953805]}","VIA ANGOA, ARSIE', Belluno, Veneto, Italia"
VIA BERNARDI,ARSIE',"Via Bernardi, Rocca d'Arsiè, Arsiè, Belluno, Veneto, Italia","{'type': 'Point', 'coordinates': [11.7517094, 45.9515123]}","VIA BERNARDI, ARSIE', Belluno, Veneto, Italia"
VIA CADORNA,ARSIE',"Via Cadorna, Sassei, Arsiè, Belluno, Veneto, Italia","{'type': 'Point', 'coordinates': [11.7558564, 45.9835084]}","VIA CADORNA, ARSIE', Belluno, Veneto, Italia"
VIA CAMPAGNA,ARSIE',"Via Campagna, C. Placido, Arsiè, Belluno, Veneto, Italia","{'type': 'Point', 'coordinates': [11.7623224, 45.9645844]}","VIA CAMPAGNA, ARSIE', Belluno, Veneto, Italia"
VIA CANEVAL,ARSIE',"Via Caneval, C. Mason, Arsiè, Belluno, Veneto, Italia","{'type': 'Point', 'coordinates': [11.7559622, 45.977422]}","VIA CANEVAL, ARSIE', Belluno, Veneto, Italia"
VIA CANOVA,ARSIE',"Via Canova, Sassei, Arsiè, Belluno, Veneto, Italia","{'type': 'Point', 'coordinates': [11.7567354, 45.9819459]}","VIA CANOVA, ARSIE', Belluno, Veneto, Italia"
VIA CARAZZAGNO,ARSIE',"Val Carazzagno, Arsiè, Belluno, Veneto, Italia","{'type': 'Point', 'coordinates': [11.7714939, 45.9517948]}","VIA CARAZZAGNO, ARSIE', Belluno, Veneto, Italia"
VIA CASERE,ARSIE',"Casere, Arsiè, Belluno, Veneto, 36052, Italia","{'type': 'Point', 'coordinates': [11.7305399, 45.9382449]}","VIA CASERE, ARSIE', Belluno, Veneto, Italia"
VIA CESARE BATTISTI,ARSIE',"Via Cesare Battisti, Sassei, Arsiè, Belluno, Veneto, Italia","{'type': 'Point', 'coordinates': [11.7551878, 45.9822009]}","VIA CESARE BATTISTI, ARSIE', Belluno, Veneto, Italia"
LARGO TARIN,AURONZO DI CADORE,"Largo Tarin, Cima Gogna, Auronzo di Cadore, Belluno, Veneto, Italia","{'type': 'Point', 'coordinates': [12.4434034, 46.5516977]}","LARGO TARIN, AURONZO DI CADORE, Belluno, Veneto, Italia"
VIA AMBATA,AURONZO DI CADORE,"Via Ambata, Reane, Auronzo di Cadore, Belluno, Veneto, Italia","{'type': 'Point', 'coordinates': [12.4207302, 46.5621504]}","VIA AMBATA, AURONZO DI CADORE, Belluno, Veneto, Italia"
VIA ANSIEI,AURONZO DI CADORE,"Ansiei, Auronzo di Cadore, Belluno, Veneto, 32041, Italia","{'type': 'Point', 'coordinates': [12.3511437, 46.5662297]}","VIA ANSIEI, AURONZO DI CADORE, Belluno, Veneto, Italia"
VIA ANTONIO BERTI,AURONZO DI CADORE,"Via Antonio Berti, Reane, Cima Gogna, Auronzo di Cadore, Belluno, Veneto, Italia","{'type': 'Point', 'coordinates': [12.4334983, 46.5538214]}","VIA ANTONIO BERTI, AURONZO DI CADORE, Belluno, Veneto, Italia"
VIA CELLA,AURONZO DI CADORE,"Via Cella, Cima Gogna, Auronzo di Cadore, Belluno, Veneto, Italia","{'type': 'Point', 'coordinates': [12.4608724, 46.5424794]}","VIA CELLA, AURONZO DI CADORE, Belluno, Veneto, Italia"
VIA CIASTEL,AURONZO DI CADORE,"Via Ciastel, Reane, Cima Gogna, Auronzo di Cadore, Belluno, Veneto, Italia","{'type': 'Point', 'coordinates': [12.4342922, 46.5531353]}","VIA CIASTEL, AURONZO DI CADORE, Belluno, Veneto, Italia"
VIA CIMA GOGNA,AURONZO DI CADORE,"Cima Gogna, Auronzo di Cadore, Belluno, Veneto, 32040, Italia","{'type': 'Point', 'coordinates': [12.4626993, 46.5132165]}","VIA CIMA GOGNA, AURONZO DI CADORE, Belluno, Veneto, Italia"
VIA CORTE,AURONZO DI CADORE,"Via Corte, Cima Gogna, Auronzo di Cadore, Belluno, Veneto, Italia","{'type': 'Point', 'coordinates': [12.4407798, 46.5523463]}","VIA CORTE, AURONZO DI CADORE, Belluno, Veneto, Italia"
VIA DE FILIPPO,AURONZO DI CADORE,"Via De Filippo, Cima Gogna, Auronzo di Cadore, Belluno, Veneto, Italia","{'type': 'Point', 'coordinates': [12.453825, 46.5473445]}","VIA DE FILIPPO, AURONZO DI CADORE, Belluno, Veneto, Italia"
VIA DELLA GROTTA,AURONZO DI CADORE,"Via della Grotta, Cima Gogna, Auronzo di Cadore, Belluno, Veneto, Italia","{'type': 'Point', 'coordinates': [12.4559872, 46.5464193]}","VIA DELLA GROTTA, AURONZO DI CADORE, Belluno, Veneto, Italia"
VIA DELL'ANGELO,AURONZO DI CADORE,"Via dell'Angelo, Cima Gogna, Auronzo di Cadore, Belluno, Veneto, Italia","{'type': 'Point', 'coordinates': [12.4624242, 46.5423583]}","VIA DELL'ANGELO, AURONZO DI CADORE, Belluno, Veneto, Italia"
LOCALITA' PONTE DOLOMITI,BELLUNO,"Ponte Dolomiti, Borgo Piave, Cavessago, Belluno, Veneto, 32100, Italia","{'type': 'Point', 'coordinates': [12.2270211, 46.1343663]}"," PONTE DOLOMITI, BELLUNO, Belluno, Veneto, Italia"
PIAZZA CASTELLO,BELLUNO,"Piazza Castello, Lambioi, Cavessago, Belluno, Veneto, 32100, Italia","{'type': 'Point', 'coordinates': [12.21591, 46.1382967]}","PIAZZA CASTELLO, BELLUNO, Belluno, Veneto, Italia"
PIAZZA DEI MARTIRI,BELLUNO,"Piazza dei Martiri, Lambioi, Cavessago, Belluno, Veneto, 32100, Italia","{'type': 'Point', 'coordinates': [12.2151491, 46.139201]}","PIAZZA DEI MARTIRI, BELLUNO, Belluno, Veneto, Italia"
PIAZZA DUOMO,BELLUNO,"Piazza Duomo, Cies, Lamon, Belluno, Veneto, 32033, Italia","{'type': 'Point', 'coordinates': [11.7488666, 46.0471772]}","PIAZZA DUOMO, BELLUNO, Belluno, Veneto, Italia"
PIAZZA MERCATO,BELLUNO,"Piazza Mercato, Cesiominore, Cesiomaggiore, Belluno, Veneto, Italia","{'type': 'Point', 'coordinates': [11.9870217, 46.0884113]}","PIAZZA MERCATO, BELLUNO, Belluno, Veneto, Italia"
PIAZZA OLTRARDO,BELLUNO,"Piazza Oltrardo, Cavarzano, Vezzano, Belluno, Veneto, 32100, Italia","{'type': 'Point', 'coordinates': [12.2105707, 46.148237]}","PIAZZA OLTRARDO, BELLUNO, Belluno, Veneto, Italia"
PIAZZA S.LUCANO BORGO PRA,BELLUNO,"Piazza San Lucano, Borgo Prà, Cavessago, Belluno, Veneto, 32100, Italia","{'type': 'Point', 'coordinates': [12.222248, 46.142189]}","PIAZZA S.LUCANO BORGO PRA, BELLUNO, Belluno, Veneto, Italia"
PIAZZA SANTO STEFANO,BELLUNO,"Piazza Santo Stefano, Borgo Prà, Cavessago, Belluno, Veneto, 32100, Italia","{'type': 'Point', 'coordinates': [12.2183966, 46.1408033]}","PIAZZA SANTO STEFANO, BELLUNO, Belluno, Veneto, Italia"
PIAZZALE DELLA STAZIONE,BELLUNO,"Piazzale della Stazione, Lambioi, Vezzano, Belluno, Veneto, 32100, Italia","{'type': 'Point', 'coordinates': [12.2107395, 46.1412043]}","PIAZZALE DELLA STAZIONE, BELLUNO, Belluno, Veneto, Italia"
PIAZZALE NEVEGAL,BELLUNO,"Piazzale Nevegal, Nevegal, Belluno, Veneto, Italia","{'type': 'Point', 'coordinates': [12.2826739, 46.0935117]}","PIAZZALE NEVEGAL, BELLUNO, Belluno, Veneto, Italia"
PIAZZALE RESISTENZA,BELLUNO,"Piazzale Resistenza, Cima i Pra, Rione Santa Caterina, Ponte nelle Alpi, Belluno, Veneto, 32014, Italia","{'type': 'Point', 'coordinates': [12.2826686, 46.1802794]}","PIAZZALE RESISTENZA, BELLUNO, Belluno, Veneto, Italia"
PIAZZALE STAZIONE,BELLUNO,"Stazione, Via Antonio Cantore, Grava, Crignes, Cortina d'Ampezzo, Belluno, Veneto, 32043, Italia","{'type': 'Point', 'coordinates': [12.137127617545264, 46.539748450000005]}","PIAZZALE STAZIONE, BELLUNO, Belluno, Veneto, Italia"
PIAZZALE VITTIME DELLE FOIBE,BELLUNO,"Piazzale Vittime delle Foibe, Lambioi, Vezzano, Belluno, Veneto, 32100, Italia","{'type': 'Point', 'coordinates': [12.2103202, 46.141089]}","PIAZZALE VITTIME DELLE FOIBE, BELLUNO, Belluno, Veneto, Italia"
VIA 10 MARZO 1945,BELLUNO,"Via 10 marzo 1945, Mussoi, Vezzano, Belluno, Veneto, 32100, Italia","{'type': 'Point', 'coordinates': [12.1887717, 46.142765]}","VIA 10 MARZO 1945, BELLUNO, Belluno, Veneto, Italia"
VIA ANTELAO,BORCA DI CADORE,"Via Antelao, Villanova, Borca di Cadore, Belluno, Veneto, 32046, Italia","{'type': 'Point', 'coordinates': [12.2265644, 46.4326429]}","VIA ANTELAO, BORCA DI CADORE, Belluno, Veneto, Italia"
VIA CAVOUR,BORCA DI CADORE,"Via Cavour, Villanova, Borca di Cadore, Belluno, Veneto, 32046, Italia","{'type': 'Point', 'coordinates': [12.2280514, 46.4282594]}","VIA CAVOUR, BORCA DI CADORE, Belluno, Veneto, Italia"
VIA CROERA,BORCA DI CADORE,"Via Croera, Villanova, Borca di Cadore, Belluno, Veneto, 32046, Italia","{'type': 'Point', 'coordinates': [12.2214508, 46.4384313]}","VIA CROERA, BORCA DI CADORE, Belluno, Veneto, Italia"
VIA DEL CRISTO,BORCA DI CADORE,"Via del Cristo, Villanova, Borca di Cadore, Belluno, Veneto, 32046, Italia","{'type': 'Point', 'coordinates': [12.2063979, 46.4399662]}","VIA DEL CRISTO, BORCA DI CADORE, Belluno, Veneto, Italia"
VIA DELLA CHIESA,BORCA DI CADORE,"Via della Chiesa, Villanova, Borca di Cadore, Belluno, Veneto, 32046, Italia","{'type': 'Point', 'coordinates': [12.2174515, 46.4365167]}","VIA DELLA CHIESA, BORCA DI CADORE, Belluno, Veneto, Italia"
VIA ENRICO MATTEI,BORCA DI CADORE,"Via Enrico Mattei, Villanova, Borca di Cadore, Belluno, Veneto, 32046, Italia","{'type': 'Point', 'coordinates': [12.2381761, 46.429485]}","VIA ENRICO MATTEI, BORCA DI CADORE, Belluno, Veneto, Italia"
VIA FERRANDINA,BORCA DI CADORE,"Via Ferrandina, Villanova, Borca di Cadore, Belluno, Veneto, 32046, Italia","{'type': 'Point', 'coordinates': [12.2365363, 46.4265707]}","VIA FERRANDINA, BORCA DI CADORE, Belluno, Veneto, Italia"
VIA FUSINELES,BORCA DI CADORE,"Via Fusineles, Villanova, Borca di Cadore, Belluno, Veneto, 32046, Italia","{'type': 'Point', 'coordinates': [12.2186849, 46.4341828]}","VIA FUSINELES, BORCA DI CADORE, Belluno, Veneto, Italia"
VIA GIUSEPPE GARIBALDI,BORCA DI CADORE,"Via Giuseppe Garibaldi, Villanova, Borca di Cadore, Belluno, Veneto, 32046, Italia","{'type': 'Point', 'coordinates': [12.2219355, 46.4358387]}","VIA GIUSEPPE GARIBALDI, BORCA DI CADORE, Belluno, Veneto, Italia"
VIA LA VARES,BORCA DI CADORE,"Via La Vares, Villanova, Borca di Cadore, Belluno, Veneto, 32046, Italia","{'type': 'Point', 'coordinates': [12.2110527, 46.4388962]}","VIA LA VARES, BORCA DI CADORE, Belluno, Veneto, Italia"
VIA MARCONI,BORCA DI CADORE,"Via Marconi, Villanova, Borca di Cadore, Belluno, Veneto, 32046, Italia","{'type': 'Point', 'coordinates': [12.2249993, 46.4316687]}","VIA MARCONI, BORCA DI CADORE, Belluno, Veneto, Italia"
VIA METANOPOLI,BORCA DI CADORE,"Via Metanopoli, Villanova, Borca di Cadore, Belluno, Veneto, 32046, Italia","{'type': 'Point', 'coordinates': [12.2323293, 46.4333573]}","VIA METANOPOLI, BORCA DI CADORE, Belluno, Veneto, Italia"
VIA OLIVO SALA - VILLANOVA,BORCA DI CADORE,"Via Olivo Sala, Villanova, Borca di Cadore, Belluno, Veneto, 32046, Italia","{'type': 'Point', 'coordinates': [12.2075787, 46.4414656]}","VIA OLIVO SALA - VILLANOVA, BORCA DI CADORE, Belluno, Veneto, Italia"
VIA PARABELUN,BORCA DI CADORE,"Via Parabelun, Villanova, Borca di Cadore, Belluno, Veneto, 32046, Italia","{'type': 'Point', 'coordinates': [12.2027361, 46.4423285]}","VIA PARABELUN, BORCA DI CADORE, Belluno, Veneto, Italia"
VIA PEZES,BORCA DI CADORE,"Via Pezes, Villanova, Borca di Cadore, Belluno, Veneto, 32046, Italia","{'type': 'Point', 'coordinates': [12.2037716, 46.4446365]}","VIA PEZES, BORCA DI CADORE, Belluno, Veneto, Italia"
VIA ROMA,BORCA DI CADORE,"Borca di Cadore, Belluno, Veneto, Italia","{'type': 'Point', 'coordinates': [12.219598, 46.436423]}","VIA ROMA, BORCA DI CADORE, Belluno, Veneto, Italia"
VIA S. ROCCO,BORCA DI CADORE,"Via San Rocco, Villanova, Borca di Cadore, Belluno, Veneto, 32046, Italia","{'type': 'Point', 'coordinates': [12.2242446, 46.4326483]}","VIA S. ROCCO, BORCA DI CADORE, Belluno, Veneto, Italia"
VIA SALIETO,BORCA DI CADORE,"Via Salieto, Villanova, Borca di Cadore, Belluno, Veneto, 32046, Italia","{'type': 'Point', 'coordinates': [12.2145003, 46.4381912]}","VIA SALIETO, BORCA DI CADORE, Belluno, Veneto, Italia"
VIA TAULEN MARCEANA,BORCA DI CADORE,"Via Taulen Marceana, Villanova, Borca di Cadore, Belluno, Veneto, 32046, Italia","{'type': 'Point', 'coordinates': [12.2107865, 46.4420776]}","VIA TAULEN MARCEANA, BORCA DI CADORE, Belluno, Veneto, Italia"
LOCALITA' LA BELLA,CALALZO DI CADORE,"Via La Bella, Molinà, Calalzo di Cadore, Belluno, Veneto, 32042, Italia","{'type': 'Point', 'coordinates': [12.3861119, 46.4432306]}"," LA BELLA, CALALZO DI CADORE, Belluno, Veneto, Italia"
LOCALITA' PRACIADELAN,CALALZO DI CADORE,"Praciadelan, Rizzios, Calalzo di Cadore, Belluno, Veneto, Italia","{'type': 'Point', 'coordinates': [12.3412374, 46.471887]}"," PRACIADELAN, CALALZO DI CADORE, Belluno, Veneto, Italia"
LOCALITA' TUORO,CALALZO DI CADORE,"tuoro, Rizzios, Calalzo di Cadore, Belluno, Veneto, 32044, Italia","{'type': 'Point', 'coordinates': [12.3443582, 46.4670995]}"," TUORO, CALALZO DI CADORE, Belluno, Veneto, Italia"
PIAZZA IV NOVEMBRE,CALALZO DI CADORE,"Piazza IV Novembre, Molinà, Calalzo di Cadore, Belluno, Veneto, 32042, Italia","{'type': 'Point', 'coordinates': [12.3802096, 46.4468978]}","PIAZZA IV NOVEMBRE, CALALZO DI CADORE, Belluno, Veneto, Italia"
VIA ANTELAO,CALALZO DI CADORE,"Via Antelao, Rizzios, Calalzo di Cadore, Belluno, Veneto, 32042, Italia","{'type': 'Point', 'coordinates': [12.375777, 46.4497464]}","VIA ANTELAO, CALALZO DI CADORE, Belluno, Veneto, Italia"
VIA GIOVANNI XXIII,CALALZO DI CADORE,"Via Giovanni XXIII, Molinà, Calalzo di Cadore, Belluno, Veneto, 32042, Italia","{'type': 'Point', 'coordinates': [12.3816834, 46.4458423]}","VIA GIOVANNI XXIII, CALALZO DI CADORE, Belluno, Veneto, Italia"
VIA LAGOLE,CALALZO DI CADORE,"Via Lagole, Molinà, Calalzo di Cadore, Belluno, Veneto, 32042, Italia","{'type': 'Point', 'coordinates': [12.3870268, 46.445008]}","VIA LAGOLE, CALALZO DI CADORE, Belluno, Veneto, Italia"
VIA LIGURIA,CALALZO DI CADORE,"Via Liguria, Molinà, Calalzo di Cadore, Belluno, Veneto, 32042, Italia","{'type': 'Point', 'coordinates': [12.3807716, 46.4462178]}","VIA LIGURIA, CALALZO DI CADORE, Belluno, Veneto, Italia"
VIA MARMAROLE,CALALZO DI CADORE,"Via Marmarole, Molinà, Calalzo di Cadore, Belluno, Veneto, 32042, Italia","{'type': 'Point', 'coordinates': [12.3819557, 46.4407935]}","VIA MARMAROLE, CALALZO DI CADORE, Belluno, Veneto, Italia"
VIA MOLINA',CALALZO DI CADORE,"Via Molinà, Molinà, Calalzo di Cadore, Belluno, Veneto, 32042, Italia","{'type': 'Point', 'coordinates': [12.3878155, 46.4476638]}","VIA MOLINA', CALALZO DI CADORE, Belluno, Veneto, Italia"
FRAZIONE FEDER,CANALE D'AGORDO,"Feder, Canale d'Agordo, Belluno, Veneto, Italia","{'type': 'Point', 'coordinates': [11.895968869620255, 46.3754967]}"," FEDER, CANALE D'AGORDO, Belluno, Veneto, Italia"
FRAZIONE FREGONA,CANALE D'AGORDO,"Fregona, Canale d'Agordo, Belluno, Veneto, Italia","{'type': 'Point', 'coordinates': [11.9058946, 46.3689088]}"," FREGONA, CANALE D'AGORDO, Belluno, Veneto, Italia"
LOCALITA' CARFON,CANALE D'AGORDO,"Carfon, Canale d'Agordo, Belluno, Veneto, Italia","{'type': 'Point', 'coordinates': [11.921652221659768, 46.3668127]}"," CARFON, CANALE D'AGORDO, Belluno, Veneto, Italia"
LOCALITA' COLMEAN,CANALE D'AGORDO,"Colmean, Canale d'Agordo, Belluno, Veneto, Italia","{'type': 'Point', 'coordinates': [11.89179646443055, 46.3773113]}"," COLMEAN, CANALE D'AGORDO, Belluno, Veneto, Italia"
LOCALITA' GARES,CANALE D'AGORDO,"Gares, Belluno, Veneto, Italia","{'type': 'Point', 'coordinates': [11.8814448, 46.3126645]}"," GARES, CANALE D'AGORDO, Belluno, Veneto, Italia"
LOCALITA' LA MORA,CANALE D'AGORDO,"La Mora, Canale d'Agordo, Belluno, Veneto, Italia","{'type': 'Point', 'coordinates': [11.901134, 46.3636541]}"," LA MORA, CANALE D'AGORDO, Belluno, Veneto, Italia"
LOCALITA' LAGAZZON,CANALE D'AGORDO,"Rifugio Lagazzon, Via Fregona, Vallada Agordina, Belluno, Veneto, Italia","{'type': 'Point', 'coordinates': [11.910301225611853, 46.38072645]}"," LAGAZZON, CANALE D'AGORDO, Belluno, Veneto, Italia"
LOCALITA' PISOLIVA,CANALE D'AGORDO,"Pisoliva, La Mora, Canale d'Agordo, Belluno, Veneto, Italia","{'type': 'Point', 'coordinates': [11.8982529, 46.366186]}"," PISOLIVA, CANALE D'AGORDO, Belluno, Veneto, Italia"
LOCALITA' TEGOSA,CANALE D'AGORDO,"Torrente Tegosa, Canale d'Agordo, Belluno, Veneto, Italia","{'type': 'Point', 'coordinates': [11.9055454, 46.376642]}"," TEGOSA, CANALE D'AGORDO, Belluno, Veneto, Italia"
LOCALITA' VAL,CANALE D'AGORDO,"Val della Pissa, Canale d'Agordo, Belluno, Veneto, Italia","{'type': 'Point', 'coordinates': [11.9258486, 46.3533441]}"," VAL, CANALE D'AGORDO, Belluno, Veneto, Italia"
PIAZZA PAPA LUCIANI,CANALE D'AGORDO,"Piazza Papa Luciani, Fregona, Canale d'Agordo, Belluno, Veneto, Italia","{'type': 'Point', 'coordinates': [11.914493, 46.3606796]}","PIAZZA PAPA LUCIANI, CANALE D'AGORDO, Belluno, Veneto, Italia"
