alias_address,alias_city,geocode,geometry,georeferencingString
LOCALITA' MACCHIETTO,PERAROLO DI CADORE,"Macchietto, Perarolo di Cadore, Belluno, Veneto, Italia","{'type': 'Point', 'coordinates': [12.3547676, 46.371628]}"," MACCHIETTO, PERAROLO DI CADORE, Belluno, Veneto, Italia"
PIAZZA ROMA,PERAROLO DI CADORE,"Piazza Roma, Perarolo di Cadore, Belluno, Veneto, 32044, Italia","{'type': 'Point', 'coordinates': [12.3554276, 46.3970828]}","PIAZZA ROMA, PERAROLO DI CADORE, Belluno, Veneto, Italia"
VIA COL DE ZORDO,PERAROLO DI CADORE,"Via Col de Zordo, Perarolo di Cadore, Belluno, Veneto, 32044, Italia","{'type': 'Point', 'coordinates': [12.358079, 46.3971777]}","VIA COL DE ZORDO, PERAROLO DI CADORE, Belluno, Veneto, Italia"
VIA REGINA MARGHERITA,PERAROLO DI CADORE,"Via Regina Margherita, Perarolo di Cadore, Belluno, Veneto, 32044, Italia","{'type': 'Point', 'coordinates': [12.3560783, 46.3959946]}","VIA REGINA MARGHERITA, PERAROLO DI CADORE, Belluno, Veneto, Italia"
VIA ROMANA,PERAROLO DI CADORE,"Via Romana, Perarolo di Cadore, Belluno, Veneto, 32044, Italia","{'type': 'Point', 'coordinates': [12.3558207, 46.3952416]}","VIA ROMANA, PERAROLO DI CADORE, Belluno, Veneto, Italia"
VIA SANT'ANNA,PERAROLO DI CADORE,"Via Sant'Anna, Perarolo di Cadore, Belluno, Veneto, 32044, Italia","{'type': 'Point', 'coordinates': [12.3558331, 46.3927132]}","VIA SANT'ANNA, PERAROLO DI CADORE, Belluno, Veneto, Italia"
GALLERIA CENTRO,PIEVE DI CADORE,"Galleria di San Alipio, Sottocastello di Cadore, Pieve di Cadore, Belluno, Veneto, 32044, Italia","{'type': 'Point', 'coordinates': [12.3824619, 46.4301097]}","GALLERIA CENTRO, PIEVE DI CADORE, Belluno, Veneto, Italia"
GRADINATA BELVEDERE,PIEVE DI CADORE,"Scalinata Belvedere, Pieve di Cadore, Sottocastello di Cadore, Pieve di Cadore, Belluno, Veneto, 32044, Italia","{'type': 'Point', 'coordinates': [12.3763416, 46.4292776]}","GRADINATA BELVEDERE, PIEVE DI CADORE, Belluno, Veneto, Italia"
PIAZZA MUNICIPIO,PIEVE DI CADORE,"Piazza Municipio, Pieve di Cadore, Sottocastello di Cadore, Pieve di Cadore, Belluno, Veneto, 32044, Italia","{'type': 'Point', 'coordinates': [12.3747598, 46.4293076]}","PIAZZA MUNICIPIO, PIEVE DI CADORE, Belluno, Veneto, Italia"
PIAZZA TIZIANO,PIEVE DI CADORE,"Piazza Tiziano, Pieve di Cadore, Sottocastello di Cadore, Pieve di Cadore, Belluno, Veneto, Italia","{'type': 'Point', 'coordinates': [12.37530706570811, 46.42807945]}","PIAZZA TIZIANO, PIEVE DI CADORE, Belluno, Veneto, Italia"
PIAZZALE DOLOMITI,PIEVE DI CADORE,"Piazzale Dolomiti, Tai di Cadore, Pieve di Cadore, Belluno, Veneto, 32040, Italia","{'type': 'Point', 'coordinates': [12.3599348, 46.4227279]}","PIAZZALE DOLOMITI, PIEVE DI CADORE, Belluno, Veneto, Italia"
VALCALDA,PIEVE DI CADORE,"Cristo di Valcalda, Via Nazionale, Pieve di Cadore, Sottocastello di Cadore, Pieve di Cadore, Belluno, Veneto, 32044, Italia","{'type': 'Point', 'coordinates': [12.369348350000012, 46.426418850000005]}","VALCALDA, PIEVE DI CADORE, Belluno, Veneto, Italia"
VIA ANTONIO ROSSO,PIEVE DI CADORE,"Via Antonio Rosso, Tai di Cadore, Pieve di Cadore, Belluno, Veneto, 32040, Italia","{'type': 'Point', 'coordinates': [12.3603131, 46.4247881]}","VIA ANTONIO ROSSO, PIEVE DI CADORE, Belluno, Veneto, Italia"
VIA ARCOLE,PIEVE DI CADORE,"Via Arcole, Sottocastello di Cadore, Pieve di Cadore, Belluno, Veneto, 32044, Italia","{'type': 'Point', 'coordinates': [12.3754082, 46.421316]}","VIA ARCOLE, PIEVE DI CADORE, Belluno, Veneto, Italia"
VIA ARSENALE,PIEVE DI CADORE,"Via Arsenale, Pieve di Cadore, Sottocastello di Cadore, Pieve di Cadore, Belluno, Veneto, 32044, Italia","{'type': 'Point', 'coordinates': [12.3735398, 46.426512]}","VIA ARSENALE, PIEVE DI CADORE, Belluno, Veneto, Italia"
VIA BELVEDERE,PIEVE DI CADORE,"Via Belvedere, Pieve di Cadore, Tai di Cadore, Pieve di Cadore, Belluno, Veneto, 32040, Italia","{'type': 'Point', 'coordinates': [12.3643531, 46.4282332]}","VIA BELVEDERE, PIEVE DI CADORE, Belluno, Veneto, Italia"
FRAZIONE ARSIE',PONTE NELLE ALPI,"Arsiè, Frazione Arsiè, Reveane, Ponte nelle Alpi, Belluno, Veneto, 32015, Italia","{'type': 'Point', 'coordinates': [12.3279915, 46.1718801]}"," ARSIE', PONTE NELLE ALPI, Belluno, Veneto, Italia"
FRAZIONE CADOLA,PONTE NELLE ALPI,"Cadola, Frazione Cadola, Canevoi, Ponte nelle Alpi, Belluno, Veneto, 32014, Italia","{'type': 'Point', 'coordinates': [12.3022863, 46.1740085]}"," CADOLA, PONTE NELLE ALPI, Belluno, Veneto, Italia"
FRAZIONE CANEVOI,PONTE NELLE ALPI,"Canevoi, Ponte nelle Alpi, Belluno, Veneto, 32014, Italia","{'type': 'Point', 'coordinates': [12.2965469, 46.1719137]}"," CANEVOI, PONTE NELLE ALPI, Belluno, Veneto, Italia"
FRAZIONE CASAN,PONTE NELLE ALPI,"Casan, Strada Provinciale n. 4 della Val Cantuna, Maset, Ponte nelle Alpi, Belluno, Veneto, 32014, Italia","{'type': 'Point', 'coordinates': [12.320623, 46.1753971]}"," CASAN, PONTE NELLE ALPI, Belluno, Veneto, Italia"
FRAZIONE COL DI CUGNAN,PONTE NELLE ALPI,"Col di Cugnan, Ponte nelle Alpi, Belluno, Veneto, 32014, Italia","{'type': 'Point', 'coordinates': [12.2971029, 46.1525762]}"," COL DI CUGNAN, PONTE NELLE ALPI, Belluno, Veneto, Italia"
FRAZIONE CORNOLADE,PONTE NELLE ALPI,"Cornolade Basse, Ponte nelle Alpi, Belluno, Veneto, 32015, Italia","{'type': 'Point', 'coordinates': [12.3152393, 46.1250989]}"," CORNOLADE, PONTE NELLE ALPI, Belluno, Veneto, Italia"
FRAZIONE CUGNAN,PONTE NELLE ALPI,"Cugnan, Ponte nelle Alpi, Belluno, Veneto, 32014, Italia","{'type': 'Point', 'coordinates': [12.2915523, 46.1569361]}"," CUGNAN, PONTE NELLE ALPI, Belluno, Veneto, Italia"
FRAZIONE LA SECCA,PONTE NELLE ALPI,"La Secca, Ponte nelle Alpi, Belluno, Veneto, 32015, Italia","{'type': 'Point', 'coordinates': [12.3169461, 46.1361644]}"," LA SECCA, PONTE NELLE ALPI, Belluno, Veneto, Italia"
FRAZIONE LASTREGHE,PONTE NELLE ALPI,"Lastreghe, Ponte nelle Alpi, Belluno, Veneto, 32014, Italia","{'type': 'Point', 'coordinates': [12.2775588, 46.1681218]}"," LASTREGHE, PONTE NELLE ALPI, Belluno, Veneto, Italia"
FRAZIONE LIZZONA,PONTE NELLE ALPI,"Lizzona, Ponte nelle Alpi, Belluno, Veneto, 32015, Italia","{'type': 'Point', 'coordinates': [12.3166561, 46.1412592]}"," LIZZONA, PONTE NELLE ALPI, Belluno, Veneto, Italia"
FRAZIONE LOSEGO,PONTE NELLE ALPI,"Losego, Frazione Losego, Roncan, Ponte nelle Alpi, Belluno, Veneto, 32014, Italia","{'type': 'Point', 'coordinates': [12.283502, 46.1422396]}"," LOSEGO, PONTE NELLE ALPI, Belluno, Veneto, Italia"
FRAZIONE PIAIA,PONTE NELLE ALPI,"Piaia, Ponte nelle Alpi, Belluno, Veneto, 32014, Italia","{'type': 'Point', 'coordinates': [12.2958628, 46.1675118]}"," PIAIA, PONTE NELLE ALPI, Belluno, Veneto, Italia"
FRAZIONE PIAN DI VEDOIA,PONTE NELLE ALPI,"Pian di Vedoia, Ponte nelle Alpi, Belluno, Veneto, 32014, Italia","{'type': 'Point', 'coordinates': [12.285579, 46.2020598]}"," PIAN DI VEDOIA, PONTE NELLE ALPI, Belluno, Veneto, Italia"
FRAZIONE QUANTIN,PONTE NELLE ALPI,"Quantin, Ponte nelle Alpi, Belluno, Veneto, Italia","{'type': 'Point', 'coordinates': [12.2981134, 46.1246564]}"," QUANTIN, PONTE NELLE ALPI, Belluno, Veneto, Italia"
FRAZIONE REVEANE,PONTE NELLE ALPI,"Reveane, Ponte nelle Alpi, Belluno, Veneto, 32015, Italia","{'type': 'Point', 'coordinates': [12.3279697, 46.1673388]}"," REVEANE, PONTE NELLE ALPI, Belluno, Veneto, Italia"
FRAZIONE RONCAN,PONTE NELLE ALPI,"Roncan, Ponte nelle Alpi, Belluno, Veneto, 32014, Italia","{'type': 'Point', 'coordinates': [12.2986801, 46.1468732]}"," RONCAN, PONTE NELLE ALPI, Belluno, Veneto, Italia"
FRAZIONE VICH,PONTE NELLE ALPI,"Vich, Ponte nelle Alpi, Belluno, Veneto, 32014, Italia","{'type': 'Point', 'coordinates': [12.3100361, 46.1535035]}"," VICH, PONTE NELLE ALPI, Belluno, Veneto, Italia"
LOCALITA' MAZZUCCHI,PONTE NELLE ALPI,"Mazzucchi, Ponte nelle Alpi, Belluno, Veneto, 32015, Italia","{'type': 'Point', 'coordinates': [12.3355987, 46.1637895]}"," MAZZUCCHI, PONTE NELLE ALPI, Belluno, Veneto, Italia"
LOCALITA' PUS,PONTE NELLE ALPI,"Pus, Ponte nelle Alpi, Belluno, Veneto, Italia","{'type': 'Point', 'coordinates': [12.2846941, 46.1168678]}"," PUS, PONTE NELLE ALPI, Belluno, Veneto, Italia"
PIAZZETTA BIVIO,PONTE NELLE ALPI,"Piazzetta Bivio, Cima i Pra, Rione Santa Caterina, Ponte nelle Alpi, Belluno, Veneto, Italia","{'type': 'Point', 'coordinates': [12.2831997, 46.1794092]}","PIAZZETTA BIVIO, PONTE NELLE ALPI, Belluno, Veneto, Italia"
RIONE SANTA CATERINA,PONTE NELLE ALPI,"Rione Santa Caterina, Ponte nelle Alpi, Belluno, Veneto, 32014, Italia","{'type': 'Point', 'coordinates': [12.2834534, 46.1722885]}","RIONE SANTA CATERINA, PONTE NELLE ALPI, Belluno, Veneto, Italia"
VIA ANGOLETTA,RIVAMONTE AGORDINO,"Angoletta, Rivamonte Agordino, Belluno, Veneto, 32021, Italia","{'type': 'Point', 'coordinates': [12.0187917, 46.2423924]}","VIA ANGOLETTA, RIVAMONTE AGORDINO, Belluno, Veneto, Italia"
VIA CANOP,RIVAMONTE AGORDINO,"Via Canop, Tos, Miotte, Rivamonte Agordino, Belluno, Veneto, 32021, Italia","{'type': 'Point', 'coordinates': [12.0237731, 46.253929]}","VIA CANOP, RIVAMONTE AGORDINO, Belluno, Veneto, Italia"
VIA CASERA,RIVAMONTE AGORDINO,"Casera, Rivamonte Agordino, Belluno, Veneto, Italia","{'type': 'Point', 'coordinates': [12.0103472, 46.2354908]}","VIA CASERA, RIVAMONTE AGORDINO, Belluno, Veneto, Italia"
VIA LONIE,RIVAMONTE AGORDINO,"Lonie, Rivamonte Agordino, Belluno, Veneto, 32021, Italia","{'type': 'Point', 'coordinates': [12.0299013, 46.2659737]}","VIA LONIE, RIVAMONTE AGORDINO, Belluno, Veneto, Italia"
VIA MIOTTE,RIVAMONTE AGORDINO,"Miotte, Rivamonte Agordino, Belluno, Veneto, 32021, Italia","{'type': 'Point', 'coordinates': [12.0297296, 46.2597552]}","VIA MIOTTE, RIVAMONTE AGORDINO, Belluno, Veneto, Italia"
VIA MOTTES,RIVAMONTE AGORDINO,"Mottes, Rivamonte Agordino, Belluno, Veneto, 32021, Italia","{'type': 'Point', 'coordinates': [12.0309142, 46.2519002]}","VIA MOTTES, RIVAMONTE AGORDINO, Belluno, Veneto, Italia"
VIA PALUCH,RIVAMONTE AGORDINO,"Paluch, Rivamonte Agordino, Belluno, Veneto, 32021, Italia","{'type': 'Point', 'coordinates': [12.032272, 46.2687089]}","VIA PALUCH, RIVAMONTE AGORDINO, Belluno, Veneto, Italia"
VIA PEDANDOLA,RIVAMONTE AGORDINO,"Pedandola, Rivamonte Agordino, Belluno, Veneto, 32021, Italia","{'type': 'Point', 'coordinates': [12.0168178, 46.2451659]}","VIA PEDANDOLA, RIVAMONTE AGORDINO, Belluno, Veneto, Italia"
VIA ROMA,RIVAMONTE AGORDINO,"Via Roma, Tos, Miotte, Rivamonte Agordino, Belluno, Veneto, 32021, Italia","{'type': 'Point', 'coordinates': [12.0248377, 46.2547357]}","VIA ROMA, RIVAMONTE AGORDINO, Belluno, Veneto, Italia"
VIA ROSSON,RIVAMONTE AGORDINO,"Via Rosson, Tos, Zenich, Rivamonte Agordino, Belluno, Veneto, 32021, Italia","{'type': 'Point', 'coordinates': [12.022525, 46.253228]}","VIA ROSSON, RIVAMONTE AGORDINO, Belluno, Veneto, Italia"
VIA SARET,RIVAMONTE AGORDINO,"Saret, Rivamonte Agordino, Belluno, Veneto, 32021, Italia","{'type': 'Point', 'coordinates': [12.0337058, 46.2617305]}","VIA SARET, RIVAMONTE AGORDINO, Belluno, Veneto, Italia"
VIA SPIA,RIVAMONTE AGORDINO,"La Spia, Rivamonte Agordino, Belluno, Veneto, 32021, Italia","{'type': 'Point', 'coordinates': [12.017201, 46.2414677]}","VIA SPIA, RIVAMONTE AGORDINO, Belluno, Veneto, Italia"
VIA TOS,RIVAMONTE AGORDINO,"Tos, Angoletta, Rivamonte Agordino, Belluno, Veneto, 32021, Italia","{'type': 'Point', 'coordinates': [12.0218359, 46.2464187]}","VIA TOS, RIVAMONTE AGORDINO, Belluno, Veneto, Italia"
VIA VALCHESINA,RIVAMONTE AGORDINO,"Valchesina, Rivamonte Agordino, Belluno, Veneto, 32021, Italia","{'type': 'Point', 'coordinates': [12.0184725, 46.2383006]}","VIA VALCHESINA, RIVAMONTE AGORDINO, Belluno, Veneto, Italia"
VIA VILLAGRANDE,RIVAMONTE AGORDINO,"Via Villagrande, Tos, Pedandola, Rivamonte Agordino, Belluno, Veneto, 32021, Italia","{'type': 'Point', 'coordinates': [12.0193541, 46.2465156]}","VIA VILLAGRANDE, RIVAMONTE AGORDINO, Belluno, Veneto, Italia"
VIA ZENICH,RIVAMONTE AGORDINO,"Zenich, Rivamonte Agordino, Belluno, Veneto, 32021, Italia","{'type': 'Point', 'coordinates': [12.0310237, 46.2555406]}","VIA ZENICH, RIVAMONTE AGORDINO, Belluno, Veneto, Italia"
VIA ZEP,RIVAMONTE AGORDINO,"Zep, Rivamonte Agordino, Belluno, Veneto, 32021, Italia","{'type': 'Point', 'coordinates': [12.0361407, 46.2593439]}","VIA ZEP, RIVAMONTE AGORDINO, Belluno, Veneto, Italia"
LOCALITA' BRAMEZZA,ROCCA PIETORE,"Bramezza, Rocca Pietore, Belluno, Veneto, 32022, Italia","{'type': 'Point', 'coordinates': [11.9967212, 46.4148873]}"," BRAMEZZA, ROCCA PIETORE, Belluno, Veneto, Italia"
LOCALITA' CARACOI AGOIN,ROCCA PIETORE,"Caracoi Agoin, Rocca Pietore, Belluno, Veneto, 32022, Italia","{'type': 'Point', 'coordinates': [11.998819, 46.4235112]}"," CARACOI AGOIN, ROCCA PIETORE, Belluno, Veneto, Italia"
LOCALITA' CARACOI CIMAI,ROCCA PIETORE,"Caracoi Cimai, Rocca Pietore, Belluno, Veneto, 32022, Italia","{'type': 'Point', 'coordinates': [11.9895922, 46.4298674]}"," CARACOI CIMAI, ROCCA PIETORE, Belluno, Veneto, Italia"
LOCALITA' COL DI LASTE,ROCCA PIETORE,"Col, Rocca Pietore, Belluno, Veneto, Italia","{'type': 'Point', 'coordinates': [11.9661214, 46.4570631]}"," COL DI LASTE, ROCCA PIETORE, Belluno, Veneto, Italia"
LOCALITA' COL DI ROCCA,ROCCA PIETORE,"Col di Rocca, Belluno, Veneto, 32022, Italia","{'type': 'Point', 'coordinates': [11.962937, 46.4296899]}"," COL DI ROCCA, ROCCA PIETORE, Belluno, Veneto, Italia"
LOCALITA' COSTA,ROCCA PIETORE,"Costa de Sora, Rocca Pietore, Belluno, Veneto, 32022, Italia","{'type': 'Point', 'coordinates': [11.9742724, 46.4376914]}"," COSTA, ROCCA PIETORE, Belluno, Veneto, Italia"
LOCALITA' DAGAI,ROCCA PIETORE,"Dagai, Rocca Pietore, Belluno, Veneto, Italia","{'type': 'Point', 'coordinates': [11.9705074, 46.4537913]}"," DAGAI, ROCCA PIETORE, Belluno, Veneto, Italia"
LOCALITA' DAVARE,ROCCA PIETORE,"Davare, Rocca Pietore, Belluno, Veneto, Italia","{'type': 'Point', 'coordinates': [11.967961, 46.4536231]}"," DAVARE, ROCCA PIETORE, Belluno, Veneto, Italia"
LOCALITA' DIGONERA,ROCCA PIETORE,"Digonera, Rocca Pietore, Belluno, Veneto, Italia","{'type': 'Point', 'coordinates': [11.9704652, 46.4660327]}"," DIGONERA, ROCCA PIETORE, Belluno, Veneto, Italia"
LOCALITA' LASTE DI SOPRA,ROCCA PIETORE,"Laste di Sopra, Rocca Pietore, Belluno, Veneto, Italia","{'type': 'Point', 'coordinates': [11.9751251, 46.456484]}"," LASTE DI SOPRA, ROCCA PIETORE, Belluno, Veneto, Italia"
LOCALITA' LASTE DI SOTTO,ROCCA PIETORE,"Laste di Sotto, Rocca Pietore, Belluno, Veneto, 32022, Italia","{'type': 'Point', 'coordinates': [11.9762403, 46.4544875]}"," LASTE DI SOTTO, ROCCA PIETORE, Belluno, Veneto, Italia"
LOCALITA' LE COSTE,ROCCA PIETORE,"Le Coste, Rocca Pietore, Belluno, Veneto, 32022, Italia","{'type': 'Point', 'coordinates': [11.9749547, 46.4517869]}"," LE COSTE, ROCCA PIETORE, Belluno, Veneto, Italia"
LOCALITA' MALGA CIAPELA,ROCCA PIETORE,"Malga Ciapela, Rocca Pietore, Belluno, Veneto, 32023, Italia","{'type': 'Point', 'coordinates': [11.9117939, 46.4276747]}"," MALGA CIAPELA, ROCCA PIETORE, Belluno, Veneto, Italia"
LOCALITA' MASARE',ROCCA PIETORE,"Località Masarè, Saviner di Callòneghe, Rocca Pietore, Belluno, Veneto, 32022, Italia","{'type': 'Point', 'coordinates': [12.0114577, 46.4118786]}"," MASARE', ROCCA PIETORE, Belluno, Veneto, Italia"
LOCALITA' MOE',ROCCA PIETORE,"Moè, Rocca Pietore, Belluno, Veneto, Italia","{'type': 'Point', 'coordinates': [11.9632657, 46.4589217]}"," MOE', ROCCA PIETORE, Belluno, Veneto, Italia"
LOCALITA' PALUE,ROCCA PIETORE,"Palue, Rocca Pietore, Belluno, Veneto, 32023, Italia","{'type': 'Point', 'coordinates': [11.9456655, 46.4264923]}"," PALUE, ROCCA PIETORE, Belluno, Veneto, Italia"
LOCALITA' PEZZE',ROCCA PIETORE,"Pezzè, Rocca Pietore, Belluno, Veneto, 32022, Italia","{'type': 'Point', 'coordinates': [11.9837664, 46.4353596]}"," PEZZE', ROCCA PIETORE, Belluno, Veneto, Italia"
LOCALITA' PIAN,ROCCA PIETORE,"Pian, Rocca Pietore, Belluno, Veneto, 32023, Italia","{'type': 'Point', 'coordinates': [11.9440172, 46.4257146]}"," PIAN, ROCCA PIETORE, Belluno, Veneto, Italia"
LOCALITA' RONCH,ROCCA PIETORE,"Ronch, Rocca Pietore, Belluno, Veneto, 32022, Italia","{'type': 'Point', 'coordinates': [11.9769708, 46.4478456]}"," RONCH, ROCCA PIETORE, Belluno, Veneto, Italia"
LOCALITA' SAVINER DI LASTE,ROCCA PIETORE,"Savinèr di Laste, Rocca Pietore, Belluno, Veneto, 32022, Italia","{'type': 'Point', 'coordinates': [11.987327, 46.4402952]}"," SAVINER DI LASTE, ROCCA PIETORE, Belluno, Veneto, Italia"
LOCALITA' SOPPERA,ROCCA PIETORE,"Soppera, Rocca Pietore, Belluno, Veneto, Italia","{'type': 'Point', 'coordinates': [11.9725124, 46.4528935]}"," SOPPERA, ROCCA PIETORE, Belluno, Veneto, Italia"
LOCALITA' SOPRACORDEVOLE,ROCCA PIETORE,"Sopracordevole, Rocca Pietore, Belluno, Veneto, 32022, Italia","{'type': 'Point', 'coordinates': [11.9814218, 46.4523467]}"," SOPRACORDEVOLE, ROCCA PIETORE, Belluno, Veneto, Italia"
LOCALITA' SORARU',ROCCA PIETORE,"Sorarù, Rocca Pietore, Belluno, Veneto, 32022, Italia","{'type': 'Point', 'coordinates': [11.9722341, 46.4306915]}"," SORARU', ROCCA PIETORE, Belluno, Veneto, Italia"
LOCALITA' TROI,ROCCA PIETORE,"Troi, Rocca Pietore, Belluno, Veneto, 32022, Italia","{'type': 'Point', 'coordinates': [11.978792, 46.4379094]}"," TROI, ROCCA PIETORE, Belluno, Veneto, Italia"
LOCALITA' VAL,ROCCA PIETORE,"Val, Rocca Pietore, Belluno, Veneto, Italia","{'type': 'Point', 'coordinates': [11.970099, 46.4545307]}"," VAL, ROCCA PIETORE, Belluno, Veneto, Italia"
VIA MARMOLADA,ROCCA PIETORE,"Via Marmolada, Sorarù, Rocca Pietore, Belluno, Veneto, 32022, Italia","{'type': 'Point', 'coordinates': [11.9737313, 46.43256]}","VIA MARMOLADA, ROCCA PIETORE, Belluno, Veneto, Italia"
FRAZIONE PADERNO,SAN GREGORIO NELLE ALPI,"Paderno, San Gregorio nelle Alpi, Belluno, Veneto, 32035, Italia","{'type': 'Point', 'coordinates': [12.0574425, 46.1152694]}"," PADERNO, SAN GREGORIO NELLE ALPI, Belluno, Veneto, Italia"
FRAZIONE RONCOI,SAN GREGORIO NELLE ALPI,"loc. Roncoi di Fuori, Paderno, San Gregorio nelle Alpi, Belluno, Veneto, 32035, Italia","{'type': 'Point', 'coordinates': [12.0294893, 46.1152466]}"," RONCOI, SAN GREGORIO NELLE ALPI, Belluno, Veneto, Italia"
LOCALITA' ALCONIS,SAN GREGORIO NELLE ALPI,"Alconis, San Gregorio nelle Alpi, Belluno, Veneto, 32035, Italia","{'type': 'Point', 'coordinates': [12.0553556, 46.1206753]}"," ALCONIS, SAN GREGORIO NELLE ALPI, Belluno, Veneto, Italia"
LOCALITA' CARAZZAI,SAN GREGORIO NELLE ALPI,"Carazzai, Belluno, Veneto, 32035, Italia","{'type': 'Point', 'coordinates': [12.044835, 46.1120471]}"," CARAZZAI, SAN GREGORIO NELLE ALPI, Belluno, Veneto, Italia"
LOCALITA' LUNI,SAN GREGORIO NELLE ALPI,"Luni, San Gregorio nelle Alpi, Belluno, Veneto, 32035, Italia","{'type': 'Point', 'coordinates': [12.0572828, 46.1088802]}"," LUNI, SAN GREGORIO NELLE ALPI, Belluno, Veneto, Italia"
LOCALITA' MUIACH,SAN GREGORIO NELLE ALPI,"Muiach, Belluno, Veneto, 32035, Italia","{'type': 'Point', 'coordinates': [12.0239585, 46.0977547]}"," MUIACH, SAN GREGORIO NELLE ALPI, Belluno, Veneto, Italia"
LOCALITA' RONCOI DI DENTRO,SAN GREGORIO NELLE ALPI,"loc. Roncoi di Dentro, San Gregorio nelle Alpi, Belluno, Veneto, 32035, Italia","{'type': 'Point', 'coordinates': [12.021442, 46.1063083]}"," RONCOI DI DENTRO, SAN GREGORIO NELLE ALPI, Belluno, Veneto, Italia"
LOCALITA' RONCOI DI FUORI,SAN GREGORIO NELLE ALPI,"loc. Roncoi di Fuori, Paderno, San Gregorio nelle Alpi, Belluno, Veneto, 32035, Italia","{'type': 'Point', 'coordinates': [12.0294893, 46.1152466]}"," RONCOI DI FUORI, SAN GREGORIO NELLE ALPI, Belluno, Veneto, Italia"
LOCALITA' VELOS,SAN GREGORIO NELLE ALPI,"Velos, Belluno, Veneto, 32035, Italia","{'type': 'Point', 'coordinates': [12.0252661, 46.0925238]}"," VELOS, SAN GREGORIO NELLE ALPI, Belluno, Veneto, Italia"
VIA BELVEDERE,SAN GREGORIO NELLE ALPI,"Via Belvedere, San Gregorio nelle Alpi, Belluno, Veneto, 32035, Italia","{'type': 'Point', 'coordinates': [12.0176838, 46.1050778]}","VIA BELVEDERE, SAN GREGORIO NELLE ALPI, Belluno, Veneto, Italia"
VIA CAL LONGA,SAN GREGORIO NELLE ALPI,"Via Cal Longa, Luni, San Gregorio nelle Alpi, Belluno, Veneto, 32035, Italia","{'type': 'Point', 'coordinates': [12.0607274, 46.1118415]}","VIA CAL LONGA, SAN GREGORIO NELLE ALPI, Belluno, Veneto, Italia"
VIA DEI CASTELLI,SAN GREGORIO NELLE ALPI,"Via dei Castelli, Paderno, San Gregorio nelle Alpi, Belluno, Veneto, 32035, Italia","{'type': 'Point', 'coordinates': [12.05683, 46.1156913]}","VIA DEI CASTELLI, SAN GREGORIO NELLE ALPI, Belluno, Veneto, Italia"
LOCALITA' VAL VISDENDE,SAN PIETRO DI CADORE,"Val Visdende, San Pietro di Cadore, Belluno, Veneto, Italia","{'type': 'Point', 'coordinates': [12.6293779, 46.6189851]}"," VAL VISDENDE, SAN PIETRO DI CADORE, Belluno, Veneto, Italia"
PIAZZA 4 NOVEMBRE,SAN PIETRO DI CADORE,"Piazza 4 Novembre, San Pietro di Cadore, Belluno, Veneto, 32045, Italia","{'type': 'Point', 'coordinates': [12.5896327, 46.5697547]}","PIAZZA 4 NOVEMBRE, SAN PIETRO DI CADORE, Belluno, Veneto, Italia"
PIAZZA GARIBALDI,SAN PIETRO DI CADORE,"Piazza Garibaldi, San Pietro di Cadore, Belluno, Veneto, 32045, Italia","{'type': 'Point', 'coordinates': [12.587781, 46.5681311]}","PIAZZA GARIBALDI, SAN PIETRO DI CADORE, Belluno, Veneto, Italia"
VIA ARGENTIERA,SAN PIETRO DI CADORE,"Via Argentiera, Val Visdende, San Pietro di Cadore, Belluno, Veneto, Italia","{'type': 'Point', 'coordinates': [12.6151364, 46.5779727]}","VIA ARGENTIERA, SAN PIETRO DI CADORE, Belluno, Veneto, Italia"
VIA CANCIAN,SAN PIETRO DI CADORE,"Via Cancian, San Pietro di Cadore, Belluno, Veneto, Italia","{'type': 'Point', 'coordinates': [12.5991617, 46.5749181]}","VIA CANCIAN, SAN PIETRO DI CADORE, Belluno, Veneto, Italia"
VIA CAVOUR,SAN PIETRO DI CADORE,"Via Cavour, San Pietro di Cadore, Belluno, Veneto, 32045, Italia","{'type': 'Point', 'coordinates': [12.5890258, 46.5700523]}","VIA CAVOUR, SAN PIETRO DI CADORE, Belluno, Veneto, Italia"
VIA DANTE ALIGHIERI,SAN PIETRO DI CADORE,"Via Dante Alighieri, San Pietro di Cadore, Belluno, Veneto, 32045, Italia","{'type': 'Point', 'coordinates': [12.5966942, 46.5734325]}","VIA DANTE ALIGHIERI, SAN PIETRO DI CADORE, Belluno, Veneto, Italia"
VIA DEL PONTE,SAN PIETRO DI CADORE,"Via del Ponte, Val Visdende, San Pietro di Cadore, Belluno, Veneto, Italia","{'type': 'Point', 'coordinates': [12.601432, 46.5758512]}","VIA DEL PONTE, SAN PIETRO DI CADORE, Belluno, Veneto, Italia"
LOCALITA' CELAT,SAN TOMASO AGORDINO,"Celat, Belluno, Veneto, 32020, Italia","{'type': 'Point', 'coordinates': [11.9745178, 46.3810118]}"," CELAT, SAN TOMASO AGORDINO, Belluno, Veneto, Italia"
LOCALITA' COSTOIA,SAN TOMASO AGORDINO,"Costoia, San Tomaso Agordino, Belluno, Veneto, 32020, Italia","{'type': 'Point', 'coordinates': [11.9713863, 46.390975]}"," COSTOIA, SAN TOMASO AGORDINO, Belluno, Veneto, Italia"
VIA AVOSCAN,SAN TOMASO AGORDINO,"Avoscan, San Tomaso Agordino, Belluno, Veneto, 32020, Italia","{'type': 'Point', 'coordinates': [11.9871263, 46.3820913]}","VIA AVOSCAN, SAN TOMASO AGORDINO, Belluno, Veneto, Italia"
VIA CANACEDE,SAN TOMASO AGORDINO,"Canacede, San Tomaso Agordino, Belluno, Veneto, 32020, Italia","{'type': 'Point', 'coordinates': [11.9625882, 46.3876828]}","VIA CANACEDE, SAN TOMASO AGORDINO, Belluno, Veneto, Italia"
VIA CHIEA,SAN TOMASO AGORDINO,"Chiea, San Tomaso Agordino, Belluno, Veneto, 32020, Italia","{'type': 'Point', 'coordinates': [11.9756291, 46.3771729]}","VIA CHIEA, SAN TOMASO AGORDINO, Belluno, Veneto, Italia"
VIA COLARU',SAN TOMASO AGORDINO,"Colarù, San Tomaso Agordino, Belluno, Veneto, 32020, Italia","{'type': 'Point', 'coordinates': [11.9803168, 46.3798525]}","VIA COLARU', SAN TOMASO AGORDINO, Belluno, Veneto, Italia"
VIA COLZARESE,SAN TOMASO AGORDINO,"Frazione Colzarese, Col Zaresè, San Tomaso Agordino, Belluno, Veneto, 32020, Italia","{'type': 'Point', 'coordinates': [11.9727583, 46.367518]}","VIA COLZARESE, SAN TOMASO AGORDINO, Belluno, Veneto, Italia"
VIA COSTA DI MEZZO,SAN TOMASO AGORDINO,"Costa di Mezzo, San Tomaso Agordino, Belluno, Veneto, 32020, Italia","{'type': 'Point', 'coordinates': [11.9735448, 46.3859916]}","VIA COSTA DI MEZZO, SAN TOMASO AGORDINO, Belluno, Veneto, Italia"
VIA FONTANELLE,SAN TOMASO AGORDINO,"Fontanelle, San Tomaso Agordino, Belluno, Veneto, 32020, Italia","{'type': 'Point', 'coordinates': [11.9743689, 46.3645442]}","VIA FONTANELLE, SAN TOMASO AGORDINO, Belluno, Veneto, Italia"
VIA FORCHIADE,SAN TOMASO AGORDINO,"Forchiade, San Tomaso Agordino, Belluno, Veneto, 32020, Italia","{'type': 'Point', 'coordinates': [11.9984086, 46.3891071]}","VIA FORCHIADE, SAN TOMASO AGORDINO, Belluno, Veneto, Italia"
VIA MEZZAVALLE,SAN TOMASO AGORDINO,"Mezzavalle, San Tomaso Agordino, Belluno, Veneto, 32020, Italia","{'type': 'Point', 'coordinates': [11.968709, 46.3832125]}","VIA MEZZAVALLE, SAN TOMASO AGORDINO, Belluno, Veneto, Italia"
VIA PECOL,SAN TOMASO AGORDINO,"Pecol, San Tomaso Agordino, Belluno, Veneto, 32020, Italia","{'type': 'Point', 'coordinates': [11.980509, 46.3867637]}","VIA PECOL, SAN TOMASO AGORDINO, Belluno, Veneto, Italia"
VIA PIAIA,SAN TOMASO AGORDINO,"Piaia, San Tomaso Agordino, Belluno, Veneto, 32020, Italia","{'type': 'Point', 'coordinates': [11.9833699, 46.386347]}","VIA PIAIA, SAN TOMASO AGORDINO, Belluno, Veneto, Italia"
VIA PIAN MOLIN,SAN TOMASO AGORDINO,"Pian Molin, San Tomaso Agordino, Belluno, Veneto, 32020, Italia","{'type': 'Point', 'coordinates': [11.9729742, 46.3853995]}","VIA PIAN MOLIN, SAN TOMASO AGORDINO, Belluno, Veneto, Italia"
VIA PIANEZZE,SAN TOMASO AGORDINO,"Pianezze, San Tomaso Agordino, Belluno, Veneto, 32020, Italia","{'type': 'Point', 'coordinates': [11.9640687, 46.3836677]}","VIA PIANEZZE, SAN TOMASO AGORDINO, Belluno, Veneto, Italia"
VIA ROI,SAN TOMASO AGORDINO,"Roi, San Tomaso Agordino, Belluno, Veneto, 32020, Italia","{'type': 'Point', 'coordinates': [11.9814497, 46.3815399]}","VIA ROI, SAN TOMASO AGORDINO, Belluno, Veneto, Italia"
VIA RONCH,SAN TOMASO AGORDINO,"Ronch, San Tomaso Agordino, Belluno, Veneto, 32020, Italia","{'type': 'Point', 'coordinates': [11.9662734, 46.3868575]}","VIA RONCH, SAN TOMASO AGORDINO, Belluno, Veneto, Italia"
