alias_address,alias_city,ammoniaca,cloro_residuo,cloruro,conducibilita,data_report,ferro,fluoruri,nitrato,nitrito,ph,solfato
CapoluogoFontana pubblica dei giardini,Acquedotto di Andorno Micca,<0.05,0.20,2.5,54,12/02/2020,11,<0.1,4.2,<0.05,6.9,1.3
Frazione RavizzaFontana pubblica,Acquedotto di Andorno Micca,<0.05,0.10,1.2,54,13/11/2019,47,<0.10,9.9,<0.05,7.4,0.88
Frazione ColmaFontana pubblica,Acquedotto di Andorno Micca,<0.05,0.09,0.87,53,12/09/2018,36,<0.1,3.2,<0.05,7.2,2.1
Frazione GolzioFontana lavatoio,Acquedotto di Andorno Micca,<0.05,0.09,0.91,110,12/09/2018,82,<0.1,5.9,<0.05,6.9,5.8
Frazione San Giuseppe di Casto.Fontana adiacente la chiesa.,Acquedotto di Andorno Micca,<0.05,0.15,1.1,104,12/09/2018,<5,<0.1,6.9,<0.05,7,2.9
Frazione Cerutti.Fontana.,Acquedotto di Andorno Micca,<0.05,0.07,1.4,67,12/09/2018,,<0.1,8.8,<0.05,7.4,0.81
CapoluogoServizi igienici del Municipio,Acquedotto di Benna,<0.05,0.1,5.1,112,07/04/2020,50,<0.1,3.4,<0.05,7.4,12
CapoluogoFontana del Parco Giochi presso i Giardini Zumaglini,Acquedotto di Biella,<0.05,0.18,1.5,26,06/06/2019,14,<0.10,2.1,<0.05,7.0,1.6
Frazione BarazzettoFontana di Piazza S.Bernardo delle Alpi,Acquedotto di Biella,<0.05,0.11,0.71,34,03/03/2020,14,<0.10,2.0,<0.05,7.2,1.9
CapoluogoFontana angolo C.so 53° Fanteria e Viale Maccalè,Acquedotto di Biella,0.05,0.2,1.8,28,06/05/2016,17,<0.1,2.3,<0.05,6.8,2.2
PolloneFontana di Piazza S. Rocco,Acquedotto di Biella,<0.05,0.13,0.39,38,02/09/2019,14,<0.1,2.2,<0.05,7.9,3
CapoluogoFontana di Piazza S. Sebastiano,Acquedotto di Biella,<0.05,0.29,3.0,44,03/03/2020,19,<0.10,3.4,<0.05,7.1,2.4
CapoluogoFontana all'angolo tra Via Liguria e Via Valle d'Aosta,Acquedotto di Biella,<0.05,0.11,1.7,46,03/03/2020,21,<0.1,2.3,<0.05,7.3,2.4
CapoluogoFontana dell'Orso presso i Giardini Zumaglini,Acquedotto di Biella,<0.05,0.11,2.2,34,09/05/2019,21,<0.1,2.6,<0.05,7.1,2.3
Frazione Biella PiazzoFontana di Piazza Cisterna,Acquedotto di Biella,<0.05,0.17,1.4,30,03/03/2020,17,<0.10,2.1,<0.05,6.9,2.2
"Biella PiazzoFontana del Bottalino, Via Ramella Germanin",Acquedotto di Biella,<0.05,0.19,1.2,21,20/04/2020,22,<0.10,2.8,<0.05,6.6,1.8
Frazione ChiavazzaFontana di Piazza D.F.M. Gatto,Acquedotto di Biella,<0.05,0.28,2.3,33,20/08/2019,34,<0.1,2.2,<0.05,7.2,2.3
Frazione Cossila S.GratoFontana di Piazza G.De Mosso,Acquedotto di Biella,<0.05,0.29,1.9,30,07/09/2017,,<0.1,2.5,<0.05,6.5,2.5
Frazione FavaroFontana di Strada per Oropa al n° 591,Acquedotto di Biella,<0.05,0.22,1.3,26,03/03/2020,<5,<0.10,2.0,<0.05,6.7,1.6
Frazione PavignanoFontana di Via Bertamelina,Acquedotto di Biella,<0.05,0.22,1.2,36,12/03/2020,25,<0.1,1.7,<0.05,7.2,2.2
CapoluogoFontana presso la chiesa di S.Biagio.,Acquedotto di Biella,<0.05,0.08,2.8,74,04/04/2019,83,<0.1,5.5,<0.05,7.6,3.1
ChiavazzaFontana Via Mollie,Acquedotto di Biella,<0.05,0.16,1.2,28,15/04/2019,,<0.10,2.4,<0.05,7.4,2.5
"Chiavazza Via Coppa, fontana parco giochi.",Acquedotto di Biella,<0.05,0.17,1.3,25,23/04/2020,21,<0.1,2.5,0.05,7.0,2.2
Cossila San GiovanniFontana all'incrocio tra la strada di Pralungo e Via Santuario d'Oropa,Acquedotto di Biella,<0.05,0.22,1.8,28,06/06/2019,47,<0.10,2.1,<0.05,6.5,2.0
Capoluogo.Fontana municipio.,Acquedotto di Camandona,<0.05,<0.05,2.3,33,15/05/2018,129,<0.1,2.7,<0.05,6.9,2.1
CapoluogoServizi igienici del Municipio,Acquedotto di Camandona,<0.05,<0.05,1.8,32,19/03/2018,36,<0.1,2.5,<0.05,7,2.3
Frazione PianezzeFontana pubblica,Acquedotto di Camandona,<0.05,<0.05,2.6,35,04/07/2017,,<0.1,3.2,<0.05,6.8,3.5
CapoluogoFontana Municipio,Acquedotto di Camandona,<0.05,<0.05,2.9,41,12/03/2020,52,<0.1,1.7,<0.05,7.3,2.3
Pianezzefontana del parco giochi,Acquedotto di Camandona,<0.05,<0.05,2.9,40,04/07/2019,130,<0.10,1.5,<0.05,7.0,2.9
CapoluogoServizi igienici del Municipio,Acquedotto di Camburzano,<0.05,0.21,0.76,45,10/02/2020,24,<0.1,1.6,<0.05,7.0,1.5
CapoluogoFontana presso il Municipio,Acquedotto di Camburzano,<0.05,0.25,0.96,28,02/04/2020,6.1,<0.1,2.5,<0.05,7.0,1.7
Frazione IondiniFontana Chiesa,Acquedotto di Campiglia Cervo,<0.05,0.22,0.45,20,16/04/2020,10,<0.1,2.0,<0.05,6.9,2.6
CapoluogoFontana municipio,Acquedotto di Campiglia Cervo,<0.05,0.15,0.46,30,19/03/2020,13,<0.1,2.6,<0.05,6.9,2.1
Frazione Valmoscafontana,Acquedotto di Campiglia Cervo,<0.05,0.13,0.71,22,16/04/2020,11,<0.1,2.8,<0.05,7.1,3.5
Frazione ForgnengoFontana lungo strada,Acquedotto di Campiglia Cervo,<0.05,0.22,0.49,17,19/03/2020,32,<0.1,1.4,<0.05,6.9,1.5
Frazione PiaroFontana lungo strada,Acquedotto di Campiglia Cervo,<0.05,<0.05,0.37,21,19/03/2020,45,<0.1,2,<0.05,7.2,1.8
Capoluogo.Fontana Iondini.,Acquedotto di Campiglia Cervo,<0.05,0.20,0.35,23,09/07/2019,12,<0.10,1.9,<0.05,7.1,2.2
CapoluogoServizi igienici del Municipio,Acquedotto di Candelo,<0.05,<0.05,3.4,151,10/07/2018,22,<0.1,2.3,<0.05,7.3,15
Capoluogoservizi ufficio tecnico,Acquedotto di Candelo,<0.05,<0.05,4.1,115,13/01/2020,30,<0.10,2.3,<0.05,<7.6,15
Capoluogo.Servizi igienici dell'ufficio tecnico.,Acquedotto di Candelo,<0.05,<0.05,2.6,118,15/10/2018,,<0.1,2.1,<0.05,7.6,10
CapoluogoServizi igienici del Municipio,Acquedotto di Casapinta,<0.05,0.20,4.8,80,27/03/2018,54,<0.1,11,<0.05,6.8,6
CapoluogoFontana del Parco Giochi,Acquedotto di Casapinta,<0.05,0.28,8.1,84,11/03/2020,14,<0.10,7.9,<0.05,6.9,5.3
CapoluogoFontana del Municipio,Acquedotto di Cerreto Castello,<0.05,0.17,6.2,96,05/11/2019,93,<0.10,7.4,<0.05,7.3,8.5
Capoluogo.Servizi scuola materna.,Acquedotto di Cerreto Castello,<0.05,<0.05,3.8,51,17/02/2020,75,<0.1,6.1,<0.05,7.1,4.3
CapoluogoFontana pubblica dei giardini di Via Pajetta-Amendola,Acquedotto di Cossato,<0.05,0.11,4.4,79,07/04/2020,114,0.13,5.4,0.07,7.3,4.7
CapoluogoFontana pubblica di Via Remo Pella,Acquedotto di Cossato,<0.05,0.30,3.1,59,18/03/2020,23,<0.10,5.2,<0.05,7.0,3.4
CapoluogoFontana pubblica di Via Vercellotto,Acquedotto di Cossato,<0.05,0.09,5.2,90,05/11/2019,36,<0.10,6.2,<0.05,7.4,6.0
Frazione BattianaFontana pubblica,Acquedotto di Cossato,<0.05,<0.05,4.2,97,17/02/2020,40,<0.1,6.7,<0.05,7.3,6.6
Frazione LorazzoFontana pubblica,Acquedotto di Cossato,<0.05,0.20,2.7,46,06/04/2020,45,<0.10,4.7,<0.05,6.7,3.7
Frazione LorazzoAsilo nido,Acquedotto di Cossato,<0.05,<0.05,2.9,47,05/04/2018,<5,<0.1,2.6,<0.05,8.2,2.5
Frazione SpolinaServizi igienici Scuola Materna,Acquedotto di Cossato,<0.05,0.09,9.4,268,17/02/2020,166,<0.1,4.8,<0.05,7.5,38
CapoluogoPotabilizzatore A.I.V.,Acquedotto di Cossato,<0.05,0.08,1.5,46,03/03/2015,33,<0.1,4.1,<0.05,6.9,2.7
Fraz. CastellengoFontana Cimitero,Acquedotto di Cossato,<0.05,<0.05,2.0,161,07/04/2020,43,<0.1,0.36,<0.05,8.2,11
CapoluogoFontana di Piazza Perotti,Acquedotto di Cossato,0.05,0.19,4.6,68,18/03/2020,50,<0.10,4.9,<0.05,7.0,3.8
CapoluogoPotabilizzatore AIV entrata filtri,Acquedotto di Cossato,<0.05,<0.05,2.1,44,27/04/2020,49,<0.10,3.8,<0.05,7.2,2.4
CapoluogoPotabilizzatore AIV uscita filtri,Acquedotto di Cossato,<0.05,0.30,2.3,45,27/04/2020,16,<0.10,3.6,<0.05,7.1,3.2
Frazione Spolinarubinetto cucina scuola materna,Acquedotto di Cossato,<0.05,<0.05,9.1,307,11/06/2019,76,<0.10,6.8,<0.05,7.6,38
CapoluogoServizi igienici Municipio,Acquedotto di Crosa,<0.05,0.25,7.6,79,08/02/2017,14,<0.1,7.5,<0.05,7.1,6.5
CapoluogoFontana Cimitero,Acquedotto di Crosa,<0.05,0.16,7.5,87,10/07/2019,8.5,<0.10,9.4,<0.05,7.4,6.0
CapoluogoServizi igienici Municipio,Acquedotto di Gaglianico,<0.05,<0.05,4.1,139,01/07/2019,43,<0.10,15,<0.05,7.5,5.4
CapoluogoServizi igienici delle scuole medie.,Acquedotto di Gaglianico,<0.05,<0.05,5.9,139,03/02/2020,58,<0.1,15,<0.05,7.3,5.7
CapoluogoServizi igienici Municipio,Acquedotto di Lessona,<0.05,0.12,1.7,43,05/02/2020,19,<0.10,3.9,<0.05,6.5,1.4
Capoluogofontana Via XI Febbraio,Acquedotto di Lessona,<0.05,0.30,8.3,56,03/09/2019,30,0.12,7.9,<0.05,7.4,10
Capoluogo.Fontana Municipio.,Acquedotto di Lessona,<0.05,0.20,3.3,59,03/09/2019,40,<0.1,4.0,<0.05,7.4,2.4
CapoluogoFontana di via dell'acqua.,Acquedotto di Lessona,<0.05,0.22,4.3,61,03/09/2019,42,<0.1,3.5,<0.05,7.4,3.6
CapoluogoFontana del Municipio,Acquedotto di Magnano,<0.05,0.21,0.97,36,11/02/2020,33,<0.1,1.5,0.05,7.0,1.8
Comunità di BoseServizi igienici della Comunità,Acquedotto di Magnano,<0.05,0.07,1.4,19,04/05/2020,17,<0.10,2.1,<0.05,6.7,3.5
Località BroglinaServizi igienici del ristorante,Acquedotto di Magnano,<0.05,<0.05,2.4,29,15/11/2017,12,<0.1,1.8,<0.05,7.3,2.2
Frazione Broglina.Fontana.,Acquedotto di Magnano,<0.05,0.12,2.0,29,10/10/2019,<5,<0.1,2.0,<0.05,7.3,2.1
"CapoluogoFontana pubblica, via Q. Sella",Acquedotto di Mosso,<0.05,0.13,1.7,49,12/03/2020,29,<0.1,4.7,<0.05,7.2,1.5
Frazione PistolesaFontana giardini via Roma .,Acquedotto di Mosso,<0.05,<0.05,1.7,30,30/11/2016,164,<0.1,3.5,<0.05,7.3,1.7
Frazione Pistolesa.Punto ASL.,Acquedotto di Mosso,<0.05,0.29,2.7,33,04/07/2019,9.4,<0.10,1.8,<0.05,6.7,2.7
CapoluogoFontana della piazza parrocchiale,Acquedotto di Muzzano,<0.05,0.30,0.36,22,10/02/2020,22,<0.10,0.95,<0.05,6.6,1.7
CapoluogoServizi igienici Municipio,Acquedotto di Muzzano,<0.05,0.15,0.82,20,10/01/2018,19,<0.1,3.2,<0.05,6.5,2
CapoluogoServizi igienici Municipio,Acquedotto di Occhieppo Inferiore,<0.05,0.08,0.51,30,10/02/2020,55,<0.1,1.0,<0.05,6.8,1.9
Capoluogo.Fontana di via Villa.,Acquedotto di Occhieppo Inferiore,<0.05,0.25,0.64,21,02/04/2020,17,<0.1,1.5,0.06,6.8,2.0
"Capoluogo.Casa di riposo Cerino Zegna, cucina.",Acquedotto di Occhieppo Inferiore,<0.05,0.14,0.85,23,13/02/2019,63,<0.10,1.9,<0.05,6.9,2.5
CapoluogoServizi igienici Municipio,Acquedotto di Occhieppo Superiore,<0.05,0.22,0.48,23,10/02/2020,20,<0.10,1.3,<0.05,6.8,2.0
Frazione GalfioneLavatoio,Acquedotto di Occhieppo Superiore,<0.05,0.23,0.81,29,07/11/2019,<5,<0.10,1.8,<0.05,6.8,1.6
CapoluogoFontana posta sulla piazza del municipio.,Acquedotto di Occhieppo Superiore,<0.05,0.18,1.2,20,05/05/2020,8.8,<0.10,1.5,<0.05,6.9,1.9
CapoluogoFontana del parco giochi,Acquedotto di Pettinengo,,,,,15/02/2007,64.32,,,,,
CapoluogoServizi igienici Municipio,Acquedotto di Pettinengo,<0.05,0.22,6.3,119,10/12/2019,86,<0.10,22,<0.05,6.7,11
Fraz.San FrancescoFontana Cimitero,Acquedotto di Pettinengo,<0.05,<0.05,12,151,17/07/2019,57,<0.1,15,<0.05,6.5,17
Capoluogo.Fontana cimitero.,Acquedotto di Pettinengo,<0.05,0.19,3.9,115,17/04/2019,57,<0.10,17,<0.05,6.9,7.2
Capoluogofontana dei giardini di Via Bellia,Acquedotto di Pettinengo,<0.05,0.20,5.0,109,14/10/2019,33,<0.10,17,<0.05,6.8,7.7
Capoluogofontana dei giardini di Via Bellia,Acquedotto di Pettinengo,<0.05,0.20,5.0,114,15/04/2020,68,<0.10,18,<0.05,6.7,9.2
CapoluogoFontana pubblica,Acquedotto di Piatto,<0.05,0.24,6.0,90,12/02/2020,11,<0.1,8.7,<0.05,6.6,4.0
CapoluogoFontana del parco giochi,Acquedotto di Piedicavallo,<0.05,<0.05,0.55,13,19/03/2020,7.3,<0.1,2.8,<0.05,6.7,1.8
Frazione MontesinaroFontana pubblica,Acquedotto di Piedicavallo,<0.05,0.23,0.64,17,19/03/2020,29,<0.1,3.3,<0.05,6.6,2.0
Capoluogo.Fontana sulla via che conduce al parco giochi,Acquedotto di Piedicavallo,<0.05,<0.05,0.16,20.6,22/11/2011,<5,<0.1,0.95,<0.05,7.16,2.45
CapoluogoFontana presso le Scuole Elementari,Acquedotto di Pollone,<0.05,0.20,0.75,23,05/05/2020,7.7,<0.10,2.7,<0.05,6.7,2.1
CapoluogoServizi igienici delle Scuole Medie,Acquedotto di Pollone,<0.05,0.12,0.79,27,23/03/2015,<5,<0.1,3.5,<0.05,6.5,2.1
Capoluogo.Servizi igienici delle scuole elementari.,Acquedotto di Pollone,0.09,<0.05,1.1,26,02/03/2020,120,<0.1,2.4,<0.05,6.9,1.7
CapoluogoFontana presso il campo sportivo,Acquedotto di Ponderano,<0.05,0.17,3.1,137,14/11/2019,20,<0.10,4.7,0.14,7.4,2.1
CapoluogoMunicipio servizi igienici.,Acquedotto di Ponderano,<0.05,0.18,3.4,125,07/04/2020,120,<0.1,4.2,<0.05,7.3,3.1
CapoluogoServizi igienici Municipio,Acquedotto di Pralungo,<0.05,0.28,2.0,32,12/02/2020,16,<0.1,2.0,<0.05,6.8,2.2
Frazione ValleFontana pubblica,Acquedotto di Pralungo,<0.05,0.30,3.8,57,10/03/2020,6.6,<0.1,3.2,<0.05,6.9,2.4
Frazione S. EurosiaFontana pubblica presso l'Alp Hotel,Acquedotto di Pralungo,<0.05,<0.05,1.5,34,04/04/2019,32,<0.1,3,<0.05,6.9,3.1
"Capoluogo.Piazza martiri della libertà,fontana del parco giochi.",Acquedotto di Pralungo,<0.05,0.11,2.1,29,07/06/2018,42,<0.1,2.3,<0.05,6.6,2.3
capoluogoFontana Zerbole,Acquedotto di Pralungo,<0.05,0.17,3.4,27,10/03/2020,20,<0.1,1.8,<0.05,6.9,2.4
CapoluogoFontana di Via Parlamento,Acquedotto di Quaregna,0.05,0.24,4.9,90,16/03/2020,19,<0.1,7.6,<0.05,7.6,5.4
CapoluogoFontana del Municipio,Acquedotto di Quittengo,<0.05,0.12,0.61,42,19/03/2020,91,<0.10,2.2,<0.05,6.7,1.9
Frazione RialmossoFontana pubblica,Acquedotto di Quittengo,<0.05,<0.05,0.54,40,09/07/2019,15,<0.1,2.3,<0.05,7.2,1.2
Frazione SassaiaFontana pubblica,Acquedotto di Quittengo,<0.05,0.13,2.0,37,16/04/2020,35,<0.1,0.36,<0.05,6.9,4.4
CapoluogoFontana Bogna,Acquedotto di Quittengo,<0.05,0.08,0.85,30,09/07/2019,23,<0.1,2.3,<0.05,7.1,1.7
CapoluogoFontana palestra di roccia,Acquedotto di Quittengo,<0.05,<0.05,0.41,29,09/07/2019,26,<0.1,2.3,<0.05,7.1,1.7
CapoluogoFontana presso il Municipio,Acquedotto di Ronco Biellese,<0.05,<0.05,1.7,31,22/01/2020,55,<0.1,2.4,<0.05,7.4,2.9
CapoluogoServizi igienici delle Scuole elementari,Acquedotto di Ronco Biellese,<0.05,0.25,1.6,36,03/02/2020,50,<0.1,2.4,<0.05,7.1,2.7
Capoluogo.Servizi igienici del municipio.,Acquedotto di Ronco Biellese,<0.05,0.11,2.9,48,15/12/2017,87,<0.1,3.1,<0.05,7.1,4.4
CapoluogoFontana di Via Q. Sella,Acquedotto di Rosazza,<0.05,<0.05,1,17,19/03/2020,8.4,<0.1,3.3,<0.05,6.8,2.5
Capoluogofontana piazza F. Rosazza,Acquedotto di Rosazza,<0.05,<0.05,0.24,20,16/04/2020,22,<0.1,3.1,<0.05,6.9,2.3
Frazione MortigliengoFontana pubblica,Acquedotto di S.Paolo Cervo,<0.05,0.25,0.83,35,19/03/2020,110,<0.1,4.5,<0.05,6.9,1.7
Frazione PianaFontana pubblica,Acquedotto di S.Paolo Cervo,<0.05,0.22,1.4,50,16/04/2020,39,<0.1,2.4,<0.05,7.7,3.8
Frazione RiabellaFontana pubblica,Acquedotto di S.Paolo Cervo,<0.05,0.19,0.70,36,18/06/2019,20,<0.10,5.6,<0.05,7.1,4.1
Fraz. Orettofontana,Acquedotto di S.Paolo Cervo,<0.05,0.15,2.5,39,19/03/2020,53,<0.1,2.2,<0.05,6.7,2.3
Capoluogo.Servizi igienici del Municipio,Acquedotto di Sala Biellese,<0.05,0.30,11,92,14/11/2019,121,<0.10,3.3,<0.05,7.4,4.7
Frazione BornascoFontana pubblica,Acquedotto di Sala Biellese,<0.05,0.16,12,106,01/04/2020,30,<0.1,3.0,<0.05,7.6,3.8
capoluogofontana parco giochi,Acquedotto di Sala Biellese,<0.05,0.18,11,99,13/06/2019,16,<0.1,3.3,<0.05,7.4,4.7
Bornascofontana di Bornasco,Acquedotto di Sala Biellese,<0.05,0.25,11,109,01/03/2017,30,<0.1,2.9,<0.05,7.9,4.7
CapoluogoServizi igienici del Municipio,Acquedotto di Selve Marcone,<0.05,<0.05,0.78,92.3,08/01/2014,<5,<0.1,7.1,<0.05,7.3,1.7
Frazione BaltigatiEsercizio pubblico .,Acquedotto di Soprana,<0.05,<0.05,25,92,23/01/2020,15,<0.1,6.7,<0.05,,2.0
Frazione CereieFontana pubblica,Acquedotto di Soprana,<0.05,<0.05,18,146,03/09/2019,39,<0.1,11,<0.05,6.6,11
Frazione CerrutiServizi igienici delle Scuole,Acquedotto di Soprana,<0.05,<0.05,4.1,96,05/02/2020,19,<0.10,11,<0.05,6.7,8.5
Frazione LanvarioFontana pubblica,Acquedotto di Soprana,0.05,<0.05,0.61,40,18/03/2020,33,<0.10,0.63,<0.05,,3.1
Frazione VioglioFontana pubblica,Acquedotto di Soprana,<0.05,0.16,10,106,10/07/2019,22,0.12,14,<0.05,,5.3
Frazione BaltigatiFontana del Parco giochi,Acquedotto di Soprana,<0.05,0.07,21,108,12/01/2015,9.6,<0.1,4.4,<0.05,,1.5
Fraz. MolinengoFontana pubblica,Acquedotto di Soprana,<0.05,<0.05,0.84,56,03/09/2019,43,0.27,1.3,0.11,6.5,5.3
Frazione Lanvario.Servizi Municipio.,Acquedotto di Soprana,<0.05,<0.05,0.53,35,14/12/2016,136,<0.1,0.76,<0.05,6.5,3.1
CapoluogoFontana di piazza del Municipio,Acquedotto di Sordevolo,<0.05,0.13,0.73,20,09/01/2020,6.5,<0.10,2.0,<0.05,6.5,2.0
Frazione S. GratoFontana di piazza S. Grato,Acquedotto di Sordevolo,<0.05,0.1,0.53,23.6,08/03/2012,<5,<0.1,1.8,<0.05,6.92,2.56
CapoluogoServizi igienici del supermercato,Acquedotto di Strona,<0.05,0.13,12,82,23/01/2020,16,<0.10,13,<0.05,6.8,7.6
CapoluogoFontana presso il Teatro,Acquedotto di Strona,<0.05,<0.05,8.6,75,05/02/2020,160,0.10,8.4,<0.05,6.6,5.5
Frazione QuarioPozzetto,Acquedotto di Strona,<0.05,0.25,8.0,76,06/04/2020,13,<0.10,10,<0.05,6.7,5.9
Fraz. CAPPIORubinetto pensile,Acquedotto di Strona,<0.05,0.48,9.61,275,16/10/2012,80.26,0.14,30.85,<0.05,6.73,18.73
Fraz. FoglioPozzetto,Acquedotto di Strona,<0.05,<0.05,13,117,05/02/2020,8.0,0.12,14,<0.05,6.5,8.6
Fraz. Piana BoeroPozzetto.,Acquedotto di Strona,<0.05,<0.05,7.5,141,27/03/2018,191,<0.1,12,<0.05,6.8,8.9
Fraz. CaligarisPozzetto,Acquedotto di Strona,<0.05,<0.05,8.5,91,03/09/2019,36,<0.1,5.2,<0.05,7.5,6.6
Frazione FoglioRubinetto esterno.,Acquedotto di Strona,<0.05,0.08,15,124,13/09/2017,12,0.12,13,<0.05,6.5,10
Frazione Gronda.Rubinetto pozzetto.,Acquedotto di Strona,<0.05,<0.05,16,127,10/07/2019,26,<0.10,12,<0.05,,10
Frazione Prina.Fontana lavatoio.,Acquedotto di Strona,<0.05,<0.05,1.0,79,10/07/2019,,<0.10,6.7,0.17,6.5,7.8
Capoluogofontana Municipio,Acquedotto di Ternengo,<0.05,0.29,1.1,41,08/05/2019,13,<0.10,2.8,<0.05,6.6,1.3
Fraz. Villafontana pubblica,Acquedotto di Ternengo,<0.05,0.27,1.2,41,17/07/2019,6.8,<0.1,2.6,0.02,6.6,0.97
Fraz Valserafontana pubblica,Acquedotto di Ternengo,<0.05,<0.05,18,172,17/07/2019,155,<0.1,27,<0.05,6.7,12
CapoluogoServizi igienici del Municipio,Acquedotto di Tollegno,<0.05,0.18,1.0,44,08/01/2020,30,<0.10,2.3,<0.05,7.1,2.8
Capoluogo.Fontana Municipio.,Acquedotto di Tollegno,<0.05,0.30,0.85,27,12/02/2020,16,<0.1,1.4,<0.05,7.0,2.1
Capoluogo.Fontana del campo sportivo.,Acquedotto di Tollegno,<0.05,0.25,1.9,36,21/08/2019,72,<0.1,1.3,<0.05,7.3,2.0
CapoluogoFontana di via Martiri della Libertà,Acquedotto di Torrazzo,<0.05,0.13,1.6,141,16/01/2020,18,<0.1,10,<0.05,7.5,4.0
CapoluogoServizi igienici del Municipio,Acquedotto di Valdengo,<0.05,0.30,8.1,141,04/02/2020,10,0.15,8.4,<0.05,7.6,19
CapoluogoFontana Cimitero,Acquedotto di Valdengo,<0.05,0.11,8.3,256,11/11/2019,188,<0.10,9.3,0.17,7.6,24
CapoluogoServizi igienici del Municipio,Acquedotto di Vallemosso,<0.05,<0.05,2.2,61,12/01/2018,20,<0.1,9.9,<0.05,6.8,2.1
CapoluogoFontana del condominio Giardino,Acquedotto di Vallemosso,<0.05,<0.05,1.4,64,12/03/2020,57,<0.1,6.3,<0.05,7.0,1.7
Frazione SimoneCircolo Arci,Acquedotto di Vallemosso,<0.05,0.14,1.7,63,22/04/2020,33,<0.10,8.0,<0.05,6.9,2.2
Capoluogo.Servizi igienici scuole elementari.,Acquedotto di Vallemosso,<0.05,0.15,3.6,86,19/02/2018,<5,<0.1,11,<0.05,6.6,5.0
CapoluogoServizi igienici del Municipio,Acquedotto di Veglio,<0.05,0.20,5.5,47,19/02/2018,30,<0.1,4.3,<0.05,7.1,1.9
Frazione RomaninaEsercizio privato (concessionaria),Acquedotto di Veglio,0.05,0.10,5.8,49,02/12/2016,60,<0.1,3.5,<0.05,7.4,2.2
CapoluogoFontana del Parco giochi,Acquedotto di Veglio,<0.05,0.18,3.6,42,29/03/2016,9.3,<0.1,3.9,<0.05,6.8,1.8
CapoluogoServizi igienici del Municipio,Acquedotto di Verrone,<0.05,0.15,7.1,81,07/04/2020,,<0.1,6.3,<0.05,7.2,5.6
CapoluogoFontana di Via Comotto,Acquedotto di Vigliano,<0.05,0.28,16,240,07/04/2020,39,<0.1,21,<0.05,6.9,27
CapoluogoFontana del Parco giochi,Acquedotto di Vigliano,<0.05,0.23,16,249,07/04/2020,55,<0.1,21,<0.05,6.8,2.8
CapoluogoServizi igienici del Municipio,Acquedotto di Zimone,<0.05,<0.05,13,261,16/01/2020,96,<0.1,35,<0.05,8.1,23
CapoluogoFontana retro municipio,Acquedotto di Zimone,<0.05,0.18,8.1,286,11/07/2019,13,<0.1,23,<0.05,7.9,17
Capoluogo.Fontana lungo strada.,Acquedotto di Zimone,<0.05,0.27,9.8,345,04/05/2020,10,<0.10,25,<0.05,7.9,17
CapoluogoServizi igienici del Municipio,Acquedotto di Zumaglia,<0.05,0.13,8.1,95,22/01/2020,51,<0.1,10,<0.05,7.2,3.9
CapoluogoFontana di Via Gallo Ditzer,Acquedotto di Zumaglia,<0.05,0.237,5.61,144.3,05/12/2012,17.98,0.19,3.17,<0.05,7.05,13.53
CapoluogoServizi igienici dell'ufficio postale.,Acquedotto di Zumaglia,<0.05,<0.05,6.6,124,07/05/2018,58,<0.1,6.8,<0.05,6.8,6.0
