alias_address,alias_city,urlReport
CapoluogoFontana pubblica dei giardini,Acquedotto di Andorno Micca,http://77.242.187.172/itis/cordar/vedi_risultati2N.php?x=13&y=9&IdCertificato_=14315
Frazione RavizzaFontana pubblica,Acquedotto di Andorno Micca,http://77.242.187.172/itis/cordar/vedi_risultati2N.php?x=13&y=9&IdCertificato_=14196
Frazione ColmaFontana pubblica,Acquedotto di Andorno Micca,http://77.242.187.172/itis/cordar/vedi_risultati2N.php?x=13&y=9&IdCertificato_=13036
Frazione GolzioFontana lavatoio,Acquedotto di Andorno Micca,http://77.242.187.172/itis/cordar/vedi_risultati2N.php?x=13&y=9&IdCertificato_=13037
Frazione San Giuseppe di Casto.Fontana adiacente la chiesa.,Acquedotto di Andorno Micca,http://77.242.187.172/itis/cordar/vedi_risultati2N.php?x=13&y=9&IdCertificato_=13040
Frazione Cerutti.Fontana.,Acquedotto di Andorno Micca,http://77.242.187.172/itis/cordar/vedi_risultati2N.php?x=13&y=9&IdCertificato_=13038
CapoluogoServizi igienici del Municipio,Acquedotto di Benna,http://77.242.187.172/itis/cordar/vedi_risultati2N.php?x=13&y=9&IdCertificato_=14438
CapoluogoFontana del Parco Giochi presso i Giardini Zumaglini,Acquedotto di Biella,http://77.242.187.172/itis/cordar/vedi_risultati2N.php?x=13&y=9&IdCertificato_=13692
Frazione BarazzettoFontana di Piazza S.Bernardo delle Alpi,Acquedotto di Biella,http://77.242.187.172/itis/cordar/vedi_risultati2N.php?x=13&y=9&IdCertificato_=14348
CapoluogoFontana angolo C.so 53° Fanteria e Viale Maccalè,Acquedotto di Biella,http://77.242.187.172/itis/cordar/vedi_risultati2N.php?x=13&y=9&IdCertificato_=11074
PolloneFontana di Piazza S. Rocco,Acquedotto di Biella,http://77.242.187.172/itis/cordar/vedi_risultati2N.php?x=13&y=9&IdCertificato_=13992
CapoluogoFontana di Piazza S. Sebastiano,Acquedotto di Biella,http://77.242.187.172/itis/cordar/vedi_risultati2N.php?x=13&y=9&IdCertificato_=14345
CapoluogoFontana all'angolo tra Via Liguria e Via Valle d'Aosta,Acquedotto di Biella,http://77.242.187.172/itis/cordar/vedi_risultati2N.php?x=13&y=9&IdCertificato_=14352
CapoluogoFontana dell'Orso presso i Giardini Zumaglini,Acquedotto di Biella,http://77.242.187.172/itis/cordar/vedi_risultati2N.php?x=13&y=9&IdCertificato_=13570
Frazione Biella PiazzoFontana di Piazza Cisterna,Acquedotto di Biella,http://77.242.187.172/itis/cordar/vedi_risultati2N.php?x=13&y=9&IdCertificato_=14346
"Biella PiazzoFontana del Bottalino, Via Ramella Germanin",Acquedotto di Biella,http://77.242.187.172/itis/cordar/vedi_risultati2N.php?x=13&y=9&IdCertificato_=14472
Frazione ChiavazzaFontana di Piazza D.F.M. Gatto,Acquedotto di Biella,http://77.242.187.172/itis/cordar/vedi_risultati2N.php?x=13&y=9&IdCertificato_=13953
Frazione Cossila S.GratoFontana di Piazza G.De Mosso,Acquedotto di Biella,http://77.242.187.172/itis/cordar/vedi_risultati2N.php?x=13&y=9&IdCertificato_=12071
Frazione FavaroFontana di Strada per Oropa al n° 591,Acquedotto di Biella,http://77.242.187.172/itis/cordar/vedi_risultati2N.php?x=13&y=9&IdCertificato_=14347
Frazione PavignanoFontana di Via Bertamelina,Acquedotto di Biella,http://77.242.187.172/itis/cordar/vedi_risultati2N.php?x=13&y=9&IdCertificato_=14376
CapoluogoFontana presso la chiesa di S.Biagio.,Acquedotto di Biella,http://77.242.187.172/itis/cordar/vedi_risultati2N.php?x=13&y=9&IdCertificato_=13456
ChiavazzaFontana Via Mollie,Acquedotto di Biella,http://77.242.187.172/itis/cordar/vedi_risultati2N.php?x=13&y=9&IdCertificato_=13508
"Chiavazza Via Coppa, fontana parco giochi.",Acquedotto di Biella,http://77.242.187.172/itis/cordar/vedi_risultati2N.php?x=13&y=9&IdCertificato_=14491
Cossila San GiovanniFontana all'incrocio tra la strada di Pralungo e Via Santuario d'Oropa,Acquedotto di Biella,http://77.242.187.172/itis/cordar/vedi_risultati2N.php?x=13&y=9&IdCertificato_=13693
Capoluogo.Fontana municipio.,Acquedotto di Camandona,http://77.242.187.172/itis/cordar/vedi_risultati2N.php?x=13&y=9&IdCertificato_=12664
CapoluogoServizi igienici del Municipio,Acquedotto di Camandona,http://77.242.187.172/itis/cordar/vedi_risultati2N.php?x=13&y=9&IdCertificato_=12494
Frazione PianezzeFontana pubblica,Acquedotto di Camandona,http://77.242.187.172/itis/cordar/vedi_risultati2N.php?x=13&y=9&IdCertificato_=11912
CapoluogoFontana Municipio,Acquedotto di Camandona,http://77.242.187.172/itis/cordar/vedi_risultati2N.php?x=13&y=9&IdCertificato_=14374
Pianezzefontana del parco giochi,Acquedotto di Camandona,http://77.242.187.172/itis/cordar/vedi_risultati2N.php?x=13&y=9&IdCertificato_=13792
CapoluogoServizi igienici del Municipio,Acquedotto di Camburzano,http://77.242.187.172/itis/cordar/vedi_risultati2N.php?x=13&y=9&IdCertificato_=14303
CapoluogoFontana presso il Municipio,Acquedotto di Camburzano,http://77.242.187.172/itis/cordar/vedi_risultati2N.php?x=13&y=9&IdCertificato_=14420
Frazione IondiniFontana Chiesa,Acquedotto di Campiglia Cervo,http://77.242.187.172/itis/cordar/vedi_risultati2N.php?x=13&y=9&IdCertificato_=14469
CapoluogoFontana municipio,Acquedotto di Campiglia Cervo,http://77.242.187.172/itis/cordar/vedi_risultati2N.php?x=13&y=9&IdCertificato_=14404
Frazione Valmoscafontana,Acquedotto di Campiglia Cervo,http://77.242.187.172/itis/cordar/vedi_risultati2N.php?x=13&y=9&IdCertificato_=14458
Frazione ForgnengoFontana lungo strada,Acquedotto di Campiglia Cervo,http://77.242.187.172/itis/cordar/vedi_risultati2N.php?x=13&y=9&IdCertificato_=14406
Frazione PiaroFontana lungo strada,Acquedotto di Campiglia Cervo,http://77.242.187.172/itis/cordar/vedi_risultati2N.php?x=13&y=9&IdCertificato_=14405
Capoluogo.Fontana Iondini.,Acquedotto di Campiglia Cervo,http://77.242.187.172/itis/cordar/vedi_risultati2N.php?x=13&y=9&IdCertificato_=13824
CapoluogoServizi igienici del Municipio,Acquedotto di Candelo,http://77.242.187.172/itis/cordar/vedi_risultati2N.php?x=13&y=9&IdCertificato_=12884
Capoluogoservizi ufficio tecnico,Acquedotto di Candelo,http://77.242.187.172/itis/cordar/vedi_risultati2N.php?x=13&y=9&IdCertificato_=14255
Capoluogo.Servizi igienici dell'ufficio tecnico.,Acquedotto di Candelo,http://77.242.187.172/itis/cordar/vedi_risultati2N.php?x=13&y=9&IdCertificato_=13116
CapoluogoServizi igienici del Municipio,Acquedotto di Casapinta,http://77.242.187.172/itis/cordar/vedi_risultati2N.php?x=13&y=9&IdCertificato_=12514
CapoluogoFontana del Parco Giochi,Acquedotto di Casapinta,http://77.242.187.172/itis/cordar/vedi_risultati2N.php?x=13&y=9&IdCertificato_=14369
CapoluogoFontana del Municipio,Acquedotto di Cerreto Castello,http://77.242.187.172/itis/cordar/vedi_risultati2N.php?x=13&y=9&IdCertificato_=14160
Capoluogo.Servizi scuola materna.,Acquedotto di Cerreto Castello,http://77.242.187.172/itis/cordar/vedi_risultati2N.php?x=13&y=9&IdCertificato_=14326
CapoluogoFontana pubblica dei giardini di Via Pajetta-Amendola,Acquedotto di Cossato,http://77.242.187.172/itis/cordar/vedi_risultati2N.php?x=13&y=9&IdCertificato_=14442
CapoluogoFontana pubblica di Via Remo Pella,Acquedotto di Cossato,http://77.242.187.172/itis/cordar/vedi_risultati2N.php?x=13&y=9&IdCertificato_=14395
CapoluogoFontana pubblica di Via Vercellotto,Acquedotto di Cossato,http://77.242.187.172/itis/cordar/vedi_risultati2N.php?x=13&y=9&IdCertificato_=14161
Frazione BattianaFontana pubblica,Acquedotto di Cossato,http://77.242.187.172/itis/cordar/vedi_risultati2N.php?x=13&y=9&IdCertificato_=14327
Frazione LorazzoFontana pubblica,Acquedotto di Cossato,http://77.242.187.172/itis/cordar/vedi_risultati2N.php?x=13&y=9&IdCertificato_=14426
Frazione LorazzoAsilo nido,Acquedotto di Cossato,http://77.242.187.172/itis/cordar/vedi_risultati2N.php?x=13&y=9&IdCertificato_=12544
Frazione SpolinaServizi igienici Scuola Materna,Acquedotto di Cossato,http://77.242.187.172/itis/cordar/vedi_risultati2N.php?x=13&y=9&IdCertificato_=14328
CapoluogoPotabilizzatore A.I.V.,Acquedotto di Cossato,http://77.242.187.172/itis/cordar/vedi_risultati2N.php?x=13&y=9&IdCertificato_=9187
Fraz. CastellengoFontana Cimitero,Acquedotto di Cossato,http://77.242.187.172/itis/cordar/vedi_risultati2N.php?x=13&y=9&IdCertificato_=14441
CapoluogoFontana di Piazza Perotti,Acquedotto di Cossato,http://77.242.187.172/itis/cordar/vedi_risultati2N.php?x=13&y=9&IdCertificato_=14396
CapoluogoPotabilizzatore AIV entrata filtri,Acquedotto di Cossato,http://77.242.187.172/itis/cordar/vedi_risultati2N.php?x=13&y=9&IdCertificato_=14495
CapoluogoPotabilizzatore AIV uscita filtri,Acquedotto di Cossato,http://77.242.187.172/itis/cordar/vedi_risultati2N.php?x=13&y=9&IdCertificato_=14496
Frazione Spolinarubinetto cucina scuola materna,Acquedotto di Cossato,http://77.242.187.172/itis/cordar/vedi_risultati2N.php?x=13&y=9&IdCertificato_=13704
CapoluogoServizi igienici Municipio,Acquedotto di Crosa,http://77.242.187.172/itis/cordar/vedi_risultati2N.php?x=13&y=9&IdCertificato_=11499
CapoluogoFontana Cimitero,Acquedotto di Crosa,http://77.242.187.172/itis/cordar/vedi_risultati2N.php?x=13&y=9&IdCertificato_=13825
CapoluogoServizi igienici Municipio,Acquedotto di Gaglianico,http://77.242.187.172/itis/cordar/vedi_risultati2N.php?x=13&y=9&IdCertificato_=13780
CapoluogoServizi igienici delle scuole medie.,Acquedotto di Gaglianico,http://77.242.187.172/itis/cordar/vedi_risultati2N.php?x=13&y=9&IdCertificato_=14285
CapoluogoServizi igienici Municipio,Acquedotto di Lessona,http://77.242.187.172/itis/cordar/vedi_risultati2N.php?x=13&y=9&IdCertificato_=14292
Capoluogofontana Via XI Febbraio,Acquedotto di Lessona,http://77.242.187.172/itis/cordar/vedi_risultati2N.php?x=13&y=9&IdCertificato_=13984
Capoluogo.Fontana Municipio.,Acquedotto di Lessona,http://77.242.187.172/itis/cordar/vedi_risultati2N.php?x=13&y=9&IdCertificato_=13986
CapoluogoFontana di via dell'acqua.,Acquedotto di Lessona,http://77.242.187.172/itis/cordar/vedi_risultati2N.php?x=13&y=9&IdCertificato_=13987
CapoluogoFontana del Municipio,Acquedotto di Magnano,http://77.242.187.172/itis/cordar/vedi_risultati2N.php?x=13&y=9&IdCertificato_=14309
Comunità di BoseServizi igienici della Comunità,Acquedotto di Magnano,http://77.242.187.172/itis/cordar/vedi_risultati2N.php?x=13&y=9&IdCertificato_=14515
Località BroglinaServizi igienici del ristorante,Acquedotto di Magnano,http://77.242.187.172/itis/cordar/vedi_risultati2N.php?x=13&y=9&IdCertificato_=12252
Frazione Broglina.Fontana.,Acquedotto di Magnano,http://77.242.187.172/itis/cordar/vedi_risultati2N.php?x=13&y=9&IdCertificato_=14106
"CapoluogoFontana pubblica, via Q. Sella",Acquedotto di Mosso,http://77.242.187.172/itis/cordar/vedi_risultati2N.php?x=13&y=9&IdCertificato_=14375
Frazione PistolesaFontana giardini via Roma .,Acquedotto di Mosso,http://77.242.187.172/itis/cordar/vedi_risultati2N.php?x=13&y=9&IdCertificato_=10653
Frazione Pistolesa.Punto ASL.,Acquedotto di Mosso,http://77.242.187.172/itis/cordar/vedi_risultati2N.php?x=13&y=9&IdCertificato_=13793
CapoluogoFontana della piazza parrocchiale,Acquedotto di Muzzano,http://77.242.187.172/itis/cordar/vedi_risultati2N.php?x=13&y=9&IdCertificato_=14306
CapoluogoServizi igienici Municipio,Acquedotto di Muzzano,http://77.242.187.172/itis/cordar/vedi_risultati2N.php?x=13&y=9&IdCertificato_=12302
CapoluogoServizi igienici Municipio,Acquedotto di Occhieppo Inferiore,http://77.242.187.172/itis/cordar/vedi_risultati2N.php?x=13&y=9&IdCertificato_=14300
Capoluogo.Fontana di via Villa.,Acquedotto di Occhieppo Inferiore,http://77.242.187.172/itis/cordar/vedi_risultati2N.php?x=13&y=9&IdCertificato_=14419
"Capoluogo.Casa di riposo Cerino Zegna, cucina.",Acquedotto di Occhieppo Inferiore,http://77.242.187.172/itis/cordar/vedi_risultati2N.php?x=13&y=9&IdCertificato_=13345
CapoluogoServizi igienici Municipio,Acquedotto di Occhieppo Superiore,http://77.242.187.172/itis/cordar/vedi_risultati2N.php?x=13&y=9&IdCertificato_=14305
Frazione GalfioneLavatoio,Acquedotto di Occhieppo Superiore,http://77.242.187.172/itis/cordar/vedi_risultati2N.php?x=13&y=9&IdCertificato_=14165
CapoluogoFontana posta sulla piazza del municipio.,Acquedotto di Occhieppo Superiore,http://77.242.187.172/itis/cordar/vedi_risultati2N.php?x=13&y=9&IdCertificato_=14518
CapoluogoFontana del parco giochi,Acquedotto di Pettinengo,http://77.242.187.172/itis/cordar/vedi_risultati2N.php?x=13&y=9&IdCertificato_=215
CapoluogoServizi igienici Municipio,Acquedotto di Pettinengo,http://77.242.187.172/itis/cordar/vedi_risultati2N.php?x=13&y=9&IdCertificato_=14230
Fraz.San FrancescoFontana Cimitero,Acquedotto di Pettinengo,http://77.242.187.172/itis/cordar/vedi_risultati2N.php?x=13&y=9&IdCertificato_=13857
Capoluogo.Fontana cimitero.,Acquedotto di Pettinengo,http://77.242.187.172/itis/cordar/vedi_risultati2N.php?x=13&y=9&IdCertificato_=13517
Capoluogofontana dei giardini di Via Bellia,Acquedotto di Pettinengo,http://77.242.187.172/itis/cordar/vedi_risultati2N.php?x=13&y=9&IdCertificato_=14123
Capoluogofontana dei giardini di Via Bellia,Acquedotto di Pettinengo,http://77.242.187.172/itis/cordar/vedi_risultati2N.php?x=13&y=9&IdCertificato_=14449
CapoluogoFontana pubblica,Acquedotto di Piatto,http://77.242.187.172/itis/cordar/vedi_risultati2N.php?x=13&y=9&IdCertificato_=14316
CapoluogoFontana del parco giochi,Acquedotto di Piedicavallo,http://77.242.187.172/itis/cordar/vedi_risultati2N.php?x=13&y=9&IdCertificato_=14409
Frazione MontesinaroFontana pubblica,Acquedotto di Piedicavallo,http://77.242.187.172/itis/cordar/vedi_risultati2N.php?x=13&y=9&IdCertificato_=14408
Capoluogo.Fontana sulla via che conduce al parco giochi,Acquedotto di Piedicavallo,http://77.242.187.172/itis/cordar/vedi_risultati2N.php?x=13&y=9&IdCertificato_=4703
CapoluogoFontana presso le Scuole Elementari,Acquedotto di Pollone,http://77.242.187.172/itis/cordar/vedi_risultati2N.php?x=13&y=9&IdCertificato_=14519
CapoluogoServizi igienici delle Scuole Medie,Acquedotto di Pollone,http://77.242.187.172/itis/cordar/vedi_risultati2N.php?x=13&y=9&IdCertificato_=9589
Capoluogo.Servizi igienici delle scuole elementari.,Acquedotto di Pollone,http://77.242.187.172/itis/cordar/vedi_risultati2N.php?x=13&y=9&IdCertificato_=14344
CapoluogoFontana presso il campo sportivo,Acquedotto di Ponderano,http://77.242.187.172/itis/cordar/vedi_risultati2N.php?x=13&y=9&IdCertificato_=14192
CapoluogoMunicipio servizi igienici.,Acquedotto di Ponderano,http://77.242.187.172/itis/cordar/vedi_risultati2N.php?x=13&y=9&IdCertificato_=14446
CapoluogoServizi igienici Municipio,Acquedotto di Pralungo,http://77.242.187.172/itis/cordar/vedi_risultati2N.php?x=13&y=9&IdCertificato_=14313
Frazione ValleFontana pubblica,Acquedotto di Pralungo,http://77.242.187.172/itis/cordar/vedi_risultati2N.php?x=13&y=9&IdCertificato_=14365
Frazione S. EurosiaFontana pubblica presso l'Alp Hotel,Acquedotto di Pralungo,http://77.242.187.172/itis/cordar/vedi_risultati2N.php?x=13&y=9&IdCertificato_=13458
"Capoluogo.Piazza martiri della libertà,fontana del parco giochi.",Acquedotto di Pralungo,http://77.242.187.172/itis/cordar/vedi_risultati2N.php?x=13&y=9&IdCertificato_=12720
capoluogoFontana Zerbole,Acquedotto di Pralungo,http://77.242.187.172/itis/cordar/vedi_risultati2N.php?x=13&y=9&IdCertificato_=14363
CapoluogoFontana di Via Parlamento,Acquedotto di Quaregna,http://77.242.187.172/itis/cordar/vedi_risultati2N.php?x=13&y=9&IdCertificato_=14380
CapoluogoFontana del Municipio,Acquedotto di Quittengo,http://77.242.187.172/itis/cordar/vedi_risultati2N.php?x=13&y=9&IdCertificato_=14411
Frazione RialmossoFontana pubblica,Acquedotto di Quittengo,http://77.242.187.172/itis/cordar/vedi_risultati2N.php?x=13&y=9&IdCertificato_=13810
Frazione SassaiaFontana pubblica,Acquedotto di Quittengo,http://77.242.187.172/itis/cordar/vedi_risultati2N.php?x=13&y=9&IdCertificato_=14456
CapoluogoFontana Bogna,Acquedotto di Quittengo,http://77.242.187.172/itis/cordar/vedi_risultati2N.php?x=13&y=9&IdCertificato_=13813
CapoluogoFontana palestra di roccia,Acquedotto di Quittengo,http://77.242.187.172/itis/cordar/vedi_risultati2N.php?x=13&y=9&IdCertificato_=13812
CapoluogoFontana presso il Municipio,Acquedotto di Ronco Biellese,http://77.242.187.172/itis/cordar/vedi_risultati2N.php?x=13&y=9&IdCertificato_=14275
CapoluogoServizi igienici delle Scuole elementari,Acquedotto di Ronco Biellese,http://77.242.187.172/itis/cordar/vedi_risultati2N.php?x=13&y=9&IdCertificato_=14286
Capoluogo.Servizi igienici del municipio.,Acquedotto di Ronco Biellese,http://77.242.187.172/itis/cordar/vedi_risultati2N.php?x=13&y=9&IdCertificato_=12286
CapoluogoFontana di Via Q. Sella,Acquedotto di Rosazza,http://77.242.187.172/itis/cordar/vedi_risultati2N.php?x=13&y=9&IdCertificato_=14407
Capoluogofontana piazza F. Rosazza,Acquedotto di Rosazza,http://77.242.187.172/itis/cordar/vedi_risultati2N.php?x=13&y=9&IdCertificato_=14468
Frazione MortigliengoFontana pubblica,Acquedotto di S.Paolo Cervo,http://77.242.187.172/itis/cordar/vedi_risultati2N.php?x=13&y=9&IdCertificato_=14402
Frazione PianaFontana pubblica,Acquedotto di S.Paolo Cervo,http://77.242.187.172/itis/cordar/vedi_risultati2N.php?x=13&y=9&IdCertificato_=14457
Frazione RiabellaFontana pubblica,Acquedotto di S.Paolo Cervo,http://77.242.187.172/itis/cordar/vedi_risultati2N.php?x=13&y=9&IdCertificato_=13734
Fraz. Orettofontana,Acquedotto di S.Paolo Cervo,http://77.242.187.172/itis/cordar/vedi_risultati2N.php?x=13&y=9&IdCertificato_=14403
Capoluogo.Servizi igienici del Municipio,Acquedotto di Sala Biellese,http://77.242.187.172/itis/cordar/vedi_risultati2N.php?x=13&y=9&IdCertificato_=14191
Frazione BornascoFontana pubblica,Acquedotto di Sala Biellese,http://77.242.187.172/itis/cordar/vedi_risultati2N.php?x=13&y=9&IdCertificato_=14418
capoluogofontana parco giochi,Acquedotto di Sala Biellese,http://77.242.187.172/itis/cordar/vedi_risultati2N.php?x=13&y=9&IdCertificato_=13732
Bornascofontana di Bornasco,Acquedotto di Sala Biellese,http://77.242.187.172/itis/cordar/vedi_risultati2N.php?x=13&y=9&IdCertificato_=11535
CapoluogoServizi igienici del Municipio,Acquedotto di Selve Marcone,http://77.242.187.172/itis/cordar/vedi_risultati2N.php?x=13&y=9&IdCertificato_=8066
Frazione BaltigatiEsercizio pubblico .,Acquedotto di Soprana,http://77.242.187.172/itis/cordar/vedi_risultati2N.php?x=13&y=9&IdCertificato_=14280
Frazione CereieFontana pubblica,Acquedotto di Soprana,http://77.242.187.172/itis/cordar/vedi_risultati2N.php?x=13&y=9&IdCertificato_=13991
Frazione CerrutiServizi igienici delle Scuole,Acquedotto di Soprana,http://77.242.187.172/itis/cordar/vedi_risultati2N.php?x=13&y=9&IdCertificato_=14291
Frazione LanvarioFontana pubblica,Acquedotto di Soprana,http://77.242.187.172/itis/cordar/vedi_risultati2N.php?x=13&y=9&IdCertificato_=14392
Frazione VioglioFontana pubblica,Acquedotto di Soprana,http://77.242.187.172/itis/cordar/vedi_risultati2N.php?x=13&y=9&IdCertificato_=13828
Frazione BaltigatiFontana del Parco giochi,Acquedotto di Soprana,http://77.242.187.172/itis/cordar/vedi_risultati2N.php?x=13&y=9&IdCertificato_=9013
Fraz. MolinengoFontana pubblica,Acquedotto di Soprana,http://77.242.187.172/itis/cordar/vedi_risultati2N.php?x=13&y=9&IdCertificato_=13990
Frazione Lanvario.Servizi Municipio.,Acquedotto di Soprana,http://77.242.187.172/itis/cordar/vedi_risultati2N.php?x=13&y=9&IdCertificato_=11376
CapoluogoFontana di piazza del Municipio,Acquedotto di Sordevolo,http://77.242.187.172/itis/cordar/vedi_risultati2N.php?x=13&y=9&IdCertificato_=14244
Frazione S. GratoFontana di piazza S. Grato,Acquedotto di Sordevolo,http://77.242.187.172/itis/cordar/vedi_risultati2N.php?x=13&y=9&IdCertificato_=4781
CapoluogoServizi igienici del supermercato,Acquedotto di Strona,http://77.242.187.172/itis/cordar/vedi_risultati2N.php?x=13&y=9&IdCertificato_=14281
CapoluogoFontana presso il Teatro,Acquedotto di Strona,http://77.242.187.172/itis/cordar/vedi_risultati2N.php?x=13&y=9&IdCertificato_=14290
Frazione QuarioPozzetto,Acquedotto di Strona,http://77.242.187.172/itis/cordar/vedi_risultati2N.php?x=13&y=9&IdCertificato_=14431
Fraz. CAPPIORubinetto pensile,Acquedotto di Strona,http://77.242.187.172/itis/cordar/vedi_risultati2N.php?x=13&y=9&IdCertificato_=5874
Fraz. FoglioPozzetto,Acquedotto di Strona,http://77.242.187.172/itis/cordar/vedi_risultati2N.php?x=13&y=9&IdCertificato_=14294
Fraz. Piana BoeroPozzetto.,Acquedotto di Strona,http://77.242.187.172/itis/cordar/vedi_risultati2N.php?x=13&y=9&IdCertificato_=12517
Fraz. CaligarisPozzetto,Acquedotto di Strona,http://77.242.187.172/itis/cordar/vedi_risultati2N.php?x=13&y=9&IdCertificato_=13989
Frazione FoglioRubinetto esterno.,Acquedotto di Strona,http://77.242.187.172/itis/cordar/vedi_risultati2N.php?x=13&y=9&IdCertificato_=12107
Frazione Gronda.Rubinetto pozzetto.,Acquedotto di Strona,http://77.242.187.172/itis/cordar/vedi_risultati2N.php?x=13&y=9&IdCertificato_=13826
Frazione Prina.Fontana lavatoio.,Acquedotto di Strona,http://77.242.187.172/itis/cordar/vedi_risultati2N.php?x=13&y=9&IdCertificato_=13827
Capoluogofontana Municipio,Acquedotto di Ternengo,http://77.242.187.172/itis/cordar/vedi_risultati2N.php?x=13&y=9&IdCertificato_=13568
Fraz. Villafontana pubblica,Acquedotto di Ternengo,http://77.242.187.172/itis/cordar/vedi_risultati2N.php?x=13&y=9&IdCertificato_=13855
Fraz Valserafontana pubblica,Acquedotto di Ternengo,http://77.242.187.172/itis/cordar/vedi_risultati2N.php?x=13&y=9&IdCertificato_=13858
CapoluogoServizi igienici del Municipio,Acquedotto di Tollegno,http://77.242.187.172/itis/cordar/vedi_risultati2N.php?x=13&y=9&IdCertificato_=14243
Capoluogo.Fontana Municipio.,Acquedotto di Tollegno,http://77.242.187.172/itis/cordar/vedi_risultati2N.php?x=13&y=9&IdCertificato_=14314
Capoluogo.Fontana del campo sportivo.,Acquedotto di Tollegno,http://77.242.187.172/itis/cordar/vedi_risultati2N.php?x=13&y=9&IdCertificato_=13969
CapoluogoFontana di via Martiri della Libertà,Acquedotto di Torrazzo,http://77.242.187.172/itis/cordar/vedi_risultati2N.php?x=13&y=9&IdCertificato_=14260
CapoluogoServizi igienici del Municipio,Acquedotto di Valdengo,http://77.242.187.172/itis/cordar/vedi_risultati2N.php?x=13&y=9&IdCertificato_=14289
CapoluogoFontana Cimitero,Acquedotto di Valdengo,http://77.242.187.172/itis/cordar/vedi_risultati2N.php?x=13&y=9&IdCertificato_=14182
CapoluogoServizi igienici del Municipio,Acquedotto di Vallemosso,http://77.242.187.172/itis/cordar/vedi_risultati2N.php?x=13&y=9&IdCertificato_=12313
CapoluogoFontana del condominio Giardino,Acquedotto di Vallemosso,http://77.242.187.172/itis/cordar/vedi_risultati2N.php?x=13&y=9&IdCertificato_=14373
Frazione SimoneCircolo Arci,Acquedotto di Vallemosso,http://77.242.187.172/itis/cordar/vedi_risultati2N.php?x=13&y=9&IdCertificato_=14481
Capoluogo.Servizi igienici scuole elementari.,Acquedotto di Vallemosso,http://77.242.187.172/itis/cordar/vedi_risultati2N.php?x=13&y=9&IdCertificato_=12449
CapoluogoServizi igienici del Municipio,Acquedotto di Veglio,http://77.242.187.172/itis/cordar/vedi_risultati2N.php?x=13&y=9&IdCertificato_=12450
Frazione RomaninaEsercizio privato (concessionaria),Acquedotto di Veglio,http://77.242.187.172/itis/cordar/vedi_risultati2N.php?x=13&y=9&IdCertificato_=11338
CapoluogoFontana del Parco giochi,Acquedotto di Veglio,http://77.242.187.172/itis/cordar/vedi_risultati2N.php?x=13&y=9&IdCertificato_=11041
CapoluogoServizi igienici del Municipio,Acquedotto di Verrone,http://77.242.187.172/itis/cordar/vedi_risultati2N.php?x=13&y=9&IdCertificato_=14439
CapoluogoFontana di Via Comotto,Acquedotto di Vigliano,http://77.242.187.172/itis/cordar/vedi_risultati2N.php?x=13&y=9&IdCertificato_=14445
CapoluogoFontana del Parco giochi,Acquedotto di Vigliano,http://77.242.187.172/itis/cordar/vedi_risultati2N.php?x=13&y=9&IdCertificato_=14444
CapoluogoServizi igienici del Municipio,Acquedotto di Zimone,http://77.242.187.172/itis/cordar/vedi_risultati2N.php?x=13&y=9&IdCertificato_=14261
CapoluogoFontana retro municipio,Acquedotto di Zimone,http://77.242.187.172/itis/cordar/vedi_risultati2N.php?x=13&y=9&IdCertificato_=13837
Capoluogo.Fontana lungo strada.,Acquedotto di Zimone,http://77.242.187.172/itis/cordar/vedi_risultati2N.php?x=13&y=9&IdCertificato_=14514
CapoluogoServizi igienici del Municipio,Acquedotto di Zumaglia,http://77.242.187.172/itis/cordar/vedi_risultati2N.php?x=13&y=9&IdCertificato_=14274
CapoluogoFontana di Via Gallo Ditzer,Acquedotto di Zumaglia,http://77.242.187.172/itis/cordar/vedi_risultati2N.php?x=13&y=9&IdCertificato_=5324
CapoluogoServizi igienici dell'ufficio postale.,Acquedotto di Zumaglia,http://77.242.187.172/itis/cordar/vedi_risultati2N.php?x=13&y=9&IdCertificato_=12637
